user_input,retrieved_contexts,response,reference,faithfulness,answer_relevancy,context_precision,context_recall
Sono un utente di una Stazione Appaltante e ho appena ricevuto le nuove credenziali per EmPULIA. Qual è il primo passo che devo compiere dopo aver fatto l'accesso?,"[""Informazioni rilevanti trovate nel Knowledge Graph:\n\n✓ **Entità trovata**: selezione primo livello\n  • Tipo: FunzionalitàPiattaforma\n  • Descrizione: Selezione del tipo di ente di primo livello.\n  • Occorrenze nel testo: 1\n  • Varianti trovate: Selezione Primo Livello\n\n→ **Relazione**: selezione primo livello --[haPrerequisito]--> selezione secondo livello struttura\n  • Dettaglio: Selezione della struttura di secondo livello.\n\n→ **Relazione**: selezione primo livello --[eDescrittoIn]--> iscrizione\n  • Dettaglio: Sezione dell'interfaccia utente per la gestione delle classi di iscrizione (Forniture/Servizi)."", ""--- Testo Originale dalle Guide per Contesto Aggiuntivo ---\n\nFonte: SA_Registrazione_gestione_utente.pdf - Pagina 6 - Sezione 'REGISTRAZIONE UTENTE PA'\n```\nAmministrazioni ed enti regionali Aziende e istituti del SSR Istituti di istruzione scolastica e universitaria Amministrazioni, enti, aziende, consorzi e società di enti locali Altri Enti Dopo aver selezionato il primo livello si può applicare il filtro relativo al Secondo livello Struttura , scegliendo tra quelli disponibili nell’elenco. L’elenco delle strutture di secondo livello cambia in base alla struttura di primo livello selezionata. Infine, in Ente si selezionerà, dalla lista ottenuta in base ai filtri applicati sui livelli precedenti, l’Ente di appartenenza. Nell’elenco sono riportati tutti gli Enti profilati ed abilitati ad operare in piattaforma. Cliccando sul comando Continua si passa allo STEP2.\n```\n\nFonte: GuidaRapidaMigrazioneOperatoriEconomici.pdf - Pagina 10 - Sezione 'None'\n```\nLe modifiche dovranno essere Sulla nuova piattaforma sono previsti tre diversi Albi Fornitori: Sulla nuova piattaforma sono previsti tre diversi Albi Fornitori: L’albo delle imprese che sulla vecchia piattaforma era unico, è dunque stato diviso in due: Forniture/Servizi e Le abilitazioni sono state migrate sulla base delle categorie selezionate: L’albo delle imprese che sulla vecchia piattaforma era unico, è dunque stato diviso in due: Forniture/Servizi e Le abilitazioni sono state migrate sulla base delle categorie selezionate: Se eri abilitato solo su categorie di beni/servizi, ora sarai abilitato sull’Albo Forniture e Servizi Se eri abilitato solo su categorie di beni/servizi, ora sarai abilitato sull’Albo Forniture e Servizi Se eri abilitato solo su categorie SOA, ora sarai abilitato sull’Albo dei Lavori Pubblici Se eri abilitato solo su categorie SOA, ora sarai abilitato sull’Albo dei Lavori Pubblici Se eri abilitato sia su categorie di beni/servizi che SOA, ora sarai abilitato su entrambi gli Albi Se eri abilitato sia su categorie di beni/servizi che SOA, ora sarai abilitato su entrambi gli AlbiRicordacheorasonodue Albi totalmenteseparati, con statie scadenzeeventualmentedifferentiRicordacheorasonodue Albi totalmenteseparati, con statie scadenzeeventualmentedifferenti Verifica le categorie per le quali sei attualmente abilitato, entrando in Anagrafica , e poi in Classi di iscrizione (per Forniture/Servizi) o Categorie SOA (per Lavori Pubblici) L’albero delle categorie non ha subito variazioni sulla nuova piattaforma Verifica le categorie per le quali sei attualmente abilitato, entrando in Anagrafica , e poi in Classi di iscrizione (per Forniture/Servizi) o Categorie SOA (per Lavori Pubblici) L’albero delle categorie non ha subito variazioni sulla nuova piattaforma Ricorda che – a partire dal tuo prossimo rinnovo all’Albo - sulla nuova piattaforma sarà richiesto di selezionare le categorie di massimo dettaglio e non sarà più possible scegliere nodi intermedi di categorie Ricorda che – a partire dal tuo prossimo rinnovo all’Albo - sulla nuova piattaforma sarà richiesto di selezionare le categorie di massimo dettaglio e non sarà più possible scegliere nodi intermedi di categorie Sarai comunque ricercabile ed invitabile a gare per le categorie di tuo interesse anche se al momento sei abilitato a  categorie di livello intermedio! Sarai comunque ricercabile ed invitabile a gare per le categorie di tuo interesse anche se al momento sei abilitato a  categorie di livello intermedio! Per le aziende migrate la data di scadenza del primo rinnovo è fissata d’ufficio al 31/12/2023 Per le aziende migrate la data di scadenza del primo rinnovo è fissata d’ufficio al 31/12/2023 SELEZIONABILI SELEZIONABILIEsempioEsempio Per creare un nuovo utente fai una nuova Per creare un nuovo utente fai una nuova p.iva dell’azienda già registrata e negli step successive inserisci i dati del nuovo utente. In questa fase non sarà possibile variare i dati anagrafici precaricati.\n```""]","Dopo aver effettuato l'accesso con le nuove credenziali EmPULIA, il primo passo da compiere è **selezionare il tipo di ente di primo livello** a cui appartiene la tua Stazione Appaltante. Questo passaggio è fondamentale per poter poi filtrare e selezionare correttamente la struttura di secondo livello e, infine, l'Ente di appartenenza.","Dopo aver effettuato il primo accesso con le nuove credenziali, il primo passo obbligatorio è il cambio della password. Questa azione si trova nella 'Lista attività' ed è definita come un' 'Attività Bloccante', il che significa che non potrai usare altre funzionalità finché non l'avrai completata.",0.75,0.9099381935612163,0.0,0.0
Come si attiva e si inizia a personalizzare il DGUE strutturato per una gara?,"[""Informazioni rilevanti trovate nel Knowledge Graph:\n\n✓ **Entità trovata**: dgue\n  • Tipo: FunzionalitàPiattaforma\n  • Descrizione: Funzionalità di configurazione del DGUE all'interno della piattaforma EmPULIA.\n  • Occorrenze nel testo: 42\n  • Varianti trovate: Configurazione del DGUE, SALVATAGGIO DEL DGUE, DGUE...\n\n→ **Relazione**: dgue --[siApplicaA]--> albo fornitori\n  • Dettaglio: Albo dei fornitori presente sulla piattaforma EmPULIA.\n\n→ **Relazione**: dgue --[siApplicaA]--> sistema dinamico acquisizione (sda)\n  • Dettaglio: Sistema di acquisizione dinamico.\n\n→ **Relazione**: dgue --[siApplicaA]--> spunta blu\n  • Dettaglio: Spunta blu sotto la colonna 'Selezionato'.\n\n→ **Relazione**: dgue --[contieneElemento]--> documento\n  • Dettaglio: La documentazione di gara.\n\n→ **Relazione**: dgue --[haPrerequisito]--> strutturato\n  • Dettaglio: Parametro di configurazione per la compilazione del DGUE.\n\n→ **Relazione**: dgue --[haPrerequisito]--> dgue\n  • Dettaglio: Funzionalità di configurazione del DGUE all'interno della piattaforma EmPULIA.\n\n→ **Relazione**: dgue --[haCampo]--> busta amministrativa\n  • Dettaglio: Contenitore di documenti amministrativi.\n\n→ **Relazione**: dgue --[haCampo]--> dgue\n  • Dettaglio: Funzionalità di configurazione del DGUE all'interno della piattaforma EmPULIA.\n\n→ **Relazione**: dgue --[rimandaA]--> dgue\n  • Dettaglio: Funzionalità di configurazione del DGUE all'interno della piattaforma EmPULIA.\n\n→ **Relazione**: dgue --[includeOperazione]--> documento\n  • Dettaglio: La documentazione di gara.\n\n→ **Relazione**: dgue --[eEseguitaDa]--> fornitore\n  • Dettaglio: Utente registrato sulla piattaforma EmPULIA.\n\n→ **Relazione**: dgue --[puoEseguire]--> fornitore\n  • Dettaglio: Utente registrato sulla piattaforma EmPULIA.\n\n→ **Relazione**: dgue --[haSottoFunzionalita]--> modulo\n  • Dettaglio: Modulo del DGUE.\n\n→ **Relazione**: dgue --[haSottoFunzionalita]--> informazione obbligatoria\n  • Dettaglio: Informazioni obbligatorie da inserire nel DGUE.\n\n→ **Relazione**: dgue --[haSottoFunzionalita]--> informazione facoltativa\n  • Dettaglio: Informazioni facoltative da inserire nel DGUE.\n\n→ **Relazione**: dgue --[riguarda]--> mandataria\n  • Dettaglio: Ruolo di mandataria.\n\n→ **Relazione**: dgue --[riguarda]--> mandante\n  • Dettaglio: Ruolo di mandante."", '--- Testo Originale dalle Guide per Contesto Aggiuntivo ---\n\nFonte: SA_ConfigurazioneDGUE.pdf - Pagina 3 - Sezione \'SALVATAGGIO DEL DGUE\'\n```\nManuale SA | Configurazione del DGUE Manuale SA | Configurazione del DGUE Pubblica Amministrazione Stazione Appaltante Operatore Economico Offerta economicamente più vantaggiosa Prezzo più basso (minor prezzo) Raggruppamento temporaneo di imprese Responsabile del Procedimento Procedura di aggiudicazione Sistema Dinamico di Acquisizione Richiesta di Offerta\n```\n\nFonte: SA_ConfigurazioneDGUE.pdf - Pagina 4 - Sezione \'DETTAGLIO DEI MODULI DA COMPLETARE\'\n```\nManuale SA | Configurazione del DGUE Manuale SA | Configurazione del DGUE Il DGUE (Documento di Gara Unico Europeo) elettronico consiste in un modello auto dichiarativo, sviluppato sulla base di uno standard europeo, con cui l\'Operatore Economico autocertifica il possesso dei requisiti per la partecipazione a gare d’appalto.  L’adozione del DGUE elettronico, che può essere richiesto dalla Stazione Appaltante come documentazione amministrativa, mira a semplificare le procedure di D.Lgs.36/2023. La predisposizione del documento DGUE sulla piattaforma EmPULIA, attivabile per qualsiasi Bando/Invito relativo ad una procedura di gara ed all’abilitazione all’Albo Fornitori  o al Sistema Dinamico di Acquisizione (SDA), consente la compilazione del documento direttamente a Sistema (invece che come documento da allegare separatamente) per gli Operatori Economici, che dovranno compilare tutte le sezioni di loro competenza, scaricare il pdf auto generato, firmarlo digitalmente e ricaricarlo in apposito campo nella busta amministrativa. comando DGUE Strutturato e selezionare SI . La funzionalità non è disponibile nella configurazione di un avviso di manifestazione di interesse, ma sarà presente nella configurazione della successiva fase ad inviti. Se si attiva il DGUE strutturato, tutti gli OE coinvolti nella presentazione dell’offerta (mandataria, mandanti, ausiliarie, imprese esecutrici in caso di consorzi) avranno l’obbligo di compilare, firmare digitalmente e ricaricare il DGUE in piattaforma. Per specializzare il DGUE cliccare su Specializza Modulo DGUE Request Mandataria . Questo passaggio è obbligatorio se si è deciso di attivare il DGUE integrato.\n```\n\nFonte: SA_ConfigurazioneDGUE.pdf - Pagina 5 - Sezione \'SPECIALIZZAZIONE DEL DGUE\'\n```\nManuale SA | Configurazione del DGUE Manuale SA | Configurazione del DGUE pubblicazione della gara. Così facendo, infatti, tutti i valori già definiti (es. lotti, cig, oggetto gara, oggetto lotti ecc.) saranno automaticamente compilati dalla piattaforma. I campi Specializza DGUE Mandanti , Specializza DGUE Ausiliarie e Specializza DGUE Esecutrici consentono di specializzare ulteriormente il DGUE in base al ruolo dell’OE. In assenza di tali specializzazioni, mandanti, ausiliare ed esecutrici avranno da compilare un modello DGUE identico a quello previsto per la mandataria. seguito per la mandataria. Entrando in Specializza modulo DGUE Request Mandataria , è possibile personalizzare il template proposto, includendo/escludendo determinati moduli e inserendo le informazioni obbligatorie e/o facoltative mancanti.\n```\n\nFonte: SA_ConfigurazioneDGUE.pdf - Pagina 6 - Sezione \'DETTAGLIO DEI MODULI DA COMPLETARE\'\n```\nManuale SA | Configurazione del DGUE Manuale SA | Configurazione del DGUE La struttura del DGUE strutturato su EmPULIA è conforme a quanto riportato nelle Regole Tecniche dedicate ai commenti. Alcune Parti, Sezioni e Moduli Richieste sono obbligatorie e non possono essere rimosse. Quelle che presentano la spunta blu, sotto la colonna Selezionato , invece possono essere disattivate o riattivate dalla SA a seconda della loro pertinenza con la gara che si sta pubblicando.\n```\n\nFonte: GuidaRapidaMigrazioneOperatoriEconomici.pdf - Pagina 7 - Sezione \'None\'\n```\nFORNITORI Se sei già registrato come fornitore sulla piattaforma EmPULIA, la tua utenza è stata migrata anche sulla nuova piattaforma Se sei già registrato come fornitore sulla piattaforma EmPULIA, la tua utenza è stata migrata anche sulla nuova piattaforma Hai dunque ricevuto via email la terna di Password) che saranno valide solo per la nuova piattaforma Hai dunque ricevuto via email la terna di Password) che saranno valide solo per la nuova piattaforma La vecchia piattaforma sarà accessibile con le consuete modalità che già utilizzi La vecchia piattaforma sarà accessibile con le consuete modalità che già utilizzi Entra nella nuova piattaforma utilizzando la terna di credenziali che hai ricevuto Entra nella nuova piattaforma utilizzando la terna di credenziali che hai ricevuto Segui i passaggi descritti di seguito per poter essere subito operativo anche sulla nuova piattafoma Segui i passaggi descritti di seguito per poter essere subito operativo anche sulla nuova piattafoma password rispettando i criteri di sicurezza richiesti ed elencati password rispettando i criteri di sicurezza richiesti ed elencati Le procedure pubblicate sulla vecchia piattaforma saranno accessibili con le precedenti modalità. Le procedure pubblicate sulla vecchia piattaforma saranno accessibili con le precedenti modalità. Tuttavia ricorda che potrebbe essere necessario o utile effettuare alcune ulteriori operazioni, descritte di seguito Tuttavia ricorda che potrebbe essere necessario o utile effettuare alcune ulteriori operazioni, descritte di seguito Accertati che i dati di contatto (telefono e/o email) della tua utenza siano corretti. Clicca su Utente in alto a destra Accertati che i dati di contatto (telefono e/o email) della tua utenza siano corretti. Clicca su Utente in alto a destra Controlla i dati ed eventualmente clicca su numeri di telefono. Controlla i dati ed eventualmente clicca su numeri di telefono. Accertati che i dati (es. Telefono) della tua azienda siano corretti. Clicca su Anagrafica in alto a destra Accertati che i dati (es. Telefono) della tua azienda siano corretti. Clicca su Anagrafica in alto a destra Controlla i dati ed eventualmente clicca su fax e sito web Controlla i dati ed eventualmente clicca su fax e sito web P.IVA, forma giuridica, sedi ecc.) entra dal menu di sinistra in P.IVA, forma giuridica, sedi ecc.) entra dal menu di sinistra in Potrai apportare le modifiche richieste, ma tali modifiche non saranno immediatamente operative. Infatti ti verrà richiesto di generare un pdf con digitalmente e di riallegarlo firmato. Clicca su Invia al termine. Le modifiche dovranno essere Potrai apportare le modifiche richieste, ma tali modifiche non saranno immediatamente operative. Infatti ti verrà richiesto di generare un pdf con digitalmente e di riallegarlo firmato. Clicca su Invia al termine.\n```\n\nFonte: SA_ConfigurazioneDGUE.pdf - Pagina 7 - Sezione \'SPECIALIZZAZIONE FACOLTATIVA DI ALTRI MODULI\'\n```\nManuale SA | Configurazione del DGUE Manuale SA | Configurazione del DGUE Se si disattiva una Parte, vengono disabilitate anche le Sezioni ed i Moduli Richieste relativi; se si disattiva una Sezione, vengono disabilitati tutti i Moduli Richieste relativi. Altrimenti si può procedere alla ATTENZIONE : se le sezioni/moduli vengono lasciati attivi, al fornitore potrebbe venir richiesta la compilazione obbligatoria delle risposte per quei moduli. Pertanto, si segnala l’opportunità di disattivare sezioni/moduli non pertinenti o per le quali non interessa conoscere il dato ai fini della gara in composizione. La colonna Indice fa riferimento all’indice previsto dalla tassonomia AGID La colonna Tipologia indica se si tratta di Parte, Sezione o Modulo Richiesta. La colonna Descrizione contiene la descrizione prevista secondo tassonomia AGID. Nella colonna Esito Riga vengono visualizzate icone rosse o verdi in prossimità delle informazioni che richiedono un inserimento di dati obbligatori da parte della Stazione Appaltante. Il bollino rosso indica che una o più informazioni obbligatorie non sono presenti ed andranno compilate dalla SA cliccando sulla lente in corrispondenza della colonna Apri (vedi immagine precedente). In particolare, in prossimità delle informazioni relative a Identità del committente , l’icona risulta essere già verde in quanto le informazioni vengono ereditate in automatico dalla gara. singoli Moduli Richieste, ed in particolare per: Visualizzare l’anteprima della domanda posta al fornitore; Completare informazioni mancanti non obbligatorie o specificare criteri minimi di selezione (es. fatturato, numero di referenze, abilitazioni o certificazioni ecc.) richiesti. Con riferimento ai valori relativi ai criteri minimi di selezione, che la SA dovrebbe specificare modulo per modulo, si segnala che la piattaforma consente comunque la non definizione degli stessi all’interno del DGUE strutturato, riportando la precisazione: Se il Requisito minimo non è valorizzato far riferimento alla documentazione di gara. Tale impostazione semplifica la compilazione del DGUE per la SA, rendendo di chiaramente riportati nella documentazione di gara.\n```\n\nFonte: GuidaRapidaMigrazioneOperatoriEconomici.pdf - Pagina 10 - Sezione \'None\'\n```\nLe modifiche dovranno essere Sulla nuova piattaforma sono previsti tre diversi Albi Fornitori: Sulla nuova piattaforma sono previsti tre diversi Albi Fornitori: L’albo delle imprese che sulla vecchia piattaforma era unico, è dunque stato diviso in due: Forniture/Servizi e Le abilitazioni sono state migrate sulla base delle categorie selezionate: L’albo delle imprese che sulla vecchia piattaforma era unico, è dunque stato diviso in due: Forniture/Servizi e Le abilitazioni sono state migrate sulla base delle categorie selezionate: Se eri abilitato solo su categorie di beni/servizi, ora sarai abilitato sull’Albo Forniture e Servizi Se eri abilitato solo su categorie di beni/servizi, ora sarai abilitato sull’Albo Forniture e Servizi Se eri abilitato solo su categorie SOA, ora sarai abilitato sull’Albo dei Lavori Pubblici Se eri abilitato solo su categorie SOA, ora sarai abilitato sull’Albo dei Lavori Pubblici Se eri abilitato sia su categorie di beni/servizi che SOA, ora sarai abilitato su entrambi gli Albi Se eri abilitato sia su categorie di beni/servizi che SOA, ora sarai abilitato su entrambi gli AlbiRicordacheorasonodue Albi totalmenteseparati, con statie scadenzeeventualmentedifferentiRicordacheorasonodue Albi totalmenteseparati, con statie scadenzeeventualmentedifferenti Verifica le categorie per le quali sei attualmente abilitato, entrando in Anagrafica , e poi in Classi di iscrizione (per Forniture/Servizi) o Categorie SOA (per Lavori Pubblici) L’albero delle categorie non ha subito variazioni sulla nuova piattaforma Verifica le categorie per le quali sei attualmente abilitato, entrando in Anagrafica , e poi in Classi di iscrizione (per Forniture/Servizi) o Categorie SOA (per Lavori Pubblici) L’albero delle categorie non ha subito variazioni sulla nuova piattaforma Ricorda che – a partire dal tuo prossimo rinnovo all’Albo - sulla nuova piattaforma sarà richiesto di selezionare le categorie di massimo dettaglio e non sarà più possible scegliere nodi intermedi di categorie Ricorda che – a partire dal tuo prossimo rinnovo all’Albo - sulla nuova piattaforma sarà richiesto di selezionare le categorie di massimo dettaglio e non sarà più possible scegliere nodi intermedi di categorie Sarai comunque ricercabile ed invitabile a gare per le categorie di tuo interesse anche se al momento sei abilitato a  categorie di livello intermedio! Sarai comunque ricercabile ed invitabile a gare per le categorie di tuo interesse anche se al momento sei abilitato a  categorie di livello intermedio! Per le aziende migrate la data di scadenza del primo rinnovo è fissata d’ufficio al 31/12/2023 Per le aziende migrate la data di scadenza del primo rinnovo è fissata d’ufficio al 31/12/2023 SELEZIONABILI SELEZIONABILIEsempioEsempio Per creare un nuovo utente fai una nuova Per creare un nuovo utente fai una nuova p.iva dell’azienda già registrata e negli step successive inserisci i dati del nuovo utente. In questa fase non sarà possibile variare i dati anagrafici precaricati.\n```\n\nFonte: SA_Preselettiva_Ristretta_Manifestazione.pdf - Pagina 22 - Sezione \'CREAZIONE FASE PRESELETTIVA DI GARA RISTRETTA\'\n```\nIn particolare, in tale sezione è possibile: prevedere e specializzare il documento DGUE, l\'autodichiarazione standardizzata a livello europeo, relativa al possesso dei requisiti di carattere generale e speciale, richiesta agli operatori economici che partecipano alla procedura di gara; predisporre tutta la documentazione amministrativa. Per consentire la compilazione del DGUE (Documento di Gara Unico Europeo) agli Operatori Economici direttamente a sistema (invece che come documento da allegare separatamente), in fase di Strutturato e selezionare ""si"". Per maggiori informazioni sulla configurazione e gestione del DGUE strutturato, si faccia riferimento al manuale dedicato. È possibile poi predisporre la documentazione amministrativa attraverso due modalità: cliccare sul comando Inserisci Documento e, nella schermata che verrà mostrata, selezionare la tipologia di documentazione richiesta tra quelle proposte cliccando sull’icona del carrello:\n```']","Per attivare e iniziare a personalizzare il DGUE strutturato per una gara sulla piattaforma EmPULIA, segui questi passaggi:

1.  **Attivazione del DGUE Strutturato:** Durante la configurazione del bando/invito relativo a una procedura di gara, all’abilitazione all’Albo Fornitori o al Sistema Dinamico di Acquisizione (SDA), seleziona ""SI"" in corrispondenza del comando ""DGUE Strutturato"". Questo permette agli Operatori Economici di compilare il DGUE direttamente sulla piattaforma, invece di allegare un documento separato.

2.  **Specializzazione del DGUE:** Dopo aver attivato il DGUE strutturato, clicca su ""Specializza Modulo DGUE Request Mandataria"". Questo passaggio è obbligatorio se si è deciso di attivare il DGUE integrato.

3.  **Personalizzazione del Template:** Entrando in ""Specializza modulo DGUE Request Mandataria"", puoi personalizzare il template proposto, includendo/escludendo determinati moduli e inserendo le informazioni obbligatorie e/o facoltative mancanti.

4.  **Specializzazione per Ruolo OE (Facoltativo):** Utilizza i campi ""Specializza DGUE Mandanti"", ""Specializza DGUE Ausiliarie"" e ""Specializza DGUE Esecutrici"" per specializzare ulteriormente il DGUE in base al ruolo dell’Operatore Economico. In assenza di tali specializzazioni, mandanti, ausiliarie ed esecutrici avranno da compilare un modello DGUE identico a quello previsto per la mandataria.

5.  **Gestione dei Moduli:**
    *   Le Parti, Sezioni e Moduli Richieste obbligatorie non possono essere rimosse.
    *   Le sezioni/moduli che presentano la spunta blu sotto la colonna ""Selezionato"" possono essere disattivate o riattivate a seconda della loro pertinenza con la gara. Disattivando una Parte, vengono disabilitate anche le Sezioni ed i Moduli Richieste relativi; se si disattiva una Sezione, vengono disabilitati tutti i Moduli Richieste relativi.
    *   Disattiva sezioni/moduli non pertinenti o per le quali non interessa conoscere il dato ai fini della gara. Altrimenti, se le sezioni/moduli vengono lasciati attivi, al fornitore potrebbe venir richiesta la compilazione obbligatoria delle risposte per quei moduli.

6.  **Informazioni Obbligatorie:** Controlla la colonna ""Esito Riga"" per individuare le informazioni obbligatorie mancanti (indicate con un bollino rosso) e compilale cliccando sulla lente in corrispondenza della colonna ""Apri"". Le informazioni relative a ""Identità del committente"" vengono ereditate automaticamente dalla gara.

7.  **Criteri Minimi di Selezione:** Puoi specificare i criteri minimi di selezione per i singoli Moduli Richieste (es. fatturato, numero di referenze, abilitazioni o certificazioni ecc.). In alternativa, puoi lasciare non valorizzato il requisito minimo, riportando la precisazione: ""Se il Requisito minimo non è valorizzato far riferimento alla documentazione di gara"".

**Importante:**

*   Dopo la compilazione del DGUE da parte degli Operatori Economici, questi dovranno scaricare il PDF autogenerato, firmarlo digitalmente e ricaricarlo nell'apposito campo nella busta amministrativa.
*   Se si attiva il DGUE strutturato, tutti gli OE coinvolti nella presentazione dell’offerta (mandataria, mandanti, ausiliarie, imprese esecutrici in caso di consorzi) avranno l’obbligo di compilare, firmare digitalmente e ricaricare il DGUE in piattaforma.
*   Assicurati che i valori già definiti (es. lotti, cig, oggetto gara, oggetto lotti ecc.) siano automaticamente compilati dalla piattaforma pubblicando la gara.

Seguendo questi passaggi, potrai attivare e personalizzare il DGUE strutturato per la tua gara sulla piattaforma EmPULIA.","Per attivare il DGUE strutturato, devi andare nella sezione 'Busta Documentazione' durante la configurazione della gara e selezionare 'SI' al comando 'DGUE Strutturato'. Dopo l'attivazione, per iniziare la personalizzazione, è obbligatorio cliccare su 'Specializza Modulo DGUE Request Mandataria'.",1.0,0.9503576100074209,0.49999999995,0.5
"È obbligatorio compilare tutti i moduli e le sezioni del DGUE, o posso disattivarne alcuni?","[""Informazioni rilevanti trovate nel Knowledge Graph:\n\n→ **Relazione**: dgue --[haPrerequisito]--> strutturato\n  • Dettaglio: Parametro di configurazione per la compilazione del DGUE.\n\n→ **Relazione**: dgue --[richiedeDocumento]--> fornitore\n  • Dettaglio: Utente registrato sulla piattaforma EmPULIA.\n\n→ **Relazione**: dgue --[haPrerequisito]--> dgue\n  • Dettaglio: Funzionalità di configurazione del DGUE all'interno della piattaforma EmPULIA.\n\n→ **Relazione**: dgue --[richiedeDocumento]--> bando/invito\n  • Dettaglio: Documento relativo ad una procedura di gara."", '--- Testo Originale dalle Guide per Contesto Aggiuntivo ---\n\nFonte: SA_ConfigurazioneDGUE.pdf - Pagina 3 - Sezione \'SALVATAGGIO DEL DGUE\'\n```\nManuale SA | Configurazione del DGUE Manuale SA | Configurazione del DGUE Pubblica Amministrazione Stazione Appaltante Operatore Economico Offerta economicamente più vantaggiosa Prezzo più basso (minor prezzo) Raggruppamento temporaneo di imprese Responsabile del Procedimento Procedura di aggiudicazione Sistema Dinamico di Acquisizione Richiesta di Offerta\n```\n\nFonte: SA_ConfigurazioneDGUE.pdf - Pagina 4 - Sezione \'DETTAGLIO DEI MODULI DA COMPLETARE\'\n```\nManuale SA | Configurazione del DGUE Manuale SA | Configurazione del DGUE Il DGUE (Documento di Gara Unico Europeo) elettronico consiste in un modello auto dichiarativo, sviluppato sulla base di uno standard europeo, con cui l\'Operatore Economico autocertifica il possesso dei requisiti per la partecipazione a gare d’appalto.  L’adozione del DGUE elettronico, che può essere richiesto dalla Stazione Appaltante come documentazione amministrativa, mira a semplificare le procedure di D.Lgs.36/2023. La predisposizione del documento DGUE sulla piattaforma EmPULIA, attivabile per qualsiasi Bando/Invito relativo ad una procedura di gara ed all’abilitazione all’Albo Fornitori  o al Sistema Dinamico di Acquisizione (SDA), consente la compilazione del documento direttamente a Sistema (invece che come documento da allegare separatamente) per gli Operatori Economici, che dovranno compilare tutte le sezioni di loro competenza, scaricare il pdf auto generato, firmarlo digitalmente e ricaricarlo in apposito campo nella busta amministrativa. comando DGUE Strutturato e selezionare SI . La funzionalità non è disponibile nella configurazione di un avviso di manifestazione di interesse, ma sarà presente nella configurazione della successiva fase ad inviti. Se si attiva il DGUE strutturato, tutti gli OE coinvolti nella presentazione dell’offerta (mandataria, mandanti, ausiliarie, imprese esecutrici in caso di consorzi) avranno l’obbligo di compilare, firmare digitalmente e ricaricare il DGUE in piattaforma. Per specializzare il DGUE cliccare su Specializza Modulo DGUE Request Mandataria . Questo passaggio è obbligatorio se si è deciso di attivare il DGUE integrato.\n```\n\nFonte: GuidaRapidaMigrazioneOperatoriEconomici.pdf - Pagina 7 - Sezione \'None\'\n```\nFORNITORI Se sei già registrato come fornitore sulla piattaforma EmPULIA, la tua utenza è stata migrata anche sulla nuova piattaforma Se sei già registrato come fornitore sulla piattaforma EmPULIA, la tua utenza è stata migrata anche sulla nuova piattaforma Hai dunque ricevuto via email la terna di Password) che saranno valide solo per la nuova piattaforma Hai dunque ricevuto via email la terna di Password) che saranno valide solo per la nuova piattaforma La vecchia piattaforma sarà accessibile con le consuete modalità che già utilizzi La vecchia piattaforma sarà accessibile con le consuete modalità che già utilizzi Entra nella nuova piattaforma utilizzando la terna di credenziali che hai ricevuto Entra nella nuova piattaforma utilizzando la terna di credenziali che hai ricevuto Segui i passaggi descritti di seguito per poter essere subito operativo anche sulla nuova piattafoma Segui i passaggi descritti di seguito per poter essere subito operativo anche sulla nuova piattafoma password rispettando i criteri di sicurezza richiesti ed elencati password rispettando i criteri di sicurezza richiesti ed elencati Le procedure pubblicate sulla vecchia piattaforma saranno accessibili con le precedenti modalità. Le procedure pubblicate sulla vecchia piattaforma saranno accessibili con le precedenti modalità. Tuttavia ricorda che potrebbe essere necessario o utile effettuare alcune ulteriori operazioni, descritte di seguito Tuttavia ricorda che potrebbe essere necessario o utile effettuare alcune ulteriori operazioni, descritte di seguito Accertati che i dati di contatto (telefono e/o email) della tua utenza siano corretti. Clicca su Utente in alto a destra Accertati che i dati di contatto (telefono e/o email) della tua utenza siano corretti. Clicca su Utente in alto a destra Controlla i dati ed eventualmente clicca su numeri di telefono. Controlla i dati ed eventualmente clicca su numeri di telefono. Accertati che i dati (es. Telefono) della tua azienda siano corretti. Clicca su Anagrafica in alto a destra Accertati che i dati (es. Telefono) della tua azienda siano corretti. Clicca su Anagrafica in alto a destra Controlla i dati ed eventualmente clicca su fax e sito web Controlla i dati ed eventualmente clicca su fax e sito web P.IVA, forma giuridica, sedi ecc.) entra dal menu di sinistra in P.IVA, forma giuridica, sedi ecc.) entra dal menu di sinistra in Potrai apportare le modifiche richieste, ma tali modifiche non saranno immediatamente operative. Infatti ti verrà richiesto di generare un pdf con digitalmente e di riallegarlo firmato. Clicca su Invia al termine. Le modifiche dovranno essere Potrai apportare le modifiche richieste, ma tali modifiche non saranno immediatamente operative. Infatti ti verrà richiesto di generare un pdf con digitalmente e di riallegarlo firmato. Clicca su Invia al termine.\n```\n\nFonte: SA_Preselettiva_Ristretta_Manifestazione.pdf - Pagina 22 - Sezione \'CREAZIONE FASE PRESELETTIVA DI GARA RISTRETTA\'\n```\nIn particolare, in tale sezione è possibile: prevedere e specializzare il documento DGUE, l\'autodichiarazione standardizzata a livello europeo, relativa al possesso dei requisiti di carattere generale e speciale, richiesta agli operatori economici che partecipano alla procedura di gara; predisporre tutta la documentazione amministrativa. Per consentire la compilazione del DGUE (Documento di Gara Unico Europeo) agli Operatori Economici direttamente a sistema (invece che come documento da allegare separatamente), in fase di Strutturato e selezionare ""si"". Per maggiori informazioni sulla configurazione e gestione del DGUE strutturato, si faccia riferimento al manuale dedicato. È possibile poi predisporre la documentazione amministrativa attraverso due modalità: cliccare sul comando Inserisci Documento e, nella schermata che verrà mostrata, selezionare la tipologia di documentazione richiesta tra quelle proposte cliccando sull’icona del carrello:\n```']","La risposta dipende dalla configurazione del DGUE impostata dalla Stazione Appaltante.

*   **Se il DGUE strutturato è attivo:** tutti gli Operatori Economici coinvolti (mandataria, mandanti, ausiliarie, imprese esecutrici in caso di consorzi) hanno l'obbligo di compilare, firmare digitalmente e ricaricare il DGUE in piattaforma. In questo caso, non è possibile disattivare sezioni.

*   **Se il DGUE strutturato non è attivo:** (e si tratta di un DGUE ""standard"" da allegare separatamente) la documentazione non fornisce indicazioni esplicite sulla possibilità di disattivare sezioni. Tuttavia, è implicito che l'Operatore Economico debba compilare tutte le sezioni di sua competenza.

In sintesi, **in generale, è necessario compilare tutte le sezioni di competenza dell'Operatore Economico.** La possibilità di ""disattivare"" sezioni non è esplicitamente menzionata e, nel caso di DGUE strutturato, è espressamente vietata.","Non tutti i moduli e le sezioni sono obbligatori. Secondo la guida, alcune 'Parti, Sezioni e Moduli Richieste' sono obbligatorie e non possono essere rimosse. Quelle che invece presentano una spunta blu sotto la colonna 'Selezionato' possono essere disattivate o riattivate dalla Stazione Appaltante (SA) a seconda della loro pertinenza per la gara.",0.8,0.911336486070657,0.0,0.0
Qual è la differenza tra definire un attributo per 'Lotto' e per 'Voce' in un modello di offerta?,"[""Informazioni rilevanti trovate nel Knowledge Graph:\n\n✓ **Entità trovata**: descrizione attributo\n  • Tipo: ParametroConfigurazione\n  • Descrizione: Voci della colonna Descrizione Attributo presenti nella tabella Attributi da usare nelle fasi della gara.\n  • Occorrenze nel testo: 2\n  • Varianti trovate: Descrizione Attributo\n\n→ **Relazione**: descrizione attributo --[riguarda]--> tabella elenco prodotti\n  • Dettaglio: Tabella Elenco Prodotti nella sezione Prodotti / Lotti.\n\n→ **Relazione**: descrizione attributo --[haCampo]--> tabella attributi usare nelle fasi gara\n  • Dettaglio: Tabella per definire gli attributi con le relative caratteristiche e il momento in cui verranno richiesti.\n\n→ **Relazione**: descrizione attributo --[eDescrittoIn]--> introduzione\n  • Dettaglio: La sezione della guida EmPULIA intitolata 'INTRODUZIONE' (ID: SA_ConfigurazioneModelli.pdf_section_2) da cui provengono queste informazioni.\n\n✓ **Entità trovata**: aggiungi attributo\n  • Tipo: ComandoUI\n  • Descrizione: Comando per aggiungere un nuovo attributo.\n  • Occorrenze nel testo: 2\n  • Varianti trovate: Aggiungi Attributo, Aggiungi attributo\n\n→ **Relazione**: aggiungi attributo --[interagisceCon]--> tabella attributi usare nelle fasi gara\n  • Dettaglio: Tabella per definire gli attributi con le relative caratteristiche e il momento in cui verranno richiesti.\n\n→ **Relazione**: aggiungi attributo --[contieneElemento]--> toolbar attributi\n  • Dettaglio: Toolbar sopra alla tabella Attributi da usare nelle fasi della gara.\n\n→ **Relazione**: aggiungi attributo --[eDescrittoIn]--> introduzione\n  • Dettaglio: La sezione della guida EmPULIA intitolata 'INTRODUZIONE' (ID: SA_ConfigurazioneModelli.pdf_section_2) da cui provengono queste informazioni.\n\n✓ **Entità trovata**: attributo gerarchico\n  • Tipo: ParametroConfigurazione\n  • Descrizione: Attributo con struttura gerarchica.\n  • Occorrenze nel testo: 1\n  • Varianti trovate: Attributo Gerarchico\n\n→ **Relazione**: attributo gerarchico --[siApplicaA]--> vedi\n  • Dettaglio: Comando per visualizzare le informazioni di un attributo gerarchico o dominio.\n\n→ **Relazione**: attributo gerarchico --[eDescrittoIn]--> introduzione\n  • Dettaglio: La sezione della guida EmPULIA intitolata 'INTRODUZIONE' (ID: SA_ConfigurazioneModelli.pdf_section_2) da cui provengono queste informazioni.\n\n✓ **Entità trovata**: attributo dominio\n  • Tipo: ParametroConfigurazione\n  • Descrizione: Attributo con scelta multipla tra voci proposte.\n  • Occorrenze nel testo: 1\n  • Varianti trovate: Attributo Dominio\n\n→ **Relazione**: attributo dominio --[siApplicaA]--> vedi\n  • Dettaglio: Comando per visualizzare le informazioni di un attributo gerarchico o dominio.\n\n→ **Relazione**: attributo dominio --[eDescrittoIn]--> introduzione\n  • Dettaglio: La sezione della guida EmPULIA intitolata 'INTRODUZIONE' (ID: SA_ConfigurazioneModelli.pdf_section_2) da cui provengono queste informazioni.\n\n✓ **Entità trovata**: eliminazione attributo\n  • Tipo: AzioneUtente\n  • Descrizione: Azione di eliminare un attributo dal modello.\n  • Occorrenze nel testo: 1\n  • Varianti trovate: Eliminazione Attributo\n\n→ **Relazione**: eliminazione attributo --[riguarda]--> tabella attributi usare nelle fasi gara\n  • Dettaglio: Tabella per definire gli attributi con le relative caratteristiche e il momento in cui verranno richiesti.\n\n→ **Relazione**: eliminazione attributo --[eDescrittoIn]--> introduzione\n  • Dettaglio: La sezione della guida EmPULIA intitolata 'INTRODUZIONE' (ID: SA_ConfigurazioneModelli.pdf_section_2) da cui provengono queste informazioni.\n\n✓ **Entità trovata**: attributo misure\n  • Tipo: ParametroConfigurazione\n  • Descrizione: Esempio di attributo 'Misure'.\n  • Occorrenze nel testo: 1\n  • Varianti trovate: Attributo Misure\n\n→ **Relazione**: attributo misure --[eDescrittoIn]--> introduzione\n  • Dettaglio: La sezione della guida EmPULIA intitolata 'INTRODUZIONE' (ID: SA_ConfigurazioneModelli.pdf_section_2) da cui provengono queste informazioni.\n\n✓ **Entità trovata**: attributo\n  • Tipo: ParametroConfigurazione\n  • Descrizione: Caratteristica di un prodotto o servizio che può essere configurata.\n  • Occorrenze nel testo: 7\n  • Varianti trovate: Attributo\n\n→ **Relazione**: attributo --[siApplicaA]--> lotto\n  • Dettaglio: Informazioni relative ai lotti della gara.\n\n→ **Relazione**: attributo --[siApplicaA]--> tabella prodotti\n  • Dettaglio: Tabella contenente l'elenco dei prodotti o servizi.\n\n→ **Relazione**: attributo --[siApplicaA]--> voce\n  • Dettaglio: Singola riga di prodotto o servizio.\n\n→ **Relazione**: attributo --[inviaDatiA]--> file excel\n  • Dettaglio: File excel da cui possono essere importati dati.\n\n→ **Relazione**: attributo --[haStato]--> attributo lettura\n  • Dettaglio: Attributo visualizzato in sola lettura."", ""--- Testo Originale dalle Guide per Contesto Aggiuntivo ---\n\nFonte: SA_ConfigurazioneDGUE.pdf - Pagina 5 - Sezione 'SPECIALIZZAZIONE DEL DGUE'\n```\nManuale SA | Configurazione del DGUE Manuale SA | Configurazione del DGUE pubblicazione della gara. Così facendo, infatti, tutti i valori già definiti (es. lotti, cig, oggetto gara, oggetto lotti ecc.) saranno automaticamente compilati dalla piattaforma. I campi Specializza DGUE Mandanti , Specializza DGUE Ausiliarie e Specializza DGUE Esecutrici consentono di specializzare ulteriormente il DGUE in base al ruolo dell’OE. In assenza di tali specializzazioni, mandanti, ausiliare ed esecutrici avranno da compilare un modello DGUE identico a quello previsto per la mandataria. seguito per la mandataria. Entrando in Specializza modulo DGUE Request Mandataria , è possibile personalizzare il template proposto, includendo/escludendo determinati moduli e inserendo le informazioni obbligatorie e/o facoltative mancanti.\n```\n\nFonte: SA_ConfigurazioneModelli.pdf - Pagina 7 - Sezione 'INTRODUZIONE'\n```\nVerrà mostrata una schermata nella quale è presente una toolbar con una serie di comandi per la gestione del documento: Salva: permette di salvare la personalizzazione del modello per poterlo riprendere in un secondo momento (cliccando sempre sul comando Apri dettagli modello , viene riproposta sempre l’ultima versione salvata); Conferma: applica le modifiche apportate al modello; per un altro utente registrato ed abilitato alla gestione dello stesso sulla gara; un altro utente registrato ed abilitato alla gestione dello stesso sulla gara; dello stesso sulla gara; Stampa: permette di stampare la pagina visualizzata; Manuale SA | Configurazione del Modello di Offerta Manuale SA | Configurazione del Modello di Offerta Vers.2 Esporta in XML: permette di esportare le informazioni contenute sulla pagina in formato XML; Chiudi: per tornare alla pagina precedente. Nell’area sottostante verranno visualizzate una serie di informazioni identificative e non editabili quali A seguire, viene invece riportato l’ Ambito di riferimento, precedentemente selezionato nella sezione Prodotti / Lotti e le quattro tabelle che consentono la configurazione del modello, ciascuna con i relativi comandi. In particolare, vengono mostrate le seguenti tabelle , descritte dettagliatamente nei paragrafi successivi: Attributi da usare nelle fasi della gara: nella tabella si definiscono gli attributi con le relative caratteristiche ed il momento in cui verranno richiesti; Calcolo del valore economico: nella tabella viene definito il calcolo sulla base del quale la piattaforma definirà il valore offerto da ciascun offerente; Colonne calcolate: nella tabella verranno definite le formule di calcolo per tutti gli attributi per i quali si è definito di usare un valore calcolato; Vincoli sugli attributi del modello: la tabella permette di configurare eventuali vincoli sugli attributi. Tutte le voci della colonna Descrizione Attributo presenti nella tabella Attributi da usare nelle fasi della gara corrispondono alla denominazione delle singole colonne che compongono la corrispettiva tabella Elenco Prodotti nella sezione Prodotti / Lotti . Manuale SA | Configurazione del Modello di Offerta Manuale SA | Configurazione del Modello di Offerta Vers.2 Sopra alla tabella Attributi da usare nelle fasi della gara , è disponibile una toolbar con alcuni comandi per la gestione della stessa. Aggiungi Attributo Consente l’aggiunta di un nuovo attributo, definito liberamente dall’utente compilatore. L’attributo aggiunto viene aggiunto in fondo alla tabella, può essere spostato e devono essere compilate tutte le relative opzioni; Nascondi e Visualizza I comandi Nascondi e Visualizza permettono di nascondere/visualizzare determinate colonne per semplificare la lettura della tabella. Per visualizzare nuovamente una o tutte le colonne nascoste, cliccare sul comando Visualizza e selezionare la voce desiderata. La colonna selezionata verrà resa nuovamente visibile nella tabella degli attributi.\n```\n\nFonte: SA_ConfigurazioneModelli.pdf - Pagina 8 - Sezione 'INTRODUZIONE'\n```\nManuale SA | Configurazione del Modello di Offerta Manuale SA | Configurazione del Modello di Offerta Vers.2 Esporta in xls Il comando Esporta in xls consente di esportare il modello in un file xlsx per una migliore consultazione dello stesso. Per procedere con il download del file, cliccare quindi sul comando predisposto in alto alla tabella. Giù e Su I comandi consentono di spostare l’ordine delle colonne nella tabella Elenco Prodotti . Il comando Vedi viene mostrato in caso di attributo Gerarchico o Dominio e consente di visualizzare le informazioni che è possibile selezionare tra quelle proposte attraverso, per l’appunto, una struttura gerarchica. Per visualizzare tali informazioni, cliccare sulla lente. Se si vuole eliminare un’informazione presente nella tabella Elenco Prodotti , è necessario aprire il dettaglio del modello attraverso il comando e, nella tabella Attributi da usare nelle fasi della gara Individuata quindi la riga relativa all’attributo da eliminare, cliccare sulla corrispettiva icona del bidone. Ad esempio, se il modello selezionato per la gara prevede l’attributo “Misure”, che nella procedura specifica non si intende richiedere ai partecipanti, si dovrà rimuoverlo dal dettaglio del modello. Ci sono alcuni attributi che non potranno comunque essere rimossi. Nella colonna Attributo , viene indicata la tipologia dell’informazione che verrà richiesta al RUP o all’OE nelle diverse fasi: Text: informazioni di tipo testuale; Number: informazioni di tipo numerico (es. quantità o prezzo); si precisa che per i campi di tipo numerico intero non viene richiesto di specificare il numero di decimali. Attach: informazioni di tipo allegato; Domain: scelta multipla tra più voci proposte; Gerarchico : informazioni da selezionare tra quelle proposte attraverso una struttura gerarchica. Alcuni attributi sono non editabili come, ad esempio, Text – DESCRIZIONE e Number – QUANTITA , altri invece possono essere personalizzati e quindi appariranno editabili come ad esempio Manuale SA | Configurazione del Modello di Offerta Manuale SA | Configurazione del Modello di Offerta Vers.2 In particolare, per alcuni modelli sono stati previsti degli attributi di tipo Text e Number generici che le stazioni appaltanti possono personalizzare inserendo una descrizione per l’informazione richiesta. Per aggiungere una nuova riga che consente di specializzare un nuovo attributo, cliccare sul comando Aggiungi attributo posizionato sopra alla tabella. In fondo alla tabella Attributi da usare nelle fasi della gara , verrà predisposta una nuova riga per la definizione dell’attributo per il quale dovranno essere compilate le informazioni richieste prestando attenzione a non selezionare attributi già previsti nel modello specifico. Non è consentito l'inserimento di attributi duplicati (es. due “Attach – ALLEGATO 1” nello stesso modello). Nella colonna Descrizione Attributo si potrà indicare il nome dell’attributo che gli utenti visualizzeranno.\n```\n\nFonte: SA_ConfigurazioneModelli.pdf - Pagina 10 - Sezione 'INTRODUZIONE'\n```\nAnche questo valore, per alcuni attributi chiave, potrebbe non essere editabile. Nel caso di un attributo di tipo Numerico verrà abilitato il campo nella colonna Numero Decimali, in cui indicare quanti decimali saranno richiesti (valore tra 0 e 10). Nel caso di un attributo di tipo Allegato verranno abilitati i campi delle colonne Richiedi firma (per definire se il file dovrà essere firmato digitalmente o meno) e Tipo File (per definire le estensioni di file ammesse). Per definire per quali righe della tabella prodotti debba essere richiesto l'attributo con le relative caratteristiche, nella colonna Lotto / Voce effettuare la selezione scegliendo tra: Lotto : l'attributo viene richiesto nelle sole righe che fanno riferimento al lotto (Voce di livello Voce : l'attributo viene richiesto nelle sole righe che fanno riferimento alla voce (Voci di livello 1,2,3 ecc. ); Manuale SA | Configurazione del Modello di Offerta Manuale SA | Configurazione del Modello di Offerta Vers.2 Lotto / Voce : l'attributo viene richiesto nelle righe che fanno riferimento sia alla voce che al lotto. Alcuni esempi: se in un lotto multivoce si vuole ricevere dai partecipanti un documento di specifiche tecniche per ciascuna riga di prodotto, si dovrà configurare “Voce”; se si vuole un’unica relazione tecnica per tutti i prodotti o servizi del listino, indicare “Lotto”. Nelle colonne a seguire , indicare se – per ciascuna colonna- quello che si sta aggiungendo è un Attributo di: Lettura : l'informazione risulterà di sola lettura; Scrittura : l'informazione è editabile ma non obbligatoria; Obbligatorio : l'informazione è da compilare obbligatoriamente; Calcolato : l'informazione è un valore che viene calcolato automaticamente in base a quanto definito dalla Formula impostata e pertanto non è editabile. In particolare, la colonna Bando/Appalto Specifico indica il momento della configurazione della gara da parte del RUP. Quindi se un attributo è ad es. Obbligatorio in Bando/Appalto specifico, significa che l’utente che sta configurando la gara dovrà necessariamente inserirlo, altrimenti il sistema non consentirà la pubblicazione dell’evento. La colonna Attestato di Partecipazione/Cauzione si riferisce il momento in cui l’OE partecipante genera l’eventuale attestato di partecipazione agli specifici lotti per gare multi-lotto (vedi manuale Indizione gara). È previsto l’inserimento di attributi in sola lettura, pertanto il pdf in cui l’OE dichiara a quali lotti intende partecipare conterrà i campi definiti in Lettura. L’utilizzo della colonna è limitato solo ad alcuni attributi. La colonna Offerta Tecnica indica il momento della compilazione della busta tecnica da parte degli OE partecipanti. Si definiranno quindi sotto questa colonna gli elementi tecnici obbligatori o facoltativi Manuale SA | Configurazione del Modello di Offerta Manuale SA | Configurazione del Modello di Offerta Vers.2 richiesti ai fornitori, quali ad es.\n```\n\nFonte: SA_IndizioneProceduraGara_AppaltoSpecifico (1).pdf - Pagina 30 - Sezione 'PRODOTTI'\n```\nSe non si vuole personalizzare il modello, si può usare uno dei modelli standard configurati. I modelli di offerta standard disponibili variano in base al tipo di gara in composizione, al criterio di aggiudicazione, all’ambito selezionato. del modello di gara adottato. In particolare, può variare sensibilmente il numero e la tipologia di Attributi . Per attributo si intende il campo riportato nell’intestazione di ciascuna colonna (ad es. Descrizione, Importo a base d’asta, Quantità ecc.). Gli attributi con l’asterisco saranno da compilare obbligatoriamente. saranno riportati, nelle colonne più a destra, alcuni attributi richiesti da ANAC ai fini dell’interoperabilità. Alcuni di questi valori sono da compilare ex-novo, altri invece saranno popolati sulla base di quanto di un file excel. Inseriti tutti i valori obbligatori o facoltativi riportati nella tabella Elenco Prodotti, cliccando su Verifica informazioni , sarà possibile avere evidenza di eventuali campi non compilati o compilati erroneamente. verde nella colonna Esito Riga . Se previsto per la tipologia di gara selezionata, è possibile aggiungere altre Righe , attraverso il pulsante configurate nel modello. Gli OE partecipanti dovranno dunque compilare tutte le righe configurate (ad es. se la SA intende richiedere un listino prezzi o un computo estimativo).\n```""]","La differenza tra definire un attributo per 'Lotto' e per 'Voce' in un modello di offerta risiede nel livello di granularità a cui l'attributo viene applicato e richiesto:

*   **Attributo a livello di 'Lotto'**: L'attributo viene richiesto una sola volta per l'intero lotto. Questo è appropriato quando l'informazione è comune a tutti gli elementi all'interno del lotto. Ad esempio, una relazione tecnica generale per tutti i prodotti/servizi del lotto.

*   **Attributo a livello di 'Voce'**: L'attributo viene richiesto per ogni singola voce (riga di prodotto/servizio) all'interno del lotto. Questo è appropriato quando l'informazione è specifica per ogni singolo elemento. Ad esempio, le specifiche tecniche dettagliate per ogni singolo prodotto in un lotto multivoce.

In sintesi, la scelta tra 'Lotto' e 'Voce' determina se l'attributo deve essere fornito una volta per l'intero lotto o individualmente per ogni voce all'interno del lotto. La guida EmPULIA (SA\_ConfigurazioneModelli.pdf) spiega chiaramente questa distinzione nella sezione ""INTRODUZIONE"" (pagina 10).","La differenza sta nel livello a cui l'attributo viene applicato. Selezionando 'Lotto', l'attributo viene richiesto una sola volta per l'intero lotto (livello 0), come nel caso di un'unica relazione tecnica per tutti i prodotti. Selezionando 'Voce', l'attributo viene richiesto per ogni singola riga di prodotto o servizio all'interno del lotto (livelli 1, 2, 3, ecc.), ad esempio per richiedere specifiche tecniche per ciascun prodotto.",1.0,0.9999999999999994,0.99999999995,1.0
Ho definito un attributo come 'Calcolato'. Dove e come devo definire la formula matematica che ne determina il valore?,"[""Informazioni rilevanti trovate nel Knowledge Graph:\n\n✓ **Entità trovata**: descrizione attributo\n  • Tipo: ParametroConfigurazione\n  • Descrizione: Voci della colonna Descrizione Attributo presenti nella tabella Attributi da usare nelle fasi della gara.\n  • Occorrenze nel testo: 2\n  • Varianti trovate: Descrizione Attributo\n\n→ **Relazione**: descrizione attributo --[riguarda]--> tabella elenco prodotti\n  • Dettaglio: Tabella Elenco Prodotti nella sezione Prodotti / Lotti.\n\n→ **Relazione**: descrizione attributo --[haCampo]--> tabella attributi usare nelle fasi gara\n  • Dettaglio: Tabella per definire gli attributi con le relative caratteristiche e il momento in cui verranno richiesti.\n\n→ **Relazione**: descrizione attributo --[eDescrittoIn]--> introduzione\n  • Dettaglio: La sezione della guida EmPULIA intitolata 'INTRODUZIONE' (ID: SA_ConfigurazioneModelli.pdf_section_2) da cui provengono queste informazioni.\n\n✓ **Entità trovata**: aggiungi attributo\n  • Tipo: ComandoUI\n  • Descrizione: Comando per aggiungere un nuovo attributo.\n  • Occorrenze nel testo: 2\n  • Varianti trovate: Aggiungi Attributo, Aggiungi attributo\n\n→ **Relazione**: aggiungi attributo --[interagisceCon]--> tabella attributi usare nelle fasi gara\n  • Dettaglio: Tabella per definire gli attributi con le relative caratteristiche e il momento in cui verranno richiesti.\n\n→ **Relazione**: aggiungi attributo --[contieneElemento]--> toolbar attributi\n  • Dettaglio: Toolbar sopra alla tabella Attributi da usare nelle fasi della gara.\n\n→ **Relazione**: aggiungi attributo --[eDescrittoIn]--> introduzione\n  • Dettaglio: La sezione della guida EmPULIA intitolata 'INTRODUZIONE' (ID: SA_ConfigurazioneModelli.pdf_section_2) da cui provengono queste informazioni.\n\n✓ **Entità trovata**: attributo gerarchico\n  • Tipo: ParametroConfigurazione\n  • Descrizione: Attributo con struttura gerarchica.\n  • Occorrenze nel testo: 1\n  • Varianti trovate: Attributo Gerarchico\n\n→ **Relazione**: attributo gerarchico --[siApplicaA]--> vedi\n  • Dettaglio: Comando per visualizzare le informazioni di un attributo gerarchico o dominio.\n\n→ **Relazione**: attributo gerarchico --[eDescrittoIn]--> introduzione\n  • Dettaglio: La sezione della guida EmPULIA intitolata 'INTRODUZIONE' (ID: SA_ConfigurazioneModelli.pdf_section_2) da cui provengono queste informazioni.\n\n✓ **Entità trovata**: attributo dominio\n  • Tipo: ParametroConfigurazione\n  • Descrizione: Attributo con scelta multipla tra voci proposte.\n  • Occorrenze nel testo: 1\n  • Varianti trovate: Attributo Dominio\n\n→ **Relazione**: attributo dominio --[siApplicaA]--> vedi\n  • Dettaglio: Comando per visualizzare le informazioni di un attributo gerarchico o dominio.\n\n→ **Relazione**: attributo dominio --[eDescrittoIn]--> introduzione\n  • Dettaglio: La sezione della guida EmPULIA intitolata 'INTRODUZIONE' (ID: SA_ConfigurazioneModelli.pdf_section_2) da cui provengono queste informazioni.\n\n✓ **Entità trovata**: eliminazione attributo\n  • Tipo: AzioneUtente\n  • Descrizione: Azione di eliminare un attributo dal modello.\n  • Occorrenze nel testo: 1\n  • Varianti trovate: Eliminazione Attributo\n\n→ **Relazione**: eliminazione attributo --[riguarda]--> tabella attributi usare nelle fasi gara\n  • Dettaglio: Tabella per definire gli attributi con le relative caratteristiche e il momento in cui verranno richiesti.\n\n→ **Relazione**: eliminazione attributo --[eDescrittoIn]--> introduzione\n  • Dettaglio: La sezione della guida EmPULIA intitolata 'INTRODUZIONE' (ID: SA_ConfigurazioneModelli.pdf_section_2) da cui provengono queste informazioni.\n\n✓ **Entità trovata**: attributo misure\n  • Tipo: ParametroConfigurazione\n  • Descrizione: Esempio di attributo 'Misure'.\n  • Occorrenze nel testo: 1\n  • Varianti trovate: Attributo Misure\n\n→ **Relazione**: attributo misure --[eDescrittoIn]--> introduzione\n  • Dettaglio: La sezione della guida EmPULIA intitolata 'INTRODUZIONE' (ID: SA_ConfigurazioneModelli.pdf_section_2) da cui provengono queste informazioni.\n\n✓ **Entità trovata**: attributo\n  • Tipo: ParametroConfigurazione\n  • Descrizione: Caratteristica di un prodotto o servizio che può essere configurata.\n  • Occorrenze nel testo: 7\n  • Varianti trovate: Attributo\n\n→ **Relazione**: attributo --[siApplicaA]--> lotto\n  • Dettaglio: Informazioni relative ai lotti della gara.\n\n→ **Relazione**: attributo --[siApplicaA]--> tabella prodotti\n  • Dettaglio: Tabella contenente l'elenco dei prodotti o servizi.\n\n→ **Relazione**: attributo --[siApplicaA]--> voce\n  • Dettaglio: Singola riga di prodotto o servizio.\n\n→ **Relazione**: attributo --[inviaDatiA]--> file excel\n  • Dettaglio: File excel da cui possono essere importati dati.\n\n→ **Relazione**: attributo --[haStato]--> attributo lettura\n  • Dettaglio: Attributo visualizzato in sola lettura."", ""--- Testo Originale dalle Guide per Contesto Aggiuntivo ---\n\nFonte: SA_ConfigurazioneDGUE.pdf - Pagina 5 - Sezione 'SPECIALIZZAZIONE DEL DGUE'\n```\nManuale SA | Configurazione del DGUE Manuale SA | Configurazione del DGUE pubblicazione della gara. Così facendo, infatti, tutti i valori già definiti (es. lotti, cig, oggetto gara, oggetto lotti ecc.) saranno automaticamente compilati dalla piattaforma. I campi Specializza DGUE Mandanti , Specializza DGUE Ausiliarie e Specializza DGUE Esecutrici consentono di specializzare ulteriormente il DGUE in base al ruolo dell’OE. In assenza di tali specializzazioni, mandanti, ausiliare ed esecutrici avranno da compilare un modello DGUE identico a quello previsto per la mandataria. seguito per la mandataria. Entrando in Specializza modulo DGUE Request Mandataria , è possibile personalizzare il template proposto, includendo/escludendo determinati moduli e inserendo le informazioni obbligatorie e/o facoltative mancanti.\n```\n\nFonte: SA_ConfigurazioneModelli.pdf - Pagina 7 - Sezione 'INTRODUZIONE'\n```\nVerrà mostrata una schermata nella quale è presente una toolbar con una serie di comandi per la gestione del documento: Salva: permette di salvare la personalizzazione del modello per poterlo riprendere in un secondo momento (cliccando sempre sul comando Apri dettagli modello , viene riproposta sempre l’ultima versione salvata); Conferma: applica le modifiche apportate al modello; per un altro utente registrato ed abilitato alla gestione dello stesso sulla gara; un altro utente registrato ed abilitato alla gestione dello stesso sulla gara; dello stesso sulla gara; Stampa: permette di stampare la pagina visualizzata; Manuale SA | Configurazione del Modello di Offerta Manuale SA | Configurazione del Modello di Offerta Vers.2 Esporta in XML: permette di esportare le informazioni contenute sulla pagina in formato XML; Chiudi: per tornare alla pagina precedente. Nell’area sottostante verranno visualizzate una serie di informazioni identificative e non editabili quali A seguire, viene invece riportato l’ Ambito di riferimento, precedentemente selezionato nella sezione Prodotti / Lotti e le quattro tabelle che consentono la configurazione del modello, ciascuna con i relativi comandi. In particolare, vengono mostrate le seguenti tabelle , descritte dettagliatamente nei paragrafi successivi: Attributi da usare nelle fasi della gara: nella tabella si definiscono gli attributi con le relative caratteristiche ed il momento in cui verranno richiesti; Calcolo del valore economico: nella tabella viene definito il calcolo sulla base del quale la piattaforma definirà il valore offerto da ciascun offerente; Colonne calcolate: nella tabella verranno definite le formule di calcolo per tutti gli attributi per i quali si è definito di usare un valore calcolato; Vincoli sugli attributi del modello: la tabella permette di configurare eventuali vincoli sugli attributi. Tutte le voci della colonna Descrizione Attributo presenti nella tabella Attributi da usare nelle fasi della gara corrispondono alla denominazione delle singole colonne che compongono la corrispettiva tabella Elenco Prodotti nella sezione Prodotti / Lotti . Manuale SA | Configurazione del Modello di Offerta Manuale SA | Configurazione del Modello di Offerta Vers.2 Sopra alla tabella Attributi da usare nelle fasi della gara , è disponibile una toolbar con alcuni comandi per la gestione della stessa. Aggiungi Attributo Consente l’aggiunta di un nuovo attributo, definito liberamente dall’utente compilatore. L’attributo aggiunto viene aggiunto in fondo alla tabella, può essere spostato e devono essere compilate tutte le relative opzioni; Nascondi e Visualizza I comandi Nascondi e Visualizza permettono di nascondere/visualizzare determinate colonne per semplificare la lettura della tabella. Per visualizzare nuovamente una o tutte le colonne nascoste, cliccare sul comando Visualizza e selezionare la voce desiderata. La colonna selezionata verrà resa nuovamente visibile nella tabella degli attributi.\n```\n\nFonte: SA_ConfigurazioneModelli.pdf - Pagina 8 - Sezione 'INTRODUZIONE'\n```\nManuale SA | Configurazione del Modello di Offerta Manuale SA | Configurazione del Modello di Offerta Vers.2 Esporta in xls Il comando Esporta in xls consente di esportare il modello in un file xlsx per una migliore consultazione dello stesso. Per procedere con il download del file, cliccare quindi sul comando predisposto in alto alla tabella. Giù e Su I comandi consentono di spostare l’ordine delle colonne nella tabella Elenco Prodotti . Il comando Vedi viene mostrato in caso di attributo Gerarchico o Dominio e consente di visualizzare le informazioni che è possibile selezionare tra quelle proposte attraverso, per l’appunto, una struttura gerarchica. Per visualizzare tali informazioni, cliccare sulla lente. Se si vuole eliminare un’informazione presente nella tabella Elenco Prodotti , è necessario aprire il dettaglio del modello attraverso il comando e, nella tabella Attributi da usare nelle fasi della gara Individuata quindi la riga relativa all’attributo da eliminare, cliccare sulla corrispettiva icona del bidone. Ad esempio, se il modello selezionato per la gara prevede l’attributo “Misure”, che nella procedura specifica non si intende richiedere ai partecipanti, si dovrà rimuoverlo dal dettaglio del modello. Ci sono alcuni attributi che non potranno comunque essere rimossi. Nella colonna Attributo , viene indicata la tipologia dell’informazione che verrà richiesta al RUP o all’OE nelle diverse fasi: Text: informazioni di tipo testuale; Number: informazioni di tipo numerico (es. quantità o prezzo); si precisa che per i campi di tipo numerico intero non viene richiesto di specificare il numero di decimali. Attach: informazioni di tipo allegato; Domain: scelta multipla tra più voci proposte; Gerarchico : informazioni da selezionare tra quelle proposte attraverso una struttura gerarchica. Alcuni attributi sono non editabili come, ad esempio, Text – DESCRIZIONE e Number – QUANTITA , altri invece possono essere personalizzati e quindi appariranno editabili come ad esempio Manuale SA | Configurazione del Modello di Offerta Manuale SA | Configurazione del Modello di Offerta Vers.2 In particolare, per alcuni modelli sono stati previsti degli attributi di tipo Text e Number generici che le stazioni appaltanti possono personalizzare inserendo una descrizione per l’informazione richiesta. Per aggiungere una nuova riga che consente di specializzare un nuovo attributo, cliccare sul comando Aggiungi attributo posizionato sopra alla tabella. In fondo alla tabella Attributi da usare nelle fasi della gara , verrà predisposta una nuova riga per la definizione dell’attributo per il quale dovranno essere compilate le informazioni richieste prestando attenzione a non selezionare attributi già previsti nel modello specifico. Non è consentito l'inserimento di attributi duplicati (es. due “Attach – ALLEGATO 1” nello stesso modello). Nella colonna Descrizione Attributo si potrà indicare il nome dell’attributo che gli utenti visualizzeranno.\n```\n\nFonte: SA_ConfigurazioneModelli.pdf - Pagina 10 - Sezione 'INTRODUZIONE'\n```\nAnche questo valore, per alcuni attributi chiave, potrebbe non essere editabile. Nel caso di un attributo di tipo Numerico verrà abilitato il campo nella colonna Numero Decimali, in cui indicare quanti decimali saranno richiesti (valore tra 0 e 10). Nel caso di un attributo di tipo Allegato verranno abilitati i campi delle colonne Richiedi firma (per definire se il file dovrà essere firmato digitalmente o meno) e Tipo File (per definire le estensioni di file ammesse). Per definire per quali righe della tabella prodotti debba essere richiesto l'attributo con le relative caratteristiche, nella colonna Lotto / Voce effettuare la selezione scegliendo tra: Lotto : l'attributo viene richiesto nelle sole righe che fanno riferimento al lotto (Voce di livello Voce : l'attributo viene richiesto nelle sole righe che fanno riferimento alla voce (Voci di livello 1,2,3 ecc. ); Manuale SA | Configurazione del Modello di Offerta Manuale SA | Configurazione del Modello di Offerta Vers.2 Lotto / Voce : l'attributo viene richiesto nelle righe che fanno riferimento sia alla voce che al lotto. Alcuni esempi: se in un lotto multivoce si vuole ricevere dai partecipanti un documento di specifiche tecniche per ciascuna riga di prodotto, si dovrà configurare “Voce”; se si vuole un’unica relazione tecnica per tutti i prodotti o servizi del listino, indicare “Lotto”. Nelle colonne a seguire , indicare se – per ciascuna colonna- quello che si sta aggiungendo è un Attributo di: Lettura : l'informazione risulterà di sola lettura; Scrittura : l'informazione è editabile ma non obbligatoria; Obbligatorio : l'informazione è da compilare obbligatoriamente; Calcolato : l'informazione è un valore che viene calcolato automaticamente in base a quanto definito dalla Formula impostata e pertanto non è editabile. In particolare, la colonna Bando/Appalto Specifico indica il momento della configurazione della gara da parte del RUP. Quindi se un attributo è ad es. Obbligatorio in Bando/Appalto specifico, significa che l’utente che sta configurando la gara dovrà necessariamente inserirlo, altrimenti il sistema non consentirà la pubblicazione dell’evento. La colonna Attestato di Partecipazione/Cauzione si riferisce il momento in cui l’OE partecipante genera l’eventuale attestato di partecipazione agli specifici lotti per gare multi-lotto (vedi manuale Indizione gara). È previsto l’inserimento di attributi in sola lettura, pertanto il pdf in cui l’OE dichiara a quali lotti intende partecipare conterrà i campi definiti in Lettura. L’utilizzo della colonna è limitato solo ad alcuni attributi. La colonna Offerta Tecnica indica il momento della compilazione della busta tecnica da parte degli OE partecipanti. Si definiranno quindi sotto questa colonna gli elementi tecnici obbligatori o facoltativi Manuale SA | Configurazione del Modello di Offerta Manuale SA | Configurazione del Modello di Offerta Vers.2 richiesti ai fornitori, quali ad es.\n```\n\nFonte: SA_IndizioneProceduraGara_AppaltoSpecifico (1).pdf - Pagina 30 - Sezione 'PRODOTTI'\n```\nSe non si vuole personalizzare il modello, si può usare uno dei modelli standard configurati. I modelli di offerta standard disponibili variano in base al tipo di gara in composizione, al criterio di aggiudicazione, all’ambito selezionato. del modello di gara adottato. In particolare, può variare sensibilmente il numero e la tipologia di Attributi . Per attributo si intende il campo riportato nell’intestazione di ciascuna colonna (ad es. Descrizione, Importo a base d’asta, Quantità ecc.). Gli attributi con l’asterisco saranno da compilare obbligatoriamente. saranno riportati, nelle colonne più a destra, alcuni attributi richiesti da ANAC ai fini dell’interoperabilità. Alcuni di questi valori sono da compilare ex-novo, altri invece saranno popolati sulla base di quanto di un file excel. Inseriti tutti i valori obbligatori o facoltativi riportati nella tabella Elenco Prodotti, cliccando su Verifica informazioni , sarà possibile avere evidenza di eventuali campi non compilati o compilati erroneamente. verde nella colonna Esito Riga . Se previsto per la tipologia di gara selezionata, è possibile aggiungere altre Righe , attraverso il pulsante configurate nel modello. Gli OE partecipanti dovranno dunque compilare tutte le righe configurate (ad es. se la SA intende richiedere un listino prezzi o un computo estimativo).\n```""]","La formula matematica per un attributo definito come 'Calcolato' va definita nella tabella ""Colonne calcolate"". Questa tabella è specificamente progettata per definire le formule di calcolo per tutti gli attributi per i quali è stato impostato l'utilizzo di un valore calcolato.  La guida menziona esplicitamente questa tabella nella sezione ""INTRODUZIONE"" di SA_ConfigurazioneModelli.pdf (pagina 7).","Se un attributo è stato definito come 'Calcolato' nella tabella 'Attributi da usare nelle fasi di gara', devi andare nella sezione 'Colonne calcolate'. Lì, per definire la formula, devi prima cliccare su 'Aggiungi Calcolo', selezionare l'attributo da calcolare e poi cliccare sull'icona della lente nella colonna 'Apri' per accedere alla calcolatrice e inserire la formula matematica.",1.0,0.9085268240787377,0.49999999995,0.5
Qual è il requisito fondamentale per i membri di una Commissione di Gara per poter operare sulla piattaforma EmPULIA?,"[""Informazioni rilevanti trovate nel Knowledge Graph:\n\n✓ **Entità trovata**: eliminazione utente membro\n  • Tipo: FunzionalitàPiattaforma\n  • Descrizione: Funzionalità per eliminare un utente dal Seggio di Gara.\n  • Occorrenze nel testo: 2\n  • Varianti trovate: Eliminazione utente membro\n\n→ **Relazione**: eliminazione utente membro --[eDescrittoIn]--> sezionesconosciuta_2\n  • Dettaglio: La sezione della guida EmPULIA intitolata 'None' (ID: GuidaRapidaMigrazioneOperatoriEconomici.pdf_section_2) da cui provengono queste informazioni.\n\n→ **Relazione**: eliminazione utente membro --[eDescrittoIn]--> sezionesconosciuta_4\n  • Dettaglio: La sezione della guida EmPULIA intitolata 'None' (ID: SA_Creazione_Commissioni_Gara.pdf_section_4) da cui provengono queste informazioni.\n\n→ **Relazione**: eliminazione utente membro --[eParteDi]--> lista utenti coinvolti\n  • Dettaglio: Tabella contenente l'elenco degli utenti coinvolti nel Seggio di Gara.\n\n✓ **Entità trovata**: membro\n  • Tipo: RuoloUtente\n  • Descrizione: Membro del Seggio di Gara, Commissione Tecnica o Commissione Economica.\n  • Occorrenze nel testo: 1\n  • Varianti trovate: Membro\n\n→ **Relazione**: membro --[eDescrittoIn]--> concorso idee progettazione singola fase\n  • Dettaglio: La sezione della guida EmPULIA intitolata 'CONCORSO DI IDEE O DI PROGETTAZIONE A SINGOLA FASE' (ID: SA_Valutazione_Concorsi.pdf_section_1) da cui provengono queste informazioni."", ""--- Testo Originale dalle Guide per Contesto Aggiuntivo ---\n\nFonte: SA_Valutazione_Concorsi.pdf - Pagina 3 - Sezione 'CONCORSO DI IDEE O DI PROGETTAZIONE A SINGOLA FASE'\n```\nAvvio Valutazione ............................................................................................................................... 5 Intestazione e Testata .......................................................................................................................... 6 Commissioni ........................................................................................................................................ 7 Sedute di gara ...................................................................................................................................... 8 Valutazione tecnica ............................................................................................................................. 9 Scheda Valutazione ................................................................................................................................... 12 Chiudi Valutazione Tecnica ....................................................................................................................... 14 Esito ........................................................................................................................................................... 15 Assegna Punteggio ..................................................................................................................................... 16 Tabella Riparametrazione Punteggi ........................................................................................................... 16 Valutazione Giudizi per Criterio ................................................................................................................ 17 Ripristina Fase ........................................................................................................................................... 17 Graduatoria anonima (Riepilogo Finale) ........................................................................................... 18 Valutazione Amministrativa .............................................................................................................. 19 Apertura Buste ........................................................................................................................................... 21 Esito ........................................................................................................................................................... 23 Verifica requisiti Amministrativi ............................................................................................................... 24 Partecipanti ................................................................................................................................................ 25 Estrazione Ausiliarie .................................................................................................................................. 28 Allegati .............................................................................................................................................. 28 Note ................................................................................................................................................... 29 2.10. Cronologia ......................................................................................................................................... 30 2.11. Documenti ......................................................................................................................................... 30\n```\n\nFonte: SA_Valutazione_Concorsi.pdf - Pagina 8 - Sezione 'CONCORSO DI IDEE O DI PROGETTAZIONE A SINGOLA FASE'\n```\nL'area di Intestazione presenta una serie di informazioni che consentono di individuare il Compilatore L'informazione Titolo documento viene compilata automaticamente con un testo di default (in cui viene riportato il Registro di Sistema della Procedura di Gara di riferimento). Nella sezione Testata viene riportata le informazioni relative alla gara, non editabili. (Seggio di Gara, eventuale Commissione Tecnica e Commissione Economica) con i relativi membri e le relative tabelle degli Atti e della Lista Utenti coinvolti . La pagina è in sola visualizzazione, dal momento che la definizione e le modifiche alla Commissione/Seggio di gara si devono fare dal Bando/Invito, come descritto nel manuale dedicato.\n```\n\nFonte: SA_Creazione_Commissioni_Gara.pdf - Pagina 10 - Sezione 'None'\n```\nNella sezione Seggio di Gara potranno essere inseriti gli atti e definiti i membri della commissione cui è affidata la fase di valutazione amministrativa della Procedura di Aggiudicazione. Per indicare un Atto (es. atto di nomina degli Utenti che compongono il Seggio di Gara), cliccare sul comando Inserisci Atto . Nella riga che verrà predisposta, cliccare sul comando Seleziona e selezionare il Tipo Atto tra quelli proposti; indicare poi le informazioni Numero Atto e Data Atto negli appositi campi. Per allegare il file relativo all’atto indicato, cliccare sul comando Per indicare uno o più utenti che compongono la Lista Utenti coinvolti di un Seggio di Gara (membri del Seggio di Gara) , cliccare sul comando Aggiungi . Non è obbligatorio indicare nella tabella Lista Utenti coinvolti tutti i membri del Seggio di Gara , purché tali nominativi vengano indicati nel verbale allegato dal Presidente\\Soggetto Valutatore ; è invece necessario indicare il Presidente\\Soggetto Valutatore . Manuale SA | Creazione Commissione di Gara Manuale SA | Creazione Commissione di Gara Vers.2 Nella riga che verrà predisposta, se l'Utente che si intende aggiungere è già registrato al sistema, cliccare sul comando Utente Commissione . Verrà mostrata una schermata contenente l'elenco di tutti gli Utenti registrati per la Continua per procedere. Il Sistema compilerà in automatico tutti i campi della riga aggiunta con le relative informazioni. Manuale SA | Creazione Commissione di Gara Manuale SA | Creazione Commissione di Gara Vers.2 Poiché l'Utente selezionato nell’esempio risulta essere già registrato al sistema, sarà sufficiente indicare solo il Ruolo da attribuirgli cliccando sul comando Seleziona e selezionandolo tra quelli proposti. Manuale SA | Creazione Commissione di Gara Manuale SA | Creazione Commissione di Gara Vers.2 Stazione Appaltante che ha pubblicato la gara. Gli altri membri del Seggio di Gara invece possono essere registrati sotto altre SA. In questo caso è possibile richiamarli in questa fase, semplicemente inserendo nel relativo campo il Codice Fiscale . Se già censiti con altra SA, o indicati in altri Seggi di Gara / Commissioni, i campi verranno compilati automaticamente con le informazioni richieste. In generale, in fase di inserimento delle informazioni nella tabella Lista Utenti coinvolti : per allegare il curriculum relativo ad un determinato utente, consultare quanto descritto nel paragrafo Caricamento Curriculum ; se l'utente che si intende aggiungere come membro del Seggio di Gara non è ancora registrato al sistema, è possibile richiederne la registrazione contestualmente alla creazione del Seggio di Gara . In tal caso, consultare quanto descritto nel paragrafo Registrazione utente membro ; per eliminare un utente definito nel Seggio di Gara , consultare quanto descritto nel paragrafo Eliminazione utente membro . Definito il Seggio di Gara , se prevista, definire la Commissione Tecnica nell’omonima sezione, altrimenti procedere con la definizione della Commissione Economica .\n```\n\nFonte: GuidaRapidaMigrazioneOperatoriEconomici.pdf - Pagina 13 - Sezione 'None'\n```\np.iva dell’azienda già registrata e negli step successive inserisci i dati del nuovo utente. In questa fase non sarà possibile variare i dati anagrafici precaricati. Accedi con le utenze in piattaforma ed entra in Anagrafica Accedi con le utenze in piattaforma ed entra in Anagrafica Nella sezione Utenti troverai aggiornato l’elenco degli utenti associati alla tua azienda Nella sezione Utenti troverai aggiornato l’elenco degli utenti associati alla tua azienda Se sono presenti più utenze, all’interno dei diversi documenti strutturati (ad es. Domanda di Ammissione ad Albo o a bandi SDA, offerte in composizione ecc.) troverai il comando Assegna a , che ti consente di assegnare il profilati Se sono presenti più utenze, all’interno dei diversi documenti strutturati (ad es. Domanda di Ammissione ad Albo o a bandi SDA, offerte in composizione ecc.) troverai il comando Assegna a , che ti consente di assegnare il profilati Per maggiori informazioni consulta su http://www.empulia.it i manuali e gli altri strumenti di apprendimento pubblicati nella sezione dedicata alla Migrazione Piattaforma Per maggiori informazioni consulta su http://www.empulia.it i manuali e gli altri strumenti di apprendimento pubblicati nella sezione dedicata alla Migrazione Piattaforma Nella stessa sezione troverai a breve anche degli eventi formativi (webinar) dedicati al passaggio alla nuova piattaforma, ed ai quali ti invitiamo a partecipare! Nella stessa sezione troverai a breve anche degli eventi formativi (webinar) dedicati al passaggio alla nuova piattaforma, ed ai quali ti invitiamo a partecipare!\n```\n\nFonte: SA_Creazione_Commissioni_Gara.pdf - Pagina 15 - Sezione 'None'\n```\nManuale SA | Creazione Commissione di Gara Manuale SA | Creazione Commissione di Gara Vers.2 Nella riga che verrà predisposta, cliccare sul comando Seleziona e selezionare il Tipo Atto tra quelli proposti; indicare poi le informazioni Numero Atto e Data Atto negli appositi campi. Per allegare il file relativo all’atto indicato, cliccare sul comando Per indicare uno o più utenti che compongono la Lista Utenti coinvolti di una Commissione Economica , cliccare sul comando Aggiungi . Non è obbligatorio indicare nella tabella Lista Utenti coinvolti tutti i membri della Commissione Economica , purché tali nominativi vengano indicati nel verbale allegato Presidente\\Soggetto Valutatore ; è invece necessario indicare il Presidente\\Soggetto Valutatore . Nella riga che verrà predisposta, se l'Utente che si intende aggiungere è già registrato al sistema, cliccare sul comando Utente Commissione . Verrà mostrata una schermata contenente l'elenco di tutti gli Utenti registrati per la Stazione Appaltante. Selezionare l' Utente Commissione tra quelli proposti e cliccare sul comando Continua per procedere. La sezione relativa alla Lista Utenti Coinvolti verrà auto compilata con le informazioni relative all’utente selezionato. Se l'Utente cliccando sul comando Seleziona e selezionandolo tra quelli proposti. Ad eccezione del Presidente/Soggetto Valutatore , che deve essere necessariamente registrato al Economica siano registrati alla piattaforma ma non come Utenti registrati dell'ente, è possibile richiamarli in questa fase, semplicemente inserendo nel relativo campo il Codice Fiscale . Se già censiti con un altro Ente o indicati in altri Seggi di Gara/Commissioni , i campi verranno compilati automaticamente con le informazioni richieste. Manuale SA | Creazione Commissione di Gara Manuale SA | Creazione Commissione di Gara Vers.2 Copia Seggio di Gara Nel caso in cui gli atti ed i membri della Commissione Economica siano gli stessi indicati nel Seggio di Gara , è possibile duplicare le informazioni cliccando sul comando Copia Seggio di Gara . Il sistema duplicherà in automatico anche per la Commissione Economica gli Atti ed i nominativi indicati nel Seggio di Gara . Nel caso in cui gli atti ed i membri della Commissione Economica siano invece gli stessi indicati per la Commissione Tecnica , è possibile duplicare le informazioni cliccando sul comando Copia Commissione Giudicatrice . Manuale SA | Creazione Commissione di Gara Manuale SA | Creazione Commissione di Gara Vers.2 Il sistema copierà in automatico anche per la Commissione Economica gli Atti ed i nominativi indicati nella Commissione Tecnica . In generale, in fase di inserimento delle informazioni nella tabella Lista Utenti coinvolti : paragrafo Caricamento Curriculum ; ancora registrato al sistema, è possibile richiederne la registrazione contestualmente alla creazione della Commissione Economica. In tal caso, consultare quanto descritto nel paragrafo Registrazione utente membro ; paragrafo Eliminazione utente membro . Definita la Commissione Economica , confermare le Commissioni di Gara cliccando sul comando Conferma posizionato nella toolbar in alto nella schermata. Per maggiori dettagli, consultare il paragrafo Conferma Commissioni di Gara .\n```""]","Il requisito fondamentale per i membri di una Commissione di Gara per poter operare sulla piattaforma EmPULIA è che siano **registrati al sistema**.

In particolare, il Presidente/Soggetto Valutatore deve essere necessariamente registrato alla piattaforma. Gli altri membri possono essere registrati sotto altre Stazioni Appaltanti, ma in tal caso è possibile richiamarli inserendo il loro Codice Fiscale. Se l'utente non è ancora registrato, è possibile richiederne la registrazione contestualmente alla creazione del Seggio/Commissione.","Secondo la guida, è necessario che sia il 'Presidente/Soggetto Valutatore' sia tutti gli altri membri del 'Seggio di Gara' e/o delle 'Commissioni Tecnica ed Economica' siano necessariamente registrati al sistema.",1.0,0.9999999999999991,0.49999999995,0.0
Come posso aggiungere un membro a un Seggio di Gara se non è ancora registrato sulla piattaforma EmPULIA?,"[""Informazioni rilevanti trovate nel Knowledge Graph:\n\n✓ **Entità trovata**: aggiunta atto gara\n  • Tipo: FunzionalitàPiattaforma\n  • Descrizione: Funzionalità per aggiungere un atto di gara.\n  • Occorrenze nel testo: 1\n  • Varianti trovate: Aggiunta Atto di Gara\n\n→ **Relazione**: aggiunta atto gara --[includeOperazione]--> aggiungi allegato\n  • Dettaglio: Comando per aggiungere un allegato alla comunicazione.\n\n→ **Relazione**: aggiunta atto gara --[includeOperazione]--> inserisci atto\n  • Dettaglio: Comando per inserire un nuovo atto relativo al Seggio di Gara.\n\n→ **Relazione**: aggiunta atto gara --[eDescrittoIn]--> funzioni\n  • Dettaglio: Le funzioni disponibili nella piattaforma EmPULIA.\n\n✓ **Entità trovata**: aggiunta allegato revoca\n  • Tipo: AzioneUtente\n  • Descrizione: Aggiungere un allegato di revoca a un bando.\n  • Occorrenze nel testo: 1\n  • Varianti trovate: Aggiunta Allegato Revoca\n\n→ **Relazione**: aggiunta allegato revoca --[richiedeInput]--> comando tre punti\n  • Dettaglio: Comando dell'interfaccia utente per aggiungere l'allegato di revoca lotto.\n\n→ **Relazione**: aggiunta allegato revoca --[richiedeInput]--> campo descrizione\n  • Dettaglio: Il campo per inserire la descrizione dell'allegato.\n\n→ **Relazione**: aggiunta allegato revoca --[riguarda]--> bando\n  • Dettaglio: Bando pubblicato su EmPULIA.\n\n→ **Relazione**: aggiunta allegato revoca --[includeOperazione]--> documento\n  • Dettaglio: La documentazione di gara.\n\n→ **Relazione**: aggiunta allegato revoca --[eDescrittoIn]--> funzioni\n  • Dettaglio: Le funzioni disponibili nella piattaforma EmPULIA.\n\n→ **Relazione**: aggiunta allegato revoca --[eParteDi]--> documento\n  • Dettaglio: La documentazione di gara.\n\n→ **Relazione**: aggiunta allegato revoca --[eParteDi]--> comando aggiungi allegato\n  • Dettaglio: Il comando per aggiungere un allegato di revoca.\n\n✓ **Entità trovata**: aggiunta allegato\n  • Tipo: FunzionalitàPiattaforma\n  • Descrizione: La funzionalità di aggiungere un allegato di sospensione.\n  • Occorrenze nel testo: 1\n  • Varianti trovate: Aggiunta Allegato\n\n→ **Relazione**: aggiunta allegato --[includeOperazione]--> aggiungi allegato\n  • Dettaglio: Comando per aggiungere un allegato alla comunicazione.\n\n→ **Relazione**: aggiunta allegato --[eDescrittoIn]--> funzioni\n  • Dettaglio: Le funzioni disponibili nella piattaforma EmPULIA.\n\n→ **Relazione**: aggiunta allegato --[eParteDi]--> caricamento file\n  • Dettaglio: Azione di caricare un file come allegato.\n\n✓ **Entità trovata**: aggiunta allegati\n  • Tipo: FunzionalitàPiattaforma\n  • Descrizione: Funzionalità di aggiunta di allegati al fascicolo di gara.\n  • Occorrenze nel testo: 1\n  • Varianti trovate: Aggiunta allegati\n\n→ **Relazione**: aggiunta allegati --[riguarda]--> fascicolo gara\n  • Dettaglio: Il fascicolo di gara allo stato attuale.\n\n→ **Relazione**: aggiunta allegati --[eEseguitaDa]--> conferma\n  • Dettaglio: Azione per confermare un'operazione.\n\n→ **Relazione**: aggiunta allegati --[eDescrittoIn]--> funzioni\n  • Dettaglio: Le funzioni disponibili nella piattaforma EmPULIA."", ""--- Testo Originale dalle Guide per Contesto Aggiuntivo ---\n\nFonte: SA_ConfigurazioneDGUE.pdf - Pagina 7 - Sezione 'SPECIALIZZAZIONE FACOLTATIVA DI ALTRI MODULI'\n```\nManuale SA | Configurazione del DGUE Manuale SA | Configurazione del DGUE Se si disattiva una Parte, vengono disabilitate anche le Sezioni ed i Moduli Richieste relativi; se si disattiva una Sezione, vengono disabilitati tutti i Moduli Richieste relativi. Altrimenti si può procedere alla ATTENZIONE : se le sezioni/moduli vengono lasciati attivi, al fornitore potrebbe venir richiesta la compilazione obbligatoria delle risposte per quei moduli. Pertanto, si segnala l’opportunità di disattivare sezioni/moduli non pertinenti o per le quali non interessa conoscere il dato ai fini della gara in composizione. La colonna Indice fa riferimento all’indice previsto dalla tassonomia AGID La colonna Tipologia indica se si tratta di Parte, Sezione o Modulo Richiesta. La colonna Descrizione contiene la descrizione prevista secondo tassonomia AGID. Nella colonna Esito Riga vengono visualizzate icone rosse o verdi in prossimità delle informazioni che richiedono un inserimento di dati obbligatori da parte della Stazione Appaltante. Il bollino rosso indica che una o più informazioni obbligatorie non sono presenti ed andranno compilate dalla SA cliccando sulla lente in corrispondenza della colonna Apri (vedi immagine precedente). In particolare, in prossimità delle informazioni relative a Identità del committente , l’icona risulta essere già verde in quanto le informazioni vengono ereditate in automatico dalla gara. singoli Moduli Richieste, ed in particolare per: Visualizzare l’anteprima della domanda posta al fornitore; Completare informazioni mancanti non obbligatorie o specificare criteri minimi di selezione (es. fatturato, numero di referenze, abilitazioni o certificazioni ecc.) richiesti. Con riferimento ai valori relativi ai criteri minimi di selezione, che la SA dovrebbe specificare modulo per modulo, si segnala che la piattaforma consente comunque la non definizione degli stessi all’interno del DGUE strutturato, riportando la precisazione: Se il Requisito minimo non è valorizzato far riferimento alla documentazione di gara. Tale impostazione semplifica la compilazione del DGUE per la SA, rendendo di chiaramente riportati nella documentazione di gara.\n```\n\nFonte: Guida_Rapida_Migrazione_Utenti_SA.pdf - Pagina 9 - Sezione 'None'\n```\nSe hai già generato il pdf e vuoi fare modifiche al contenuto, Gli altri campi sono facoltativi Gli altri campi sono facoltativi Effettua il log-out e successivamente rientra con le tue credenziali Effettua il log-out e successivamente rientra con le tue credenziali Troverai nel menu di sinistra tutti i gruppi funzionali a cui sei abilitato sulla base del ruolo assegnato Troverai nel menu di sinistra tutti i gruppi funzionali a cui sei abilitato sulla base del ruolo assegnato Dopo aver caricato il file firmato, clicca su Conferma Dopo aver caricato il file firmato, clicca su Conferma Per maggiori informazioni consulta su http://www.empulia.it i manuali e gli altri strumenti di apprendimento pubblicati nella sezione dedicata alla Migrazione Piattaforma Per maggiori informazioni consulta su http://www.empulia.it i manuali e gli altri strumenti di apprendimento pubblicati nella sezione dedicata alla Migrazione Piattaforma Nella stessa sezione troverai a breve anche degli eventi formativi (webinar) dedicati al passaggio alla nuova piattaforma, ed ai quali ti invitiamo a partecipare! Nella stessa sezione troverai a breve anche degli eventi formativi (webinar) dedicati al passaggio alla nuova piattaforma, ed ai quali ti invitiamo a partecipare!\n```\n\nFonte: SA_Creazione_Commissioni_Gara.pdf - Pagina 10 - Sezione 'None'\n```\nNella sezione Seggio di Gara potranno essere inseriti gli atti e definiti i membri della commissione cui è affidata la fase di valutazione amministrativa della Procedura di Aggiudicazione. Per indicare un Atto (es. atto di nomina degli Utenti che compongono il Seggio di Gara), cliccare sul comando Inserisci Atto . Nella riga che verrà predisposta, cliccare sul comando Seleziona e selezionare il Tipo Atto tra quelli proposti; indicare poi le informazioni Numero Atto e Data Atto negli appositi campi. Per allegare il file relativo all’atto indicato, cliccare sul comando Per indicare uno o più utenti che compongono la Lista Utenti coinvolti di un Seggio di Gara (membri del Seggio di Gara) , cliccare sul comando Aggiungi . Non è obbligatorio indicare nella tabella Lista Utenti coinvolti tutti i membri del Seggio di Gara , purché tali nominativi vengano indicati nel verbale allegato dal Presidente\\Soggetto Valutatore ; è invece necessario indicare il Presidente\\Soggetto Valutatore . Manuale SA | Creazione Commissione di Gara Manuale SA | Creazione Commissione di Gara Vers.2 Nella riga che verrà predisposta, se l'Utente che si intende aggiungere è già registrato al sistema, cliccare sul comando Utente Commissione . Verrà mostrata una schermata contenente l'elenco di tutti gli Utenti registrati per la Continua per procedere. Il Sistema compilerà in automatico tutti i campi della riga aggiunta con le relative informazioni. Manuale SA | Creazione Commissione di Gara Manuale SA | Creazione Commissione di Gara Vers.2 Poiché l'Utente selezionato nell’esempio risulta essere già registrato al sistema, sarà sufficiente indicare solo il Ruolo da attribuirgli cliccando sul comando Seleziona e selezionandolo tra quelli proposti. Manuale SA | Creazione Commissione di Gara Manuale SA | Creazione Commissione di Gara Vers.2 Stazione Appaltante che ha pubblicato la gara. Gli altri membri del Seggio di Gara invece possono essere registrati sotto altre SA. In questo caso è possibile richiamarli in questa fase, semplicemente inserendo nel relativo campo il Codice Fiscale . Se già censiti con altra SA, o indicati in altri Seggi di Gara / Commissioni, i campi verranno compilati automaticamente con le informazioni richieste. In generale, in fase di inserimento delle informazioni nella tabella Lista Utenti coinvolti : per allegare il curriculum relativo ad un determinato utente, consultare quanto descritto nel paragrafo Caricamento Curriculum ; se l'utente che si intende aggiungere come membro del Seggio di Gara non è ancora registrato al sistema, è possibile richiederne la registrazione contestualmente alla creazione del Seggio di Gara . In tal caso, consultare quanto descritto nel paragrafo Registrazione utente membro ; per eliminare un utente definito nel Seggio di Gara , consultare quanto descritto nel paragrafo Eliminazione utente membro . Definito il Seggio di Gara , se prevista, definire la Commissione Tecnica nell’omonima sezione, altrimenti procedere con la definizione della Commissione Economica .\n```\n\nFonte: SA_FunzioniBando.pdf - Pagina 10 - Sezione 'FUNZIONI'\n```\npubblicato Per modificare l'informazione Seduta Virtuale, nella sezione Testata cliccare sul comando e selezionare il valore si o no. Nella medesima sezione viene inoltre riportata l’informazione relativa al Precedente Valore della Seduta Virtuale. Per modificare gli utenti cliccare sulla sezione . In tale sezione vengono indicati gli utenti a cui è affidata la gestione dei quesiti inviati dagli operatori economici nonché quelli ai quali è consentita la visualizzazione della procedura anche quando quest’ultima è In lavorazione (dalla specifica sezione Consultazioni Gare/RDO/Appalti Specifici). campo Note e digitare il testo. Altre modifiche, quali quelle sull’oggetto, sui termini o sugli atti di gara, sono da gestire tramite funzionalità di Rettifica o di Proroga, dal momento che tali modifiche vanno comunicate alla PCP di ANAC in interoperabilità. Per visualizzare lo storico delle operazioni eseguite in ordine cronologico dagli utenti della Stazione Effettuate le opportune modifiche, cliccare sul comando Conferma posizionato nella toolbar in alto nella schermata. Il presente paragrafo descrive le modalità per effettuare eventuali rettifiche e/o integrazioni ad un bando pubblicato su EmPULIA, modificandone i termini, l’oggetto e/o gli atti di gara precedentemente predisposti, attraverso la specifica funzione Rettifica. Alla pubblicazione della rettifica, EmPULIA trasmette alla PCP di ANAC le informazioni rettificate attraverso l’invio della scheda PCP idonea. Se la procedura è sopra soglia, verrà contestualmente inviato\n```\n\nFonte: SA_FunzioniBando.pdf - Pagina 14 - Sezione 'FUNZIONI'\n```\npubblicato Per aggiungere un atto di gara , cliccare sul comando Aggiungi Allegato . Nella tabella Atti di Gara verrà aggiunta una riga. Inserire l'informazione Nuova Descrizione nell'omonimo campo e cliccare sul comando con i tre punti per aggiungere il Nuovo Allegato. In alternativa, è possibile aggiungere un nuovo allegato cliccando sul comando Inserisci Atto e selezionare la tipologia di atto da inserire dalla lista suggerita (es. bando di gara, disciplinare, capitolato tecnico, ecc.). Effettuate tutte le rettifiche al documento, inserire la Motivazione nell'omonimo campo e cliccare sul comando Aggiungi Allegato posizionato al di sopra della tabella Documenti Allegati per aggiungere l'allegato di rettifica, completando, nella riga che verrà predisposta, il campo Descrizione. Infine, cliccare sul comando per caricare il file. (Nell’allegato andranno indicate le motivazioni che giustificheranno la rettifica del Bando e saranno visibili agli O.E.). Per eliminare un allegato, fare clic sull’icona del cestino. Apportate le opportune modifiche, cliccare sul comando Invia presente nella toolbar per procedere con la pubblicazione del documento di Rettifica.\n```\n\nFonte: SA_FunzioniBando.pdf - Pagina 16 - Sezione 'FUNZIONI'\n```\npubblicato È necessario indicare la Motivazione della revoca nell'apposito campo e cliccare sul comando con i tre punti per aggiungere l'allegato di revoca lotto. Cliccare sulla check box per selezionare il lotto/i da revocare.\n```\n\nFonte: SA_FunzioniBando.pdf - Pagina 19 - Sezione 'FUNZIONI'\n```\npubblicato Per aggiungere l'allegato di revoca, cliccare sul comando Aggiungi Allegato posizionato al di sopra della tabella Lista Allegati, completare il campo Descrizione e cliccare sul comando con i tre punti. Compilate correttamente tutte le informazioni richieste, cliccare sul comando Invio presente nella toolbar per procedere con la pubblicazione del documento di Revoca. venga revocato Bando termini presentazione delle Offerte/Risposte/Manifestazioni di interesse/Domande di Partecipazione non sono ancora scaduti , la Offerte/Risposte/Manifestazioni di interesse/Domande di Partecipazione da parte delle imprese. A seguito della revoca, possibile Operatori Economici inviare un’Offerta/Risposta/Manifestazione di interesse/Domanda di Partecipazione precedentemente salvata. In tutti gli altri casi (termini di presentazione delle Offerte/Risposte/Manifestazioni di interesse/Domande di Partecipazione scaduti, ma seduta non ancora effettuata; termini di presentazione delle Offerte/Risposte/Manifestazioni di interesse/Domande di Partecipazione scaduti e seduta effettuata; aggiudicazione definitiva effettuata) il Bando verrà posto nello stato Revocato e tale azione\n```\n\nFonte: SA_EmissioneGestione_OdF.pdf - Pagina 23 - Sezione 'CREAZIONE ORDINATIVO DI FORNITURA'\n```\ndisabilitato, così come le altre funzioni disponibili. Inoltre, Lo Stato passerà da “ Pubblicato ” ad “ Annullato ”. è possibile eseguire l’annullamento del CIG, il comando quindi appare disabilitato. Dunque, si precisa che, in linea con quanto previsto da ANAC, la scheda ANN per gli OdF è trasmissibile fino all’accettazione dell’ordinativo da parte dell’OE.\n```\n\nFonte: SA_FunzioniBando.pdf - Pagina 25 - Sezione 'FUNZIONI'\n```\npubblicato Aggiungere quindi l'allegato di sospensione cliccando sul comando Aggiungi Allegato . Nella riga che verrà aggiunta alla tabella Lista Allegati, inserire la Descrizione nell’apposito campo e cliccare sul comando per caricare il file. Per eliminare l’allegato, fare clic sull’icona del cestino. Se in fase di indizione della procedura di gara, in Testata, l'informazione Visualizza Notifiche è stata impostata su si , in fondo alla schermata verrà predisposta una tabella con i destinatari della comunicazione, aggiornata in automatico dal Sistema al momento dell'invio. In caso contrario, la tabella non verrà mostrata. momento, per l'Operatore Economico non sarà consentito l'invio di una offerta/risposta/manifestazione di interesse. In particolare, il documento di Sospensione Gara In lavorazione (salvato) è disponibile per la lavorazione nella sezione Documenti del bando/invito/avviso e si potrà: inviarlo, sospendendo definitivamente la procedura di gara; annullarlo. In tal caso la procedura di gara ritornerà nella fase Pubblicato o Presentazione Offerte/Risposte.\n```\n\nFonte: SA_CPM.pdf - Pagina 30 - Sezione 'CREAZIONE CONSULTAZIONE PRELIMINARE'\n```\nA seguire, il campo Rispondere Entro , ovvero entro il quale l’Operatore Economico dovrà inviare la propria risposta, è impostato con una data di default che è possibile modificare per eventuali personalizzazioni. Indicare il Testo della Comunicazione nell'apposito campo. Per aggiungere un allegato, cliccare sul comando Aggiungi Allegato e, nella riga che verrà predisposta, indicare la Descrizione del documento e caricare il file attraverso il comando . Predisposto correttamente il contenuto della comunicazione, cliccare sul comando Invio posizionato nella toolbar in alto nella schermata per procedere con l'invio.\n```\n\nFonte: SA_FunzioniBando.pdf - Pagina 33 - Sezione 'FUNZIONI'\n```\npubblicato Nella schermata relativa al documento appena assegnato ad un altro utente, nel relativo campo, verrà aggiornato il nominativo del Compilatore con quello relativo all'utenza selezionata. I soli utenti in possesso dello specifico Profilo “ Fascicolo di gara ”, hanno a disposizione il relativo comando Esportazione Fascicolo . Cliccando sul pulsante, la piattaforma avvierà l’export del fascicolo di gara allo stato attuale, ovvero rendendo disponibili solo i documenti aperti attraverso le relative sedute. L’operazione può richiedere da pochi minuti a diverse ore, a seconda del peso del fascicolo. Gli utenti con profilo dedicato possono monitorare lo stato dell’esportazione, entrando nel menù di sinistra in Procedure di gara e poi in Lista Fascicoli di Gara . La pagina di riepilogo mostra una tabella con i fascicoli scaricati dall’utente o in fase di download.\n```\n\nFonte: SA_CPM.pdf - Pagina 36 - Sezione 'CREAZIONE CONSULTAZIONE PRELIMINARE'\n```\nNella schermata che verrà mostrata, il Titolo documento , l’ Oggetto e il Testo della Comunicazione risultano precompilati automaticamente, ma editabili per eventuali modifiche o personalizzazioni. Per aggiungere un allegato, cliccare sul comando Aggiungi Allegato e, nella riga che verrà predisposta, indicare la Descrizione del documento e caricare il file attraverso il comando hanno inviato la propria Risposta alla Consultazione Preliminare, destinatari della comunicazione\n```\n\nFonte: SA_FunzioniBando.pdf - Pagina 37 - Sezione 'FUNZIONI'\n```\npubblicato Cliccare su Conferma per concludere l’operazione ed aggiungere gli allegati al fascicolo di gara. Aperto il dettaglio del bando di interesse, nella sezione Documenti , è possibile visualizzare tutti i documenti creati (anche solo salvati o in fase di lavorazione) e pubblicati.\n```""]","Per aggiungere un membro a un Seggio di Gara che non è ancora registrato sulla piattaforma EmPULIA, segui questi passaggi:

1.  **Accedi alla sezione Seggio di Gara:** Questa sezione è dove puoi inserire gli atti e definire i membri della commissione.
2.  **Clicca sul comando Aggiungi:** Questo comando ti permette di aggiungere utenti alla Lista Utenti coinvolti del Seggio di Gara.
3.  **Registrazione utente membro:** Se l'utente non è registrato, puoi richiederne la registrazione contestualmente alla creazione del Seggio di Gara. Consulta il paragrafo ""Registrazione utente membro"" per i dettagli.
4.  **Utenti registrati con altre SA:** Se l'utente è già censito con un'altra Stazione Appaltante (SA), puoi richiamarlo inserendo il suo Codice Fiscale nel campo apposito. I campi verranno compilati automaticamente se l'utente è già censito.
5.  **Indicare il Presidente/Soggetto Valutatore:** È necessario indicare il Presidente/Soggetto Valutatore.
6.  **Allegare il verbale:** Assicurati che i nominativi di tutti i membri del Seggio di Gara siano indicati nel verbale allegato dal Presidente/Soggetto Valutatore, anche se non sono tutti indicati nella tabella Lista Utenti coinvolti.","Per aggiungere un membro non ancora registrato, devi cliccare sul comando 'Aggiungi' sopra la tabella 'Lista Utenti Coinvolti'. Sulla nuova riga che appare, seleziona la casella 'Registra', indica il Ruolo che vuoi attribuirgli e infine compila tutte le informazioni richieste: Codice Fiscale, Nome, Cognome, Ruolo Aziendale ed E-Mail.",1.0,0.997309587484902,0.49999999995,0.5
"Se uso le funzioni 'Modifica Contratto' o 'Rinnovo' per cambiare la data di scadenza, queste modifiche vengono comunicate automaticamente ad ANAC?","[""Informazioni rilevanti trovate nel Knowledge Graph:\n\n✓ **Entità trovata**: modifica contenuto\n  • Tipo: FunzionalitàPiattaforma\n  • Descrizione: Possibilità di modificare il contenuto di un documento.\n  • Occorrenze nel testo: 1\n  • Varianti trovate: Modifica contenuto\n\n→ **Relazione**: modifica contenuto --[haPrerequisito]--> pdf\n  • Dettaglio: Documento in formato PDF.\n\n→ **Relazione**: modifica contenuto --[eDescrittoIn]--> sezionesconosciuta_1\n  • Dettaglio: La sezione della guida EmPULIA intitolata 'None' (ID: GuidaRapidaMigrazioneOperatoriEconomici.pdf_section_1) da cui provengono queste informazioni.\n\n✓ **Entità trovata**: comando modifica\n  • Tipo: ComandoUI\n  • Descrizione: Comando per modificare la descrizione e le caratteristiche tecniche di una riga.\n  • Occorrenze nel testo: 1\n  • Varianti trovate: Comando Modifica\n\n→ **Relazione**: comando modifica --[interagisceCon]--> riga\n  • Dettaglio: Riga all'interno della tabella Elenco documenti.\n\n→ **Relazione**: comando modifica --[eDescrittoIn]--> eliminazione consultazione lavorazione\n  • Dettaglio: La sezione della guida EmPULIA intitolata 'ELIMINAZIONE DI UNA CONSULTAZIONE IN LAVORAZIONE' (ID: SA_CPM.pdf_section_3) da cui provengono queste informazioni.\n\n→ **Relazione**: comando modifica --[puoEseguire]--> obbligatorietà\n  • Dettaglio: Caratteristica tecnica di obbligatorietà di un documento.\n\n→ **Relazione**: comando modifica --[puoEseguire]--> richiesta firma digitale\n  • Dettaglio: Caratteristica tecnica di richiesta della firma digitale di un documento.\n\n→ **Relazione**: comando modifica --[puoEseguire]--> estensione file\n  • Dettaglio: Estensione del file ammessa per la documentazione.\n\n✓ **Entità trovata**: modifica\n  • Tipo: SezioneGuida\n  • Descrizione: La sezione della guida EmPULIA intitolata 'MODIFICA' (ID: SA_EmissioneGestione_OdF.pdf_section_1) da cui provengono queste informazioni.\n  • Occorrenze nel testo: 8\n  • Varianti trovate: MODIFICA, Modifica\n\n→ **Relazione**: modifica --[richiedeInput]--> autorizzazione\n  • Dettaglio: Necessità di autorizzazione per effettuare modifiche.\n\n→ **Relazione**: modifica --[richiedeInput]--> formalizzazione\n  • Dettaglio: Necessità di formalizzazione per effettuare modifiche.\n\n→ **Relazione**: modifica --[contieneElemento]--> sezione documenti\n  • Dettaglio: Sezione della piattaforma dedicata ai documenti.\n\n→ **Relazione**: modifica --[generaDocumento]--> documento\n  • Dettaglio: La documentazione di gara.\n\n→ **Relazione**: modifica --[haStato]--> documento\n  • Dettaglio: La documentazione di gara.\n\n→ **Relazione**: modifica --[eParteDi]--> documenti\n  • Dettaglio: Sezione della piattaforma dedicata ai documenti.\n\n→ **Relazione**: modifica --[eParteDi]--> associazione enti\n  • Dettaglio: Funzionalità di associazione ad altri Enti o strutture.\n\n→ **Relazione**: modifica --[eParteDi]--> modifica ruolo utente\n  • Dettaglio: Funzionalità di modifica del ruolo associato all’utente.\n\n→ **Relazione**: modifica --[eDescrittoIn]--> sezioni\n  • Dettaglio: Le sezioni da includere nel documento DGUE.\n\n→ **Relazione**: modifica --[eDescrittoIn]--> avvisi\n  • Dettaglio: La sezione della guida EmPULIA intitolata 'AVVISI' (ID: SA_FunzioniBando.pdf_section_1) da cui provengono queste informazioni.\n\n→ **Relazione**: modifica --[eDescrittoIn]--> modifica ruolo\n  • Dettaglio: La sezione della guida EmPULIA intitolata 'MODIFICA RUOLO' (ID: SA_Registrazione_gestione_utente.pdf_section_9) da cui provengono queste informazioni.\n\n→ **Relazione**: modifica --[eDescrittoIn]--> firma digitale\n  • Dettaglio: L'operazione di apporre una firma digitale a un documento."", ""--- Testo Originale dalle Guide per Contesto Aggiuntivo ---\n\nFonte: SA_EmissioneGestione_OdF.pdf - Pagina 3 - Sezione 'MODIFICA'\n```\nCrea Ordinativo ................................................................................................................. 8 INVIO .................................................................................................................................... 23 ANNULLAMENTO ORDINATIVO FORNITURA (GESTORE CONVENZIONI) .......................................................................................................................... 36\n```\n\nFonte: SA_FunzioniBando.pdf - Pagina 3 - Sezione 'AVVISI'\n```\npubblicato Modifica ............................................................................................................................. 7 Rettifica .............................................................................................................................. 9 Revoca lotto ...................................................................................................................... 14 Revoca .............................................................................................................................. 16 Proroga ............................................................................................................................. 19 Sospensione della gara ...................................................................................................... 22 Ripristino Gara ................................................................................................................. 25 Sostituzione R.U.P. .......................................................................................................... 27 Riammissione Offerta ....................................................................................................... 28 ESITI / PUBBLICAZIONI ............................................................................................................. 39 INDICE DELLE FIGURE .............................................................................................................. 42\n```\n\nFonte: SA_CPM.pdf - Pagina 5 - Sezione 'ELIMINAZIONE DI UNA CONSULTAZIONE IN LAVORAZIONE'\n```\ninviate dagli Operatori Economici. alla Stazione Appaltante di acquisire maggiori informazioni tecniche ed operative nella preparazione delle Procedure di Gara; agli Operatori Economici di raccogliere informazioni rilevanti sull'appalto in fase di definizione. Riservata . documento strutturato e inviare quest’ultimo in approvazione al Responsabile del Procedimento (R.U.P.) - se diverso dall’Utente collegato - il quale potrà poi procedere alla pubblicazione dello stesso. cliccare sulla sezione Consultazioni Preliminari di Mercato e successivamente sulla voce Consultazioni Preliminari di Mercato .\n```\n\nFonte: Guida_Rapida_Migrazione_Utenti_SA.pdf - Pagina 7 - Sezione 'None'\n```\nSe sei già registrato ed operativo come utente di una Stazione Appaltante sulla piattaforma EmPULIA, la tua utenza è stata migrata anche sulla nuova piattaforma Se sei già registrato ed operativo come utente di una Stazione Appaltante sulla piattaforma EmPULIA, la tua utenza è stata migrata anche sulla nuova piattaforma Hai dunque ricevuto via email la nuova terna di credenziali valide solo per la nuova piattaforma Hai dunque ricevuto via email la nuova terna di credenziali valide solo per la nuova piattaforma La vecchia piattaforma sarà accessibile con le consuete modalità che già utilizzi La vecchia piattaforma sarà accessibile con le consuete modalità che già utilizzi Entra nella nuova piattaforma utilizzando la terna di credenziali che hai ricevuto Entra nella nuova piattaforma utilizzando la terna di credenziali che hai ricevuto Segui i passaggi descritti di seguito per poter essere subito operativo anche sulla nuova piattafoma Segui i passaggi descritti di seguito per poter essere subito operativo anche sulla nuova piattafoma password rispettando i criteri di sicurezza richiesti ed elencati password rispettando i criteri di sicurezza richiesti ed elencati ad un set molto limitato di funzionalità ad un set molto limitato di funzionalità (angolo alto a destra) (angolo alto a destra) Ricorda che: \uf0d8 Se selezioni Punto Istruttore, dovrai obbligatoriamente indicare un approvatore di riferimento \uf0d8 Se selezioni Punto Ordinante o RUP PDG dovrai generare un pdf riepilogativo , da firmare digitalmente e riallegare firmato per poter \uf0d8 Se selezioni RUP PDG dovrai obbligatoriamente allegare l’ Atto di nomina o idoneità \uf0d8 Se selezioni più ruoli, devi indicare quello prevalente Ricorda che: \uf0d8 Se selezioni Punto Istruttore, dovrai obbligatoriamente indicare un approvatore di riferimento \uf0d8 Se selezioni Punto Ordinante o RUP PDG dovrai generare un pdf riepilogativo , da firmare digitalmente e riallegare firmato per poter \uf0d8 Se selezioni RUP PDG dovrai obbligatoriamente allegare l’ Atto di nomina o idoneità \uf0d8 Se selezioni più ruoli, devi indicare quello prevalente Se non trovi nell’elenco il tuo approvatore, molto probabilmente lo stesso non ha completato la assegnato il ruolo corretto Se non trovi nell’elenco il tuo approvatore, molto probabilmente lo stesso non ha completato la assegnato il ruolo corretto Indica dunque: \uf0d8 Struttura di Appartenenza (richiesto solo per alcuni Enti) \uf0d8 Almeno un approvatore di riferimento (solo se sei Punto Istruttore) Indica dunque: \uf0d8 Struttura di Appartenenza (richiesto solo per alcuni Enti) \uf0d8 Almeno un approvatore di riferimento (solo se sei Punto Istruttore) Se sei Punto Ordinante o RUP PDG devi inoltre cliccare su Genera pdf , firmare digitalmente il documento, riallegarlo firmato tramite Allega pdf firmato . Se hai già generato il pdf e vuoi fare modifiche al contenuto, Se sei Punto Ordinante o RUP PDG devi inoltre cliccare su Genera pdf , firmare digitalmente il documento, riallegarlo firmato tramite Allega pdf firmato .\n```\n\nFonte: SA_ConfigurazioneDGUE.pdf - Pagina 7 - Sezione 'SPECIALIZZAZIONE FACOLTATIVA DI ALTRI MODULI'\n```\nManuale SA | Configurazione del DGUE Manuale SA | Configurazione del DGUE Se si disattiva una Parte, vengono disabilitate anche le Sezioni ed i Moduli Richieste relativi; se si disattiva una Sezione, vengono disabilitati tutti i Moduli Richieste relativi. Altrimenti si può procedere alla ATTENZIONE : se le sezioni/moduli vengono lasciati attivi, al fornitore potrebbe venir richiesta la compilazione obbligatoria delle risposte per quei moduli. Pertanto, si segnala l’opportunità di disattivare sezioni/moduli non pertinenti o per le quali non interessa conoscere il dato ai fini della gara in composizione. La colonna Indice fa riferimento all’indice previsto dalla tassonomia AGID La colonna Tipologia indica se si tratta di Parte, Sezione o Modulo Richiesta. La colonna Descrizione contiene la descrizione prevista secondo tassonomia AGID. Nella colonna Esito Riga vengono visualizzate icone rosse o verdi in prossimità delle informazioni che richiedono un inserimento di dati obbligatori da parte della Stazione Appaltante. Il bollino rosso indica che una o più informazioni obbligatorie non sono presenti ed andranno compilate dalla SA cliccando sulla lente in corrispondenza della colonna Apri (vedi immagine precedente). In particolare, in prossimità delle informazioni relative a Identità del committente , l’icona risulta essere già verde in quanto le informazioni vengono ereditate in automatico dalla gara. singoli Moduli Richieste, ed in particolare per: Visualizzare l’anteprima della domanda posta al fornitore; Completare informazioni mancanti non obbligatorie o specificare criteri minimi di selezione (es. fatturato, numero di referenze, abilitazioni o certificazioni ecc.) richiesti. Con riferimento ai valori relativi ai criteri minimi di selezione, che la SA dovrebbe specificare modulo per modulo, si segnala che la piattaforma consente comunque la non definizione degli stessi all’interno del DGUE strutturato, riportando la precisazione: Se il Requisito minimo non è valorizzato far riferimento alla documentazione di gara. Tale impostazione semplifica la compilazione del DGUE per la SA, rendendo di chiaramente riportati nella documentazione di gara.\n```\n\nFonte: Guida_Rapida_Migrazione_Utenti_SA.pdf - Pagina 9 - Sezione 'None'\n```\nSe hai già generato il pdf e vuoi fare modifiche al contenuto, Gli altri campi sono facoltativi Gli altri campi sono facoltativi Effettua il log-out e successivamente rientra con le tue credenziali Effettua il log-out e successivamente rientra con le tue credenziali Troverai nel menu di sinistra tutti i gruppi funzionali a cui sei abilitato sulla base del ruolo assegnato Troverai nel menu di sinistra tutti i gruppi funzionali a cui sei abilitato sulla base del ruolo assegnato Dopo aver caricato il file firmato, clicca su Conferma Dopo aver caricato il file firmato, clicca su Conferma Per maggiori informazioni consulta su http://www.empulia.it i manuali e gli altri strumenti di apprendimento pubblicati nella sezione dedicata alla Migrazione Piattaforma Per maggiori informazioni consulta su http://www.empulia.it i manuali e gli altri strumenti di apprendimento pubblicati nella sezione dedicata alla Migrazione Piattaforma Nella stessa sezione troverai a breve anche degli eventi formativi (webinar) dedicati al passaggio alla nuova piattaforma, ed ai quali ti invitiamo a partecipare! Nella stessa sezione troverai a breve anche degli eventi formativi (webinar) dedicati al passaggio alla nuova piattaforma, ed ai quali ti invitiamo a partecipare!\n```\n\nFonte: GuidaRapidaMigrazioneOperatoriEconomici.pdf - Pagina 10 - Sezione 'None'\n```\nLe modifiche dovranno essere Sulla nuova piattaforma sono previsti tre diversi Albi Fornitori: Sulla nuova piattaforma sono previsti tre diversi Albi Fornitori: L’albo delle imprese che sulla vecchia piattaforma era unico, è dunque stato diviso in due: Forniture/Servizi e Le abilitazioni sono state migrate sulla base delle categorie selezionate: L’albo delle imprese che sulla vecchia piattaforma era unico, è dunque stato diviso in due: Forniture/Servizi e Le abilitazioni sono state migrate sulla base delle categorie selezionate: Se eri abilitato solo su categorie di beni/servizi, ora sarai abilitato sull’Albo Forniture e Servizi Se eri abilitato solo su categorie di beni/servizi, ora sarai abilitato sull’Albo Forniture e Servizi Se eri abilitato solo su categorie SOA, ora sarai abilitato sull’Albo dei Lavori Pubblici Se eri abilitato solo su categorie SOA, ora sarai abilitato sull’Albo dei Lavori Pubblici Se eri abilitato sia su categorie di beni/servizi che SOA, ora sarai abilitato su entrambi gli Albi Se eri abilitato sia su categorie di beni/servizi che SOA, ora sarai abilitato su entrambi gli AlbiRicordacheorasonodue Albi totalmenteseparati, con statie scadenzeeventualmentedifferentiRicordacheorasonodue Albi totalmenteseparati, con statie scadenzeeventualmentedifferenti Verifica le categorie per le quali sei attualmente abilitato, entrando in Anagrafica , e poi in Classi di iscrizione (per Forniture/Servizi) o Categorie SOA (per Lavori Pubblici) L’albero delle categorie non ha subito variazioni sulla nuova piattaforma Verifica le categorie per le quali sei attualmente abilitato, entrando in Anagrafica , e poi in Classi di iscrizione (per Forniture/Servizi) o Categorie SOA (per Lavori Pubblici) L’albero delle categorie non ha subito variazioni sulla nuova piattaforma Ricorda che – a partire dal tuo prossimo rinnovo all’Albo - sulla nuova piattaforma sarà richiesto di selezionare le categorie di massimo dettaglio e non sarà più possible scegliere nodi intermedi di categorie Ricorda che – a partire dal tuo prossimo rinnovo all’Albo - sulla nuova piattaforma sarà richiesto di selezionare le categorie di massimo dettaglio e non sarà più possible scegliere nodi intermedi di categorie Sarai comunque ricercabile ed invitabile a gare per le categorie di tuo interesse anche se al momento sei abilitato a  categorie di livello intermedio! Sarai comunque ricercabile ed invitabile a gare per le categorie di tuo interesse anche se al momento sei abilitato a  categorie di livello intermedio! Per le aziende migrate la data di scadenza del primo rinnovo è fissata d’ufficio al 31/12/2023 Per le aziende migrate la data di scadenza del primo rinnovo è fissata d’ufficio al 31/12/2023 SELEZIONABILI SELEZIONABILIEsempioEsempio Per creare un nuovo utente fai una nuova Per creare un nuovo utente fai una nuova p.iva dell’azienda già registrata e negli step successive inserisci i dati del nuovo utente. In questa fase non sarà possibile variare i dati anagrafici precaricati.\n```\n\nFonte: SA_Registrazione_gestione_utente.pdf - Pagina 11 - Sezione 'MODIFICA RUOLO'\n```\nSistema inibirà l’accesso alle altre funzioni finché tale richiesta non verrà evasa (il comando Continua, in questo caso, non produrrà alcuna azione). Per proseguire è necessario quindi fare clic sull’oggetto Nella schermata che verrà mostrata, inserire la password ricevuta per e-mail nel campo Vecchia Password e digitare una nuova password nel campo Nuova Password , rispettando i criteri elencati. Digitare nuovamente la password scelta nel campo Controllo Password e fare clic sul comando Conferma . limitati al solo profilo base (Utente Ente Base). Per completare la profilazione dell’utente, definirne il ruolo e dunque abilitarlo alle funzionalità di sua le istruzioni riportate nel paragrafo successivo.\n```\n\nFonte: SA_Registrazione_gestione_utente.pdf - Pagina 12 - Sezione 'MODIFICA RUOLO'\n```\nattivabile a discrezione dell’utente ogni volta che si renda necessario effettuare modifiche che richiedono un’autorizzazione o una formalizzazione, quali ad esempio l’associazione ad altri Enti o strutture o il ruolo associato all’utente. In alto alla schermata che verrà mostrata, è predisposta una toolbar per gestire il processo: Conferma per terminare le operazioni e rendere effettiva l’assegnazione del ruolo o dei ruoli selezionati. Stampa per stampare il documento visualizzato. Esporta in Excel per esportare in formato xls le informazioni visualizzate sulla schermata. Chiudi per tornare alla schermata precedente. ed Altri dati.\n```\n\nFonte: SA_ConfigurazioneDGUE.pdf - Pagina 13 - Sezione 'SALVATAGGIO DEL DGUE'\n```\nManuale SA | Configurazione del DGUE Manuale SA | Configurazione del DGUE Alcuni moduli prevedono infine l’automatica attivazione di gruppi di domande dipendenti, legate al quanto configurato precedentemente. Ad es. modulo Altri requisiti economici e finanziari , come da immagine seguente. Una volta che sono state predisposte correttamente tutte le sezioni da includere nel documento, cliccare sul comando Salva posizionato nella toolbar in alto nella schermata.\n```\n\nFonte: SA_CPM.pdf - Pagina 15 - Sezione 'ELIMINAZIONE DI UNA CONSULTAZIONE IN LAVORAZIONE'\n```\nPer richiedere la firma digitale della documentazione richiesta, spuntare la casella in corrispondenza del documento di interesse nella colonna Richiedi Firma . corrispondenza della riga di interesse. Per copiare una riga già predisposta all'interno della tabella Elenco documenti , cliccare sul comando modificare la descrizione e le caratteristiche tecniche di obbligatorietà e di richiesta della firma digitale e di determinate estensioni del file. Per specificare la tipologia di estensione ammessa per ogni documentazione predisposta, cliccare sul relativo comando nella colonna Tipo File . Di default, sono previste le estensioni .pdf e .p7m. Per modificare i tipi di file ammessi è possibile procedere mediante due modalità: digitare la parola chiave nell'apposito campo per effettuare la ricerca dell'estensione di interesse, cliccare sul comando Cerca , selezionare una o più estensioni tra quelle presenti dall'elenco generato dalla ricerca e cliccare sul comando Conferma . ricercare l'estensione di interesse tra quelle presenti nell'elenco proposto e selezionarla cliccando sulla relativa check box. Cliccare infine sul comando Conferma . dagli operatori economici. Nella sezione verrà infatti mostrata la tabella Elenco Utenti , in cui dovrà essere indicato, per ogni utente, il ruolo assegnato. Poiché è già presente una riga il cui Ruolo è impostato di default su Quesiti , sarà sufficiente procedere con l'indicazione del nominativo dell'utente. Per aggiungere un riferimento, cliccare sul comando Aggiungi e, nella riga predisposta, selezionare il nominativo dell'Utente tra quelli proposti e indicare il Ruolo che gli si intende affidare.\n```\n\nFonte: SA_CPM.pdf - Pagina 17 - Sezione 'SEZIONI'\n```\nNel caso in cui vengano inserite eventuali Note Approvatore e/o Allegati , all'atto del salvataggio/invio della consultazione, nella sezione Cronologia la tabella Operazioni Effettuate verrà alimentata automaticamente. Nella sezione Documenti è possibile visualizzare tutti i documenti generati da piattaforma e collegati alla consultazione, come ad esempio eventuali comunicazioni e/o documenti di Rettifica e Proroga (anche solo in fase di lavorazione). Durante la fase di indizione della consultazione, e dunque di\n```\n\nFonte: SA_CPM.pdf - Pagina 33 - Sezione 'CONSULTAZIONE DELLE RISPOSTE'\n```\nPredisposto correttamente il contenuto della comunicazione, cliccare sul comando Invio posizionato nella toolbar in alto nella schermata per procedere con l'invio. È possibile visualizzare tutte le comunicazioni integrative inviate, nella sezione Documenti. Per visualizzare le eventuali Risposte alle comunicazioni integrative inviate dagli Operatori Economici, è possibile procedere attraverso due modalità: dalla sezione Documenti ; Consultazione Preliminare. inviate a più Operatori Economici mentre la seconda modalità consente la visualizzazione della Risposta in caso di comunicazione integrativa inviata al singolo Operatore Economico.\n```""]","Non è possibile determinare con certezza se le modifiche alla data di scadenza tramite le funzioni 'Modifica Contratto' o 'Rinnovo' vengano comunicate automaticamente ad ANAC basandosi esclusivamente sulle informazioni fornite.

Le informazioni estratte dal Knowledge Graph si concentrano principalmente su:

*   Funzionalità di modifica di documenti e dati all'interno della piattaforma EmPULIA.
*   Gestione degli utenti e dei loro ruoli.
*   Configurazione del DGUE (Documento di Gara Unico Europeo).
*   Gestione delle consultazioni preliminari di mercato.

Nessuna delle sezioni o delle relazioni individuate menziona specificamente l'integrazione con ANAC o la trasmissione automatica di dati relativi a modifiche contrattuali o rinnovi. Per rispondere con certezza, sarebbe necessario consultare documentazione specifica relativa alle funzionalità di ""Modifica Contratto"" e ""Rinnovo"" e alla loro integrazione con sistemi esterni come quelli di ANAC.","No, le modifiche non vengono comunicate automaticamente. Le funzionalità di 'Modifica Contratto' e 'Funzioni' (come Rinnovo ed Estensione) non prevedono l'invio di schede con i dati modificati alla Piattaforma Contratti Pubblici (PCP) di ANAC. È quindi responsabilità dell'utente operare anche tramite il modulo 'Esecuzione' per adempiere a tali obblighi informativi.",0.6,0.0,0.0,0.0
Ho più aggiudicazioni per lotti diversi vinti dallo stesso operatore. Come posso creare un unico contratto per tutte?,"[""Informazioni rilevanti trovate nel Knowledge Graph:\n\n✓ **Entità trovata**: note contratto\n  • Tipo: InterfacciaUtenteElemento\n  • Descrizione: Campo di testo per inserire note relative al contratto.\n  • Occorrenze nel testo: 1\n  • Varianti trovate: Note per il contratto\n\n→ **Relazione**: note contratto --[eDescrittoIn]--> creazione ordinativo fornitura\n  • Dettaglio: La sezione della guida EmPULIA intitolata 'CREAZIONE ORDINATIVO DI FORNITURA' (ID: SA_EmissioneGestione_OdF.pdf_section_3) da cui provengono queste informazioni.\n\n✓ **Entità trovata**: scheda sottoscrizione contratto\n  • Tipo: DocumentoSistema\n  • Descrizione: Documento di sottoscrizione del contratto.\n  • Occorrenze nel testo: 1\n  • Varianti trovate: Scheda di Sottoscrizione Contratto\n\n→ **Relazione**: scheda sottoscrizione contratto --[precede]--> invio scheda sottoscrizione contratto\n  • Dettaglio: Azione di invio della scheda di sottoscrizione contratto.\n\n→ **Relazione**: scheda sottoscrizione contratto --[eDescrittoIn]--> creazione ordinativo fornitura\n  • Dettaglio: La sezione della guida EmPULIA intitolata 'CREAZIONE ORDINATIVO DI FORNITURA' (ID: SA_EmissioneGestione_OdF.pdf_section_3) da cui provengono queste informazioni.\n\n✓ **Entità trovata**: invio scheda sottoscrizione contratto\n  • Tipo: AzioneUtente\n  • Descrizione: Azione di invio della scheda di sottoscrizione contratto.\n  • Occorrenze nel testo: 1\n  • Varianti trovate: Invio Scheda di Sottoscrizione Contratto\n\n→ **Relazione**: invio scheda sottoscrizione contratto --[precede]--> scheda sottoscrizione contratto\n  • Dettaglio: Documento di sottoscrizione del contratto.\n\n→ **Relazione**: invio scheda sottoscrizione contratto --[eDescrittoIn]--> creazione ordinativo fornitura\n  • Dettaglio: La sezione della guida EmPULIA intitolata 'CREAZIONE ORDINATIVO DI FORNITURA' (ID: SA_EmissioneGestione_OdF.pdf_section_3) da cui provengono queste informazioni.\n\n✓ **Entità trovata**: modulo esecuzione contratto\n  • Tipo: PiattaformaModulo\n  • Descrizione: Il modulo per comunicare le modifiche contrattuali ad ANAC.\n  • Occorrenze nel testo: 3\n  • Varianti trovate: Modulo di esecuzione del contratto, Modulo Esecuzione Contratto\n\n→ **Relazione**: modulo esecuzione contratto --[richiedeInput]--> comunicazione ad anac\n  • Dettaglio: Azione di comunicazione ad ANAC dell'evento di annullamento.\n\n→ **Relazione**: modulo esecuzione contratto --[eDescrittoIn]--> annullamento ordinativo fornitura\n  • Dettaglio: Funzionalità per annullare un ordinativo di fornitura (gestore convenzioni).\n\n→ **Relazione**: modulo esecuzione contratto --[eDescrittoIn]--> creazione ordinativo fornitura\n  • Dettaglio: La sezione della guida EmPULIA intitolata 'CREAZIONE ORDINATIVO DI FORNITURA' (ID: SA_EmissioneGestione_OdF.pdf_section_3) da cui provengono queste informazioni.\n\n→ **Relazione**: modulo esecuzione contratto --[puoEseguire]--> rup\n  • Dettaglio: Responsabile Unico del Procedimento.\n\n✓ **Entità trovata**: direttore dell’esecuzione contratto\n  • Tipo: RuoloUtente\n  • Descrizione: Il direttore dell'esecuzione del contratto per una specifica procedura sulla piattaforma EmPULIA.\n  • Occorrenze nel testo: 1\n  • Varianti trovate: Direttore dell’Esecuzione del Contratto\n\n→ **Relazione**: direttore dell’esecuzione contratto --[eDescrittoIn]--> funzioni\n  • Dettaglio: Le funzioni disponibili nella piattaforma EmPULIA.\n\n✓ **Entità trovata**: contratto\n  • Tipo: DocumentoSistema\n  • Descrizione: Un contratto esistente per il lotto da revocare.\n  • Occorrenze nel testo: 28\n  • Varianti trovate: Contratto, CONTRATTO\n\n→ **Relazione**: contratto --[siApplicaA]--> filtri ricerca\n  • Dettaglio: Box dei filtri di ricerca per definire i parametri di ricerca.\n\n→ **Relazione**: contratto --[siApplicaA]--> scheda\n  • Dettaglio: Le schede relative agli appalti.\n\n→ **Relazione**: contratto --[siApplicaA]--> scrittura privata\n  • Dettaglio: La tipologia di contratto in forma di scrittura privata.\n\n→ **Relazione**: contratto --[richiedeInput]--> creazione stato avanzamento\n  • Dettaglio: La funzionalità per creare un nuovo stato di avanzamento.\n\n→ **Relazione**: contratto --[riguarda]--> data scadenza\n  • Dettaglio: Data di scadenza del rinnovo dell'albo.\n\n→ **Relazione**: contratto --[riguarda]--> dettaglio contratto\n  • Dettaglio: Pagina di dettaglio del contratto accessibile dalla piattaforma EmPULIA.\n\n→ **Relazione**: contratto --[riguarda]--> conclusione esecuzione\n  • Dettaglio: Documento di conclusione dell'esecuzione di un contratto.\n\n→ **Relazione**: contratto --[riguarda]--> filtro contratti\n  • Dettaglio: Funzionalità di filtro dei contratti per stato di affidamento.\n\n→ **Relazione**: contratto --[eEseguitaDa]--> fornitore\n  • Dettaglio: Utente registrato sulla piattaforma EmPULIA."", ""--- Testo Originale dalle Guide per Contesto Aggiuntivo ---\n\nFonte: SA_EmissioneGestione_OdF.pdf - Pagina 3 - Sezione 'MODIFICA'\n```\nCrea Ordinativo ................................................................................................................. 8 INVIO .................................................................................................................................... 23 ANNULLAMENTO ORDINATIVO FORNITURA (GESTORE CONVENZIONI) .......................................................................................................................... 36\n```\n\nFonte: SA_FunzioniBando.pdf - Pagina 4 - Sezione 'FUNZIONI'\n```\npubblicato Pubblica Amministrazione Operatore Economico Stazione Appaltante Raggruppamento temporaneo di imprese Responsabile Unico di Progetto Direttore dell’Esecuzione del Contratto Piattaforma Contratti Pubblici di ANAC Procedura di aggiudicazione\n```\n\nFonte: SA_EmissioneGestione_OdF.pdf - Pagina 5 - Sezione 'CREAZIONE ORDINATIVO DI FORNITURA'\n```\nAttraverso la piattaforma EmPULIA è possibile: accordi quadro e convenzioni centralizzate; centralizzate; della scheda AD4 partendo dall’OdF configurato; Tali funzionalità sono descritte dal par. 2 al par. 11. accordo quadro. La funzionalità è descritta al par. 12 Per ricercare i prodotti/servizi presenti nelle convenzioni attive nel Negozio Elettronico ed avviare il cliccare sul gruppo funzionale Negozio Elettronico e successivamente sulla voce Creazione Ordinativi di Fornitura .\n```\n\nFonte: GuidaRapidaMigrazioneOperatoriEconomici.pdf - Pagina 7 - Sezione 'None'\n```\nFORNITORI Se sei già registrato come fornitore sulla piattaforma EmPULIA, la tua utenza è stata migrata anche sulla nuova piattaforma Se sei già registrato come fornitore sulla piattaforma EmPULIA, la tua utenza è stata migrata anche sulla nuova piattaforma Hai dunque ricevuto via email la terna di Password) che saranno valide solo per la nuova piattaforma Hai dunque ricevuto via email la terna di Password) che saranno valide solo per la nuova piattaforma La vecchia piattaforma sarà accessibile con le consuete modalità che già utilizzi La vecchia piattaforma sarà accessibile con le consuete modalità che già utilizzi Entra nella nuova piattaforma utilizzando la terna di credenziali che hai ricevuto Entra nella nuova piattaforma utilizzando la terna di credenziali che hai ricevuto Segui i passaggi descritti di seguito per poter essere subito operativo anche sulla nuova piattafoma Segui i passaggi descritti di seguito per poter essere subito operativo anche sulla nuova piattafoma password rispettando i criteri di sicurezza richiesti ed elencati password rispettando i criteri di sicurezza richiesti ed elencati Le procedure pubblicate sulla vecchia piattaforma saranno accessibili con le precedenti modalità. Le procedure pubblicate sulla vecchia piattaforma saranno accessibili con le precedenti modalità. Tuttavia ricorda che potrebbe essere necessario o utile effettuare alcune ulteriori operazioni, descritte di seguito Tuttavia ricorda che potrebbe essere necessario o utile effettuare alcune ulteriori operazioni, descritte di seguito Accertati che i dati di contatto (telefono e/o email) della tua utenza siano corretti. Clicca su Utente in alto a destra Accertati che i dati di contatto (telefono e/o email) della tua utenza siano corretti. Clicca su Utente in alto a destra Controlla i dati ed eventualmente clicca su numeri di telefono. Controlla i dati ed eventualmente clicca su numeri di telefono. Accertati che i dati (es. Telefono) della tua azienda siano corretti. Clicca su Anagrafica in alto a destra Accertati che i dati (es. Telefono) della tua azienda siano corretti. Clicca su Anagrafica in alto a destra Controlla i dati ed eventualmente clicca su fax e sito web Controlla i dati ed eventualmente clicca su fax e sito web P.IVA, forma giuridica, sedi ecc.) entra dal menu di sinistra in P.IVA, forma giuridica, sedi ecc.) entra dal menu di sinistra in Potrai apportare le modifiche richieste, ma tali modifiche non saranno immediatamente operative. Infatti ti verrà richiesto di generare un pdf con digitalmente e di riallegarlo firmato. Clicca su Invia al termine. Le modifiche dovranno essere Potrai apportare le modifiche richieste, ma tali modifiche non saranno immediatamente operative. Infatti ti verrà richiesto di generare un pdf con digitalmente e di riallegarlo firmato. Clicca su Invia al termine.\n```\n\nFonte: SA_Gestione_ Contratto.pdf - Pagina 7 - Sezione 'CONTRATTO'\n```\nVers.3 Effettuato l’accesso al dettaglio del contratto, in cima al documento, sarà disponibile una toolbar con i seguenti comandi per la gestione del documento: funzionale Gestione RdO/Procedure di gara.Per riprendere il documento, cliccare sull’icona nella colonna Apri; Invio in approvazione : In attesa di prossimi sviluppi, si consiglia di non utilizzare tale comando; RUP Esecuzione : per selezionare l’utente della Stazione Appaltante che si occuperà dell’esecuzione in qualità di RUP. In attesa di prossimi sviluppi, l’assegnazione di tale ruolo non ha impatti sul modulo di esecuzione. dell’invio/conferma del contratto; eventualmente modificare/personalizzare ed allegare al documento di contratto; Funzioni : per rinnovare la Data Scadenza e/o estendere il Totale/Valore contratto, attraverso le rispettive funzioni di Rinnovo ed Estensione, a seguito dell’invio/conferma del contratto; Chiudi : per tornare sulla pagina precedente. Alcuni dei comandi indicati potrebbero non essere attivabili (in grigio) in base allo stato del Alcuni dei dati richiesti nel documento sono importati dalla procedura telematica che origina il\n```\n\nFonte: SA_ConfigurazioneModelli.pdf - Pagina 8 - Sezione 'INTRODUZIONE'\n```\nManuale SA | Configurazione del Modello di Offerta Manuale SA | Configurazione del Modello di Offerta Vers.2 Esporta in xls Il comando Esporta in xls consente di esportare il modello in un file xlsx per una migliore consultazione dello stesso. Per procedere con il download del file, cliccare quindi sul comando predisposto in alto alla tabella. Giù e Su I comandi consentono di spostare l’ordine delle colonne nella tabella Elenco Prodotti . Il comando Vedi viene mostrato in caso di attributo Gerarchico o Dominio e consente di visualizzare le informazioni che è possibile selezionare tra quelle proposte attraverso, per l’appunto, una struttura gerarchica. Per visualizzare tali informazioni, cliccare sulla lente. Se si vuole eliminare un’informazione presente nella tabella Elenco Prodotti , è necessario aprire il dettaglio del modello attraverso il comando e, nella tabella Attributi da usare nelle fasi della gara Individuata quindi la riga relativa all’attributo da eliminare, cliccare sulla corrispettiva icona del bidone. Ad esempio, se il modello selezionato per la gara prevede l’attributo “Misure”, che nella procedura specifica non si intende richiedere ai partecipanti, si dovrà rimuoverlo dal dettaglio del modello. Ci sono alcuni attributi che non potranno comunque essere rimossi. Nella colonna Attributo , viene indicata la tipologia dell’informazione che verrà richiesta al RUP o all’OE nelle diverse fasi: Text: informazioni di tipo testuale; Number: informazioni di tipo numerico (es. quantità o prezzo); si precisa che per i campi di tipo numerico intero non viene richiesto di specificare il numero di decimali. Attach: informazioni di tipo allegato; Domain: scelta multipla tra più voci proposte; Gerarchico : informazioni da selezionare tra quelle proposte attraverso una struttura gerarchica. Alcuni attributi sono non editabili come, ad esempio, Text – DESCRIZIONE e Number – QUANTITA , altri invece possono essere personalizzati e quindi appariranno editabili come ad esempio Manuale SA | Configurazione del Modello di Offerta Manuale SA | Configurazione del Modello di Offerta Vers.2 In particolare, per alcuni modelli sono stati previsti degli attributi di tipo Text e Number generici che le stazioni appaltanti possono personalizzare inserendo una descrizione per l’informazione richiesta. Per aggiungere una nuova riga che consente di specializzare un nuovo attributo, cliccare sul comando Aggiungi attributo posizionato sopra alla tabella. In fondo alla tabella Attributi da usare nelle fasi della gara , verrà predisposta una nuova riga per la definizione dell’attributo per il quale dovranno essere compilate le informazioni richieste prestando attenzione a non selezionare attributi già previsti nel modello specifico. Non è consentito l'inserimento di attributi duplicati (es. due “Attach – ALLEGATO 1” nello stesso modello). Nella colonna Descrizione Attributo si potrà indicare il nome dell’attributo che gli utenti visualizzeranno.\n```\n\nFonte: SA_Modulo_Esecuzione_Contratti.pdf - Pagina 8 - Sezione 'CONTRATTI STIPULATI'\n```\n(Schede AD5, AD3 o A3_6) per cui non è già stata inviata la scheda CO2 (conclusione esecuzione) già stata inviata la scheda SC1 (sottoscrizione del contratto), ma per cui non sono state già inviate schede successive. Per maggiori informazioni sull’invio della scheda di sottoscrizione contratto, si faccia riferimento al manuale dedicato al contratto. attraverso l’apposita box dei filtri di ricerca, definendo i parametri e cliccando su Cerca .\n```\n\nFonte: GuidaRapidaMigrazioneOperatoriEconomici.pdf - Pagina 10 - Sezione 'None'\n```\nLe modifiche dovranno essere Sulla nuova piattaforma sono previsti tre diversi Albi Fornitori: Sulla nuova piattaforma sono previsti tre diversi Albi Fornitori: L’albo delle imprese che sulla vecchia piattaforma era unico, è dunque stato diviso in due: Forniture/Servizi e Le abilitazioni sono state migrate sulla base delle categorie selezionate: L’albo delle imprese che sulla vecchia piattaforma era unico, è dunque stato diviso in due: Forniture/Servizi e Le abilitazioni sono state migrate sulla base delle categorie selezionate: Se eri abilitato solo su categorie di beni/servizi, ora sarai abilitato sull’Albo Forniture e Servizi Se eri abilitato solo su categorie di beni/servizi, ora sarai abilitato sull’Albo Forniture e Servizi Se eri abilitato solo su categorie SOA, ora sarai abilitato sull’Albo dei Lavori Pubblici Se eri abilitato solo su categorie SOA, ora sarai abilitato sull’Albo dei Lavori Pubblici Se eri abilitato sia su categorie di beni/servizi che SOA, ora sarai abilitato su entrambi gli Albi Se eri abilitato sia su categorie di beni/servizi che SOA, ora sarai abilitato su entrambi gli AlbiRicordacheorasonodue Albi totalmenteseparati, con statie scadenzeeventualmentedifferentiRicordacheorasonodue Albi totalmenteseparati, con statie scadenzeeventualmentedifferenti Verifica le categorie per le quali sei attualmente abilitato, entrando in Anagrafica , e poi in Classi di iscrizione (per Forniture/Servizi) o Categorie SOA (per Lavori Pubblici) L’albero delle categorie non ha subito variazioni sulla nuova piattaforma Verifica le categorie per le quali sei attualmente abilitato, entrando in Anagrafica , e poi in Classi di iscrizione (per Forniture/Servizi) o Categorie SOA (per Lavori Pubblici) L’albero delle categorie non ha subito variazioni sulla nuova piattaforma Ricorda che – a partire dal tuo prossimo rinnovo all’Albo - sulla nuova piattaforma sarà richiesto di selezionare le categorie di massimo dettaglio e non sarà più possible scegliere nodi intermedi di categorie Ricorda che – a partire dal tuo prossimo rinnovo all’Albo - sulla nuova piattaforma sarà richiesto di selezionare le categorie di massimo dettaglio e non sarà più possible scegliere nodi intermedi di categorie Sarai comunque ricercabile ed invitabile a gare per le categorie di tuo interesse anche se al momento sei abilitato a  categorie di livello intermedio! Sarai comunque ricercabile ed invitabile a gare per le categorie di tuo interesse anche se al momento sei abilitato a  categorie di livello intermedio! Per le aziende migrate la data di scadenza del primo rinnovo è fissata d’ufficio al 31/12/2023 Per le aziende migrate la data di scadenza del primo rinnovo è fissata d’ufficio al 31/12/2023 SELEZIONABILI SELEZIONABILIEsempioEsempio Per creare un nuovo utente fai una nuova Per creare un nuovo utente fai una nuova p.iva dell’azienda già registrata e negli step successive inserisci i dati del nuovo utente. In questa fase non sarà possibile variare i dati anagrafici precaricati.\n```\n\nFonte: SA_Gestione_ Contratto.pdf - Pagina 11 - Sezione 'CONTRATTO'\n```\nVers.3 Firmato sia dalla stazione appaltante che dall’operatore economico ; al momento dell’invio file sia presente la firma digitale di quest’ultima mentre, al momento della conferma del caricato dalla S.A., con l’apposizione anche della propria firma digitale; dell’O.E., non viene effettuato nessun controllo in merito al contenuto del file, pertanto l’O.E. può allegare anche un allegato differente da quello caricato dalla S.A. Viene tuttavia verificato che sul file allegato sia presente la firma digitale da parte dell’operatore economico. obbligatori, prima di inviare al concorrente aggiudicatario il documento di stipula, occorre procedere Lo Stato del documento viene aggiornato da In lavorazione a Inviato . specifico comando Firmatario , cliccare sul comando Invia in approvazione posizionato nella toolbar in alto nella schermata. Un messaggio di informazione a video confermerà l'operazione. Il comando verrà attivato solo a seguito della selezione del firmatario. Lo Stato del documento viene aggiornato da In lavorazione a In approvazione e per procedere con Appaltante si colleghi al portale EmPULIA, acceda al dettaglio del documento (dal gruppo funzionale Procedure di gara e dalla voce Contratto) e che clicchi sul comando Invia posizionato nella toolbar in alto nel documento. Lo Stato del documento viene aggiornato da In lavorazione a Inviato . la cui fase cambia da In aggiudicazione a Chiusa . Per i contratti in forma di Scrittura Privata, il documento si intende validamente perfezionato al momento in cui i documenti firmati digitalmente dall'operatore economico vengono caricati a sistema per accettazione.\n```\n\nFonte: SA_Fascicolo_Virtuale_OE.pdf - Pagina 12 - Sezione 'FASCICOLO VIRTUALE OPERATORE ECONOMICO'\n```\ndella richiesta di accesso è consentito a seguito della finalizzazione del suddetto invio. Per tale ragione, nell’elenco verranno visualizzati esclusivamente gli appalti per cui sono state inviate correttamente tali schede e tutti gli affidamenti diretti per i quali le stesse non sono previste. A seguire, verrà visualizzato un messaggio di conferma, cliccare su Sì per proseguire.\n```\n\nFonte: SA_Trasferimento_ProceduraContratto_altroRUP.pdf - Pagina 12 - Sezione 'TRASFERISCI CONTRATTO'\n```\nManuale SA | Trasferimento di una procedura o di un contratto ad altro RUP mail e accedendo alla piattaforma, nel relativo gruppo funzionale e nella specifica Funzionalità Contratto trova il Contratto nello stato “ Da prendere in carico ”. È possibile filtrare i Contratti per Stato Affidamento ( Da prendere in Carico o Preso in Carico ) per velocizzare la ricerca. Il (nuovo) RUP dell’esecuzione dovrà selezionare il contratto da prendere in carico e cliccare sul comando Prendi In Carico . Inseriti i dati del contratto, il nuovo RUP Esecuzione potrà poi procede all’invio del Contratto al fornitore. Si ricorda che la presa in carico – per espressa regola tecnica di ANAC- comporta l’automatico trasferimento di tutti i contratti derivanti dalla procedura.\n```\n\nFonte: SA_Modulo_Esecuzione_Contratti.pdf - Pagina 13 - Sezione 'CONTRATTI IN ESECUZIONE'\n```\nPer poter creare uno stato di avanzamento è necessario selezionare la voce Funzioni nella toolbar, quindi selezionare Stato avanzamento . Per un dato contratto possono essere inviati più stati di avanzamento ma prima di poter inviarne uno nuovo il precedente, se presente, deve trovarsi in uno stato conclusivo, ovvero ‘ Confermato’ o ‘ Errore’ . La pagina di compilazione della scheda SA1 è composta dalla toolbar, dalla testata e dai campi propri della scheda. Nella toolbar sono presenti tre pulsanti: Salva, Invio, Chiudi .\n```\n\nFonte: SA_FunzioniBando.pdf - Pagina 15 - Sezione 'FUNZIONI'\n```\npubblicato Lo Stato del documento cambierà da In lavorazione ad Inviato ed un messaggio di informazione a video confermerà l'operazione. Cliccare su per chiudere il messaggio. Per annullare un documento di Rettifica non ancora inviato, cliccare invece sul comando Annulla presente nella toolbar in alto nella schermata. Il presente paragrafo descrive le modalità per revocare uno o più lotti di una procedura di gara multi lotto, in qualsiasi momento a partire dalla pubblicazione e fino all’aggiudicazione definitiva della stessa, attraverso la specifica funzione Revoca Lotto . Alla pubblicazione della revoca, EmPULIA trasmette alla PCP di ANAC l’avvenuta revoca attraverso l’invio della scheda PCP idonea. Se la procedura è sopra soglia, verrà contestualmente inviato al TED la relativa Change-notice . La revoca del lotto non è consentita se per il lotto da revocare esiste un contratto o una convenzione. Non è possibile applicare la Revoca Lotto se è in corso una Rettifica o una Proroga della Procedura di Gara in oggetto; i comandi verranno disabilitati fino alla conferma/annullamento della modifica in corso. schermata e successivamente su Revoca Lotto . Nella toolbar in alto al documento saranno presenti i comandi per la gestione dello stesso, già descritti nei paragrafi successivi.\n```\n\nFonte: SA_EmissioneGestione_OdF.pdf - Pagina 17 - Sezione 'CREAZIONE ORDINATIVO DI FORNITURA'\n```\nIn fondo alla schermata è inoltre possibile indicare eventuali Note per il contratto nell’apposito campo. Per aggiungere eventuali allegati - obbligatori e non – relativi all’emissione dell’ordinativo, cliccare sul comando Aggiungi Allegato e, nella riga che verrà aggiunta alla tabella, inserire la Descrizione del documento e cliccare sul comando per allegare il file. Per verificare il residuo della convenzione direttamente dal documento Ordinativo di Fornitura, cliccare sul comando Verifica Residuo posizionato nella toolbar in alto nella schermata (vedi fig.7). parte dell'utente che ha creato il documento. Visualizzata la tabella con tutti gli ordinativi creati/in fase di predisposizione, è possibile procedere all'eliminazione secondo due modalità:\n```\n\nFonte: SA_EmissioneGestione_OdF.pdf - Pagina 21 - Sezione 'CREAZIONE ORDINATIVO DI FORNITURA'\n```\nprodotti/servizi selezionati cliccando su Aggiungi Articolo e variando l’importo o la quantità dell’ordinativo. parte dell’Operatore Economico, e quindi prima dell’invio della scheda di sottoscrizione contratto\n```\n\nFonte: SA_EmissioneGestione_OdF.pdf - Pagina 23 - Sezione 'CREAZIONE ORDINATIVO DI FORNITURA'\n```\ndisabilitato, così come le altre funzioni disponibili. Inoltre, Lo Stato passerà da “ Pubblicato ” ad “ Annullato ”. è possibile eseguire l’annullamento del CIG, il comando quindi appare disabilitato. Dunque, si precisa che, in linea con quanto previsto da ANAC, la scheda ANN per gli OdF è trasmissibile fino all’accettazione dell’ordinativo da parte dell’OE.\n```\n\nFonte: SA_EmissioneGestione_OdF.pdf - Pagina 30 - Sezione 'CREAZIONE ORDINATIVO DI FORNITURA'\n```\nATTENZIONE : la funzionalità è differente da quella descritta nel par. 4. Infatti, in questo caso la riduzione avviene successivamente all’accettazione da parte dell’OE e dunque successivamente alla trasmissione della scheda SC1 ad ANAC. Effettuata la riduzione il RUP dovrà quindi avere cura di comunicare ad ANAC le modifiche contrattuali attraverso il modulo di esecuzione del contratto (vedi manuale dedicato). Fornitura, cliccare sull’icona dell’ordinativo di interesse. schermata. principale alcune informazioni, quali CIG e Data di scadenza . Indicare la Descrizione Ordinativo nell'apposito campo. In particolare, per aggiungere uno o più articoli oggetto dell'Ordinativo di Fornitura principale a cui si comando Aggiungi Articolo .\n```\n\nFonte: SA_EmissioneGestione_OdF.pdf - Pagina 35 - Sezione 'ANNULLAMENTO ORDINATIVO DI FORNITURA'\n```\ngià Accettato dall'Operatore Economico. ATTENZIONE : la funzionalità è differente da quella descritta nel par. 4. Infatti, in questo caso l’annullamento avviene successivamente all’accettazione da parte dell’OE e dunque successivamente alla trasmissione della scheda SC1 ad ANAC. Accettato l’annullamento da parte del gestore, il RUP dovrà quindi avere cura di comunicare ad ANAC l’evento attraverso il modulo di esecuzione del contratto (vedi manuale dedicato). L'annullamento è consentito fino al raggiungimento del termine Data scadenza Convenzione ma la predisposizione di una richiesta di annullamento è consentita esclusivamente all’utente dell’Ente con ruolo di Punto Ordinante . La richiesta sarà poi inoltrata all'utente con ruolo di Gestore convenzioni per l'eventuale approvazione. Ordinativi di Fornitura, cliccare sull’icona dell’ordinativo di interesse. Aperto il documento, cliccare sul comando Annulla Ordinativo posizionato nella toolbar in alto nella schermata. Verrà creato in automatico un documento di annullamento che erediterà dall'ordinativo principale alcune informazioni, quali CIG e Data di scadenza . Indicare la Motivazione dell’annullamento nell'apposito campo. È inoltre possibile inserire un Allegato alla motivazione cliccando sul comando ed eventuali note per l' approvatore (Gestore convenzioni).\n```\n\nFonte: SA_Modulo_Esecuzione_Contratti.pdf - Pagina 37 - Sezione 'CONTRATTI IN ESECUZIONE'\n```\nConfermato . Per un dato contratto può essere inviata una sola Conclusione esecuzione. La pagina di compilazione della scheda CO1 è composta dalla toolbar, dalla testata e dai campi propri della scheda. Nella toolbar sono presenti tre pulsanti: Salva, Invio, Chiudi . Nella testata sono riportati una serie di campi, in sola visualizzazione, importati dall’appalto oppure dal contratto. È sempre possibile (su questa come su tutte le altre schede) chiudere la Testata, in modo da visualizzare solo i campi per i quali è richiesta una compilazione. Compilare tutti i campi richiesti (i campi in grassetto e con l’asterisco sono obbligatori). Per salvare una bozza della scheda in compilazione è necessario selezionare il pulsante Salva . Per inviare la scheda è invece necessario selezionare il pulsante Invio presente in toolbar.\n```""]","La documentazione fornita non descrive una funzionalità specifica per unire aggiudicazioni multiple in un unico contratto. Tuttavia, si possono dedurre alcune azioni e considerazioni:

1.  **Verifica della fattibilità:** Prima di procedere, è fondamentale verificare se la piattaforma EmPULIA permette di creare un unico contratto a partire da più aggiudicazioni. Potrebbe essere necessario contattare il supporto EmPULIA per chiarimenti.

2.  **Creazione di un Ordinativo di Fornitura (OdF):** La guida menziona la ""Creazione Ordinativi di Fornitura"". Potrebbe essere possibile creare un unico OdF che comprenda tutti i lotti vinti dallo stesso operatore.  La sezione 'CREAZIONE ORDINATIVO DI FORNITURA' (SA\_EmissioneGestione\_OdF.pdf_section_3) potrebbe contenere informazioni utili.

3.  **Scheda di Sottoscrizione Contratto:** Dopo aver creato l'OdF, si dovrà procedere con la ""Scheda di Sottoscrizione Contratto"".  Assicurarsi che la scheda rifletta correttamente tutti i lotti inclusi nell'OdF.

4.  **Note per il contratto:** Nel creare l'OdF, utilizzare il campo ""Note per il contratto"" per specificare che si tratta di un contratto unificato per più lotti e indicare i riferimenti delle singole aggiudicazioni.

5.  **Modulo di Esecuzione del Contratto:** Una volta stipulato il contratto unificato, utilizzare il ""Modulo di Esecuzione del Contratto"" per comunicare eventuali modifiche o eventi relativi all'esecuzione del contratto ad ANAC.

6.  **RUP (Responsabile Unico del Procedimento):** Il RUP ha un ruolo chiave nella gestione del contratto. Assicurarsi che il RUP sia correttamente designato e che sia a conoscenza della natura unificata del contratto.

7.  **Comunicazione con EmPULIA e ANAC:** In caso di dubbi o difficoltà, è consigliabile contattare il supporto di EmPULIA e/o ANAC per ottenere indicazioni specifiche sulla procedura da seguire.

**In sintesi, la procedura più probabile è:**

1.  Creare un unico Ordinativo di Fornitura che comprenda tutti i lotti vinti dallo stesso operatore.
2.  Compilare la Scheda di Sottoscrizione Contratto facendo riferimento a tutti i lotti.
3.  Utilizzare il campo ""Note per il contratto"" per specificare i dettagli.
4.  Gestire l'esecuzione del contratto tramite il Modulo di Esecuzione del Contratto.

**Importante:** Questa risposta si basa sulle informazioni disponibili nel Knowledge Graph. È fondamentale verificare la fattibilità di questa procedura con il supporto di EmPULIA e/o ANAC.","Sì, è possibile creare un unico contratto. Per farlo, devi andare nella sezione 'Aggiudicazioni in attesa di contratto', selezionare tramite le check box tutte le aggiudicazioni relative ai diversi lotti vinti dallo stesso operatore e poi cliccare sul comando 'Contratto' nella toolbar. È fondamentale notare che questo è possibile solo se per questi lotti è stata creata un'unica comunicazione di aggiudicazione definitiva.",0.36363636363636365,0.0,0.0,0.0
Quali sono le principali regole generali che distinguono i concorsi di idee dalle gare tradizionali su EmPULIA?,"[""Informazioni rilevanti trovate nel Knowledge Graph:\n\n✓ **Entità trovata**: creazione concorso idee\n  • Tipo: SezioneGuida\n  • Descrizione: La sezione della guida EmPULIA intitolata 'CREAZIONE CONCORSO DI IDEE' (ID: SA_IndizioneConcorsi_Idee_Progettazione.pdf_section_2) da cui provengono queste informazioni.\n  • Occorrenze nel testo: 5\n  • Varianti trovate: CREAZIONE CONCORSO DI IDEE\n\n→ **Relazione**: creazione concorso idee --[eDescrittoIn]--> fornitore\n  • Dettaglio: Utente registrato sulla piattaforma EmPULIA.\n\n→ **Relazione**: creazione concorso idee --[eDescrittoIn]--> empulia\n  • Dettaglio: Piattaforma per la gestione di procedure.\n\n→ **Relazione**: creazione concorso idee --[eDescrittoIn]--> accesso\n  • Dettaglio: Funzionalità di accesso alla piattaforma tramite credenziali.\n\n→ **Relazione**: creazione concorso idee --[eDescrittoIn]--> stazione appaltante\n  • Dettaglio: Un ente che utilizza la piattaforma EmPULIA per attività di appalto.\n\n→ **Relazione**: creazione concorso idee --[eDescrittoIn]--> procedura\n  • Dettaglio: I criteri che la password deve rispettare.\n\n→ **Relazione**: creazione concorso idee --[eDescrittoIn]--> offerta economicamente più vantaggiosa\n  • Dettaglio: Criterio di aggiudicazione di una gara basato sul miglior rapporto qualità/prezzo.\n\n→ **Relazione**: creazione concorso idee --[eDescrittoIn]--> pubblica amministrazione\n  • Dettaglio: Ente della Pubblica Amministrazione che utilizza la piattaforma EmPULIA.\n\n→ **Relazione**: creazione concorso idee --[eDescrittoIn]--> prezzo più basso\n  • Dettaglio: Criterio di aggiudicazione di una gara d'appalto basato sul prezzo più basso.\n\n→ **Relazione**: creazione concorso idee --[eDescrittoIn]--> raggruppamento temporaneo imprese\n  • Dettaglio: Unione temporanea di imprese che partecipano congiuntamente a una gara d'appalto.\n\n→ **Relazione**: creazione concorso idee --[eDescrittoIn]--> sistema dinamico acquisizione\n  • Dettaglio: Sistema Dinamico di Acquisizione (SDA) all'interno della piattaforma EmPULIA.\n\n→ **Relazione**: creazione concorso idee --[eDescrittoIn]--> richiesta offerta\n  • Dettaglio: Documento di Richiesta di Offerta (RdO) all'interno del Sistema Dinamico di Acquisizione.\n\n→ **Relazione**: creazione concorso idee --[eDescrittoIn]--> documento\n  • Dettaglio: La documentazione di gara.\n\n→ **Relazione**: creazione concorso idee --[eDescrittoIn]--> toolbar\n  • Dettaglio: La barra degli strumenti in alto nella schermata.\n\n→ **Relazione**: creazione concorso idee --[eDescrittoIn]--> area filtro\n  • Dettaglio: Area nella parte alta della pagina per effettuare ricerche tra le consultazioni preliminari.\n\n→ **Relazione**: creazione concorso idee --[eDescrittoIn]--> data creazione\n  • Dettaglio: Criterio di ordinamento delle consultazioni preliminari.\n\n→ **Relazione**: creazione concorso idee --[eDescrittoIn]--> icona dettaglio\n  • Dettaglio: Icona per visualizzare il dettaglio della consultazione.\n\n→ **Relazione**: creazione concorso idee --[eDescrittoIn]--> stato\n  • Dettaglio: Informazione di dettaglio della consultazione: Stato.\n\n→ **Relazione**: creazione concorso idee --[eDescrittoIn]--> responsabile unico procedimento (r.u.p.)\n  • Dettaglio: Il ruolo del Responsabile Unico del Procedimento all'interno della piattaforma EmPULIA.\n\n→ **Relazione**: creazione concorso idee --[eDescrittoIn]--> rettifica\n  • Dettaglio: Documento di rettifica."", ""--- Testo Originale dalle Guide per Contesto Aggiuntivo ---\n\nFonte: SA_ConfigurazioneDGUE.pdf - Pagina 3 - Sezione 'SALVATAGGIO DEL DGUE'\n```\nManuale SA | Configurazione del DGUE Manuale SA | Configurazione del DGUE Pubblica Amministrazione Stazione Appaltante Operatore Economico Offerta economicamente più vantaggiosa Prezzo più basso (minor prezzo) Raggruppamento temporaneo di imprese Responsabile del Procedimento Procedura di aggiudicazione Sistema Dinamico di Acquisizione Richiesta di Offerta\n```\n\nFonte: SA_Approfondimento_formule.pdf - Pagina 4 - Sezione 'VALUTAZIONE SOGGETTIVA'\n```\nPer la predisposizione di una procedura di gara aggiudicata attraverso il criterio dell’offerta economicamente più vantaggiosa sulla base del miglior rapporto qualità/prezzo, la piattaforma EmPULIA garantisce un set molto ampio di formule per la valutazione degli elementi economici (di seguito semplicemente formula), in grado di soddisfare la grande maggioranza delle esigenze delle stazioni appaltanti. Dal momento che la scelta della formula assume un ruolo strategico che ha impatti rilevanti sulla formulazione della graduatoria finale, si precisa da un lato la non tassatività di utilizzo delle formule descritte nel presente documento, e dall’altro si ribadisce che l’onere e la responsabilità di scelta di una determinata formula sono sempre in capo alla singola Stazione Appaltante . Le formule messe a disposizione dal Sistema possono essere classificate come segue: Formule Interdipendenti : il punteggio economico di un concorrente dipende anche dall’offerta di altri concorrenti: o Valore Assoluto o Massimo Sconto o Massimo Sconto non Lineare o Ribasso Massimo o Ribasso Massimo non Lineare o Valore Soglia dei Ribassi o Valore Soglia dei Ribassi condizionata o Valore Soglia degli Sconti o Valore Soglia degli Sconti condizionata o Massimo Spread a Scalino o Minimo Spread a Scalino o Valore Offerta / Massimo Valore Offerta * Punteggio o Percentuale Offerta / Massima Percentuale Offerta * Punteggio Formule Indipendenti : in cui il punteggio di ciascun concorrente dipende esclusivamente dalla propria offerta economica ed è conoscibile a priori dal concorrente stesso nel momento in cui definisce la propria offerta: o Esponenziale Qualora una SA intenda utilizzare una formula non ricompresa nelle opzioni sopra descritte, il Sistema\n```\n\nFonte: SA_IndizioneConcorsi_Idee_Progettazione.pdf - Pagina 4 - Sezione 'CREAZIONE CONCORSO DI IDEE'\n```\nManuale SA | Indizione Concorsi di idee e di progettazione Manuale SA | Indizione Concorsi di idee e di progettazione Pubblica Avviso ........................................................................................................ 29 Pubblicazione della procedura su EmPULIA ............................................................ 29 Recupera CIG ............................................................................................................ 30 Esito Operazione ....................................................................................................... 30 Consulta Avviso ........................................................................................................ 30 Pubblica Amministrazione Stazione Appaltante Operatore Economico Offerta economicamente più vantaggiosa Prezzo più basso (minor prezzo) Raggruppamento temporaneo di imprese Responsabile Unico di Progetto Procedura di aggiudicazione Sistema Dinamico di Acquisizione Richiesta di Offerta\n```\n\nFonte: SA_CPM.pdf - Pagina 6 - Sezione 'ELIMINAZIONE DI UNA CONSULTAZIONE IN LAVORAZIONE'\n```\nNella parte alta della pagina è presente innanzitutto un’area di filtro che consente all’utente di effettuare ricerche, in base ad uno o più criteri ( es. Registro di Sistema, Nome, Appalto Verde, Appalto Sociale ), tra le consultazioni preliminari nella tabella sottostante (se presenti). Sotto l’area di ricerca, è presente una toolbar per la gestione delle consultazioni preliminari visualizzate nella tabella sottostante, con i seguenti comandi: Stampa Lista per stampare le informazioni visualizzate nella tabella sottostante; Esporta in xls per esportare in formato xlsx le informazioni visualizzate nella tabella sottostante; Seleziona per selezionare/deselezionare con un’unica azione più consultazioni preliminari. Nella tabella sottostante, saranno visibili - se presenti - tutte le consultazioni predisposte (salvate) e/o pubblicate dalla Stazione Appaltante, ordinate per data di creazione (dalla più recente alla meno recente) . Per ogni consultazione è possibile visualizzare il dettaglio (cliccando sulla relativa icona Sistema, Nome, Oggetto, Rispondere Entro Il (scadenza), Stato, Numero Documenti Ricevuti e Numero Quesiti Ricevuti.\n```\n\nFonte: GuidaRapidaMigrazioneOperatoriEconomici.pdf - Pagina 7 - Sezione 'None'\n```\nFORNITORI Se sei già registrato come fornitore sulla piattaforma EmPULIA, la tua utenza è stata migrata anche sulla nuova piattaforma Se sei già registrato come fornitore sulla piattaforma EmPULIA, la tua utenza è stata migrata anche sulla nuova piattaforma Hai dunque ricevuto via email la terna di Password) che saranno valide solo per la nuova piattaforma Hai dunque ricevuto via email la terna di Password) che saranno valide solo per la nuova piattaforma La vecchia piattaforma sarà accessibile con le consuete modalità che già utilizzi La vecchia piattaforma sarà accessibile con le consuete modalità che già utilizzi Entra nella nuova piattaforma utilizzando la terna di credenziali che hai ricevuto Entra nella nuova piattaforma utilizzando la terna di credenziali che hai ricevuto Segui i passaggi descritti di seguito per poter essere subito operativo anche sulla nuova piattafoma Segui i passaggi descritti di seguito per poter essere subito operativo anche sulla nuova piattafoma password rispettando i criteri di sicurezza richiesti ed elencati password rispettando i criteri di sicurezza richiesti ed elencati Le procedure pubblicate sulla vecchia piattaforma saranno accessibili con le precedenti modalità. Le procedure pubblicate sulla vecchia piattaforma saranno accessibili con le precedenti modalità. Tuttavia ricorda che potrebbe essere necessario o utile effettuare alcune ulteriori operazioni, descritte di seguito Tuttavia ricorda che potrebbe essere necessario o utile effettuare alcune ulteriori operazioni, descritte di seguito Accertati che i dati di contatto (telefono e/o email) della tua utenza siano corretti. Clicca su Utente in alto a destra Accertati che i dati di contatto (telefono e/o email) della tua utenza siano corretti. Clicca su Utente in alto a destra Controlla i dati ed eventualmente clicca su numeri di telefono. Controlla i dati ed eventualmente clicca su numeri di telefono. Accertati che i dati (es. Telefono) della tua azienda siano corretti. Clicca su Anagrafica in alto a destra Accertati che i dati (es. Telefono) della tua azienda siano corretti. Clicca su Anagrafica in alto a destra Controlla i dati ed eventualmente clicca su fax e sito web Controlla i dati ed eventualmente clicca su fax e sito web P.IVA, forma giuridica, sedi ecc.) entra dal menu di sinistra in P.IVA, forma giuridica, sedi ecc.) entra dal menu di sinistra in Potrai apportare le modifiche richieste, ma tali modifiche non saranno immediatamente operative. Infatti ti verrà richiesto di generare un pdf con digitalmente e di riallegarlo firmato. Clicca su Invia al termine. Le modifiche dovranno essere Potrai apportare le modifiche richieste, ma tali modifiche non saranno immediatamente operative. Infatti ti verrà richiesto di generare un pdf con digitalmente e di riallegarlo firmato. Clicca su Invia al termine.\n```\n\nFonte: Guida_Rapida_Migrazione_Utenti_SA.pdf - Pagina 7 - Sezione 'None'\n```\nSe sei già registrato ed operativo come utente di una Stazione Appaltante sulla piattaforma EmPULIA, la tua utenza è stata migrata anche sulla nuova piattaforma Se sei già registrato ed operativo come utente di una Stazione Appaltante sulla piattaforma EmPULIA, la tua utenza è stata migrata anche sulla nuova piattaforma Hai dunque ricevuto via email la nuova terna di credenziali valide solo per la nuova piattaforma Hai dunque ricevuto via email la nuova terna di credenziali valide solo per la nuova piattaforma La vecchia piattaforma sarà accessibile con le consuete modalità che già utilizzi La vecchia piattaforma sarà accessibile con le consuete modalità che già utilizzi Entra nella nuova piattaforma utilizzando la terna di credenziali che hai ricevuto Entra nella nuova piattaforma utilizzando la terna di credenziali che hai ricevuto Segui i passaggi descritti di seguito per poter essere subito operativo anche sulla nuova piattafoma Segui i passaggi descritti di seguito per poter essere subito operativo anche sulla nuova piattafoma password rispettando i criteri di sicurezza richiesti ed elencati password rispettando i criteri di sicurezza richiesti ed elencati ad un set molto limitato di funzionalità ad un set molto limitato di funzionalità (angolo alto a destra) (angolo alto a destra) Ricorda che: \uf0d8 Se selezioni Punto Istruttore, dovrai obbligatoriamente indicare un approvatore di riferimento \uf0d8 Se selezioni Punto Ordinante o RUP PDG dovrai generare un pdf riepilogativo , da firmare digitalmente e riallegare firmato per poter \uf0d8 Se selezioni RUP PDG dovrai obbligatoriamente allegare l’ Atto di nomina o idoneità \uf0d8 Se selezioni più ruoli, devi indicare quello prevalente Ricorda che: \uf0d8 Se selezioni Punto Istruttore, dovrai obbligatoriamente indicare un approvatore di riferimento \uf0d8 Se selezioni Punto Ordinante o RUP PDG dovrai generare un pdf riepilogativo , da firmare digitalmente e riallegare firmato per poter \uf0d8 Se selezioni RUP PDG dovrai obbligatoriamente allegare l’ Atto di nomina o idoneità \uf0d8 Se selezioni più ruoli, devi indicare quello prevalente Se non trovi nell’elenco il tuo approvatore, molto probabilmente lo stesso non ha completato la assegnato il ruolo corretto Se non trovi nell’elenco il tuo approvatore, molto probabilmente lo stesso non ha completato la assegnato il ruolo corretto Indica dunque: \uf0d8 Struttura di Appartenenza (richiesto solo per alcuni Enti) \uf0d8 Almeno un approvatore di riferimento (solo se sei Punto Istruttore) Indica dunque: \uf0d8 Struttura di Appartenenza (richiesto solo per alcuni Enti) \uf0d8 Almeno un approvatore di riferimento (solo se sei Punto Istruttore) Se sei Punto Ordinante o RUP PDG devi inoltre cliccare su Genera pdf , firmare digitalmente il documento, riallegarlo firmato tramite Allega pdf firmato . Se hai già generato il pdf e vuoi fare modifiche al contenuto, Se sei Punto Ordinante o RUP PDG devi inoltre cliccare su Genera pdf , firmare digitalmente il documento, riallegarlo firmato tramite Allega pdf firmato .\n```\n\nFonte: SA_CPM.pdf - Pagina 7 - Sezione 'CONSULTAZIONE DELLE RISPOSTE'\n```\ncome Responsabile Unico del Procedimento (R.U.P.) e non è più possibile modificarla; Pubblicato : la consultazione è stata approvata/pubblicata dal Responsabile Unico del Procedimento (R.U.P.) ed è pertanto visibile agli operatori economici, che potranno presentare la risposta; Rifiutato : la consultazione non è stata approvata dal Responsabile Unico del Procedimento (R.U.P.); Rettificato : la consultazione è stata rettificata; e non è più possibile inviare risposte e/o ulteriori comunicazioni. riportata al di sopra della tabella con l'elenco delle consultazioni. della consultazione e per ciascuna di esse è possibile consultare lo specifico paragrafo disponibile nel presente manuale. In particolare, la schermata presenterà le seguenti sezioni: Testata , Atti , Busta\n```\n\nFonte: SA_ConfigurazioneDGUE.pdf - Pagina 7 - Sezione 'SPECIALIZZAZIONE FACOLTATIVA DI ALTRI MODULI'\n```\nManuale SA | Configurazione del DGUE Manuale SA | Configurazione del DGUE Se si disattiva una Parte, vengono disabilitate anche le Sezioni ed i Moduli Richieste relativi; se si disattiva una Sezione, vengono disabilitati tutti i Moduli Richieste relativi. Altrimenti si può procedere alla ATTENZIONE : se le sezioni/moduli vengono lasciati attivi, al fornitore potrebbe venir richiesta la compilazione obbligatoria delle risposte per quei moduli. Pertanto, si segnala l’opportunità di disattivare sezioni/moduli non pertinenti o per le quali non interessa conoscere il dato ai fini della gara in composizione. La colonna Indice fa riferimento all’indice previsto dalla tassonomia AGID La colonna Tipologia indica se si tratta di Parte, Sezione o Modulo Richiesta. La colonna Descrizione contiene la descrizione prevista secondo tassonomia AGID. Nella colonna Esito Riga vengono visualizzate icone rosse o verdi in prossimità delle informazioni che richiedono un inserimento di dati obbligatori da parte della Stazione Appaltante. Il bollino rosso indica che una o più informazioni obbligatorie non sono presenti ed andranno compilate dalla SA cliccando sulla lente in corrispondenza della colonna Apri (vedi immagine precedente). In particolare, in prossimità delle informazioni relative a Identità del committente , l’icona risulta essere già verde in quanto le informazioni vengono ereditate in automatico dalla gara. singoli Moduli Richieste, ed in particolare per: Visualizzare l’anteprima della domanda posta al fornitore; Completare informazioni mancanti non obbligatorie o specificare criteri minimi di selezione (es. fatturato, numero di referenze, abilitazioni o certificazioni ecc.) richiesti. Con riferimento ai valori relativi ai criteri minimi di selezione, che la SA dovrebbe specificare modulo per modulo, si segnala che la piattaforma consente comunque la non definizione degli stessi all’interno del DGUE strutturato, riportando la precisazione: Se il Requisito minimo non è valorizzato far riferimento alla documentazione di gara. Tale impostazione semplifica la compilazione del DGUE per la SA, rendendo di chiaramente riportati nella documentazione di gara.\n```\n\nFonte: SA_ConfigurazioneDGUE.pdf - Pagina 13 - Sezione 'SALVATAGGIO DEL DGUE'\n```\nManuale SA | Configurazione del DGUE Manuale SA | Configurazione del DGUE Alcuni moduli prevedono infine l’automatica attivazione di gruppi di domande dipendenti, legate al quanto configurato precedentemente. Ad es. modulo Altri requisiti economici e finanziari , come da immagine seguente. Una volta che sono state predisposte correttamente tutte le sezioni da includere nel documento, cliccare sul comando Salva posizionato nella toolbar in alto nella schermata.\n```\n\nFonte: SA_CPM.pdf - Pagina 17 - Sezione 'SEZIONI'\n```\nNel caso in cui vengano inserite eventuali Note Approvatore e/o Allegati , all'atto del salvataggio/invio della consultazione, nella sezione Cronologia la tabella Operazioni Effettuate verrà alimentata automaticamente. Nella sezione Documenti è possibile visualizzare tutti i documenti generati da piattaforma e collegati alla consultazione, come ad esempio eventuali comunicazioni e/o documenti di Rettifica e Proroga (anche solo in fase di lavorazione). Durante la fase di indizione della consultazione, e dunque di\n```""]","Basandomi sulle informazioni fornite, non è possibile delineare le principali regole generali che distinguono i concorsi di idee dalle gare tradizionali su EmPULIA. Il Knowledge Graph si concentra principalmente sulla creazione di concorsi di idee sulla piattaforma EmPULIA, descrivendo funzionalità e processi specifici per la gestione di tali concorsi. Non fornisce un confronto diretto con le gare tradizionali, né elenca le regole generali che le differenziano.

Le informazioni disponibili riguardano:

*   **Funzionalità della piattaforma EmPULIA:** Accesso, gestione utenti, creazione di documenti, gestione di consultazioni preliminari, etc.
*   **Aspetti procedurali:** Ruolo del RUP, gestione delle offerte, criteri di aggiudicazione (offerta economicamente più vantaggiosa, prezzo più basso).
*   **Documentazione:** DGUE, documenti di gara, rettifiche, etc.

Per rispondere alla domanda, sarebbe necessario un documento o una sezione della guida EmPULIA che espliciti le differenze procedurali, legali e operative tra concorsi di idee e gare d'appalto tradizionali.","I concorsi di idee e progettazione seguono regole specifiche diverse dalle altre gare. Le principali sono: possono essere configurati solo come 'lotto singolo'; garantiscono l' 'anonimato delle idee e dei progetti' fino all'apertura delle buste amministrative; non prevedono mai un' 'offerta economica' (il punteggio tecnico è sempre 100 punti); e la 'verifica della documentazione amministrativa' avviene 'ex-post', cioè solo dopo aver completato la valutazione tecnica e definito una graduatoria.",1.0,0.0,0.0,0.0
Ho pubblicato un concorso di idee. Posso vedere chi è l'Operatore Economico che ha inviato un quesito prima che la gara scada?,"[""Informazioni rilevanti trovate nel Knowledge Graph:\n\n✓ **Entità trovata**: visualizzazione consultazioni preliminari mercato\n  • Tipo: FunzionalitàPiattaforma\n  • Descrizione: Funzionalità per visualizzare le consultazioni preliminari di mercato\n  • Occorrenze nel testo: 1\n  • Varianti trovate: Visualizzazione Consultazioni Preliminari di Mercato\n\n→ **Relazione**: visualizzazione consultazioni preliminari mercato --[rimandaA]--> notifica e-mail\n  • Dettaglio: E-mail di notifica ricevuta dal RUP\n\n→ **Relazione**: visualizzazione consultazioni preliminari mercato --[eDescrittoIn]--> sezioni\n  • Dettaglio: Le sezioni da includere nel documento DGUE.\n\n→ **Relazione**: visualizzazione consultazioni preliminari mercato --[haSottoFunzionalita]--> documenti approvazione\n  • Dettaglio: Voce di menu per visualizzare i documenti in attesa di approvazione\n\n✓ **Entità trovata**: visualizzazione dettaglio consultazione\n  • Tipo: FunzionalitàPiattaforma\n  • Descrizione: La funzionalità di visualizzare il dettaglio di una consultazione.\n  • Occorrenze nel testo: 1\n  • Varianti trovate: Visualizzazione dettaglio consultazione\n\n→ **Relazione**: visualizzazione dettaglio consultazione --[generaDocumento]--> dettaglio consultazione\n  • Dettaglio: Possibilità di visualizzare il dettaglio di ogni consultazione.\n\n→ **Relazione**: visualizzazione dettaglio consultazione --[rimandaA]--> icona apri\n  • Dettaglio: Un'icona nella colonna 'Apri' utilizzata per visualizzare il dettaglio di una consultazione.\n\n→ **Relazione**: visualizzazione dettaglio consultazione --[eDescrittoIn]--> creazione consultazione preliminare\n  • Dettaglio: La sezione della guida EmPULIA intitolata 'CREAZIONE CONSULTAZIONE PRELIMINARE' (ID: SA_CPM.pdf_section_0) da cui provengono queste informazioni.\n\n✓ **Entità trovata**: visualizzazione dettaglio risposta\n  • Tipo: FunzionalitàPiattaforma\n  • Descrizione: Funzionalità che permette di visualizzare il dettaglio di una risposta inviata da un Operatore Economico.\n  • Occorrenze nel testo: 1\n  • Varianti trovate: Visualizzazione Dettaglio Risposta\n\n→ **Relazione**: visualizzazione dettaglio risposta --[haPassoSuccessivo]--> fornitore\n  • Dettaglio: Utente registrato sulla piattaforma EmPULIA.\n\n→ **Relazione**: visualizzazione dettaglio risposta --[eDescrittoIn]--> consultazione risposte\n  • Dettaglio: La sezione della guida EmPULIA intitolata 'CONSULTAZIONE DELLE RISPOSTE' (ID: SA_CPM.pdf_section_1) da cui provengono queste informazioni.\n\n✓ **Entità trovata**: visualizzazione comunicazioni integrative\n  • Tipo: FunzionalitàPiattaforma\n  • Descrizione: Funzionalità per visualizzare le comunicazioni integrative inviate.\n  • Occorrenze nel testo: 1\n  • Varianti trovate: Visualizzazione Comunicazioni Integrative\n\n→ **Relazione**: visualizzazione comunicazioni integrative --[haPassoSuccessivo]--> invio\n  • Dettaglio: Comando per inviare il documento del bando/invito.\n\n→ **Relazione**: visualizzazione comunicazioni integrative --[eDescrittoIn]--> consultazione risposte\n  • Dettaglio: La sezione della guida EmPULIA intitolata 'CONSULTAZIONE DELLE RISPOSTE' (ID: SA_CPM.pdf_section_1) da cui provengono queste informazioni.\n\n→ **Relazione**: visualizzazione comunicazioni integrative --[eParteDi]--> sezione documenti\n  • Dettaglio: Sezione della piattaforma dedicata ai documenti.\n\n✓ **Entità trovata**: visualizzazione risposte\n  • Tipo: FunzionalitàPiattaforma\n  • Descrizione: Funzionalità per visualizzare le risposte alle comunicazioni integrative.\n  • Occorrenze nel testo: 1\n  • Varianti trovate: Visualizzazione Risposte\n\n→ **Relazione**: visualizzazione risposte --[eEseguitaDa]--> utente\n  • Dettaglio: Elemento dell'interfaccia utente in alto a destra.\n\n→ **Relazione**: visualizzazione risposte --[eDescrittoIn]--> consultazione risposte\n  • Dettaglio: La sezione della guida EmPULIA intitolata 'CONSULTAZIONE DELLE RISPOSTE' (ID: SA_CPM.pdf_section_1) da cui provengono queste informazioni.\n\n→ **Relazione**: visualizzazione risposte --[haSottoFunzionalita]--> consultazione preliminare\n  • Dettaglio: Consultazione predisposta (salvata) e/o pubblicata dalla Stazione Appaltante.\n\n→ **Relazione**: visualizzazione risposte --[haSottoFunzionalita]--> sezione documenti\n  • Dettaglio: Sezione della piattaforma dedicata ai documenti.\n\n✓ **Entità trovata**: visualizzazione comunicazioni\n  • Tipo: FunzionalitàPiattaforma\n  • Descrizione: La funzionalità di visualizzare le comunicazioni scambiate.\n  • Occorrenze nel testo: 1\n  • Varianti trovate: Visualizzazione Comunicazioni\n\n→ **Relazione**: visualizzazione comunicazioni --[interagisceCon]--> schermata comunicazioni\n  • Dettaglio: La schermata che mostra le comunicazioni scambiate.\n\n→ **Relazione**: visualizzazione comunicazioni --[eDescrittoIn]--> conversazione\n  • Dettaglio: La sezione della guida EmPULIA intitolata 'CONVERSAZIONE' (ID: SA_CPM.pdf_section_7) da cui provengono queste informazioni.\n\n→ **Relazione**: visualizzazione comunicazioni --[eParteDi]--> fornitore\n  • Dettaglio: Utente registrato sulla piattaforma EmPULIA.\n\n✓ **Entità trovata**: visualizzazione dettaglio scadenze\n  • Tipo: FunzionalitàPiattaforma\n  • Descrizione: La funzionalità che permette di visualizzare il dettaglio delle scadenze del giorno.\n  • Occorrenze nel testo: 1\n  • Varianti trovate: Visualizzazione Dettaglio Scadenze\n\n→ **Relazione**: visualizzazione dettaglio scadenze --[haPassoSuccessivo]--> tabella sintesi\n  • Dettaglio: Una tabella che riassume le informazioni relative alla scadenza.\n\n→ **Relazione**: visualizzazione dettaglio scadenze --[includeOperazione]--> cliccare\n  • Dettaglio: Azione di cliccare su un elemento dell'interfaccia."", ""--- Testo Originale dalle Guide per Contesto Aggiuntivo ---\n\nFonte: SA_CPM.pdf - Pagina 2 - Sezione 'CREAZIONE CONSULTAZIONE PRELIMINARE'\n```\nManuale per Stazioni Appaltanti\n```\n\nFonte: SA_CPM.pdf - Pagina 3 - Sezione 'CONSULTAZIONE DELLE RISPOSTE'\n```\nINVIO ..................................................................................................................................... 19\n```\n\nFonte: SA_CPM.pdf - Pagina 6 - Sezione 'ELIMINAZIONE DI UNA CONSULTAZIONE IN LAVORAZIONE'\n```\nNella parte alta della pagina è presente innanzitutto un’area di filtro che consente all’utente di effettuare ricerche, in base ad uno o più criteri ( es. Registro di Sistema, Nome, Appalto Verde, Appalto Sociale ), tra le consultazioni preliminari nella tabella sottostante (se presenti). Sotto l’area di ricerca, è presente una toolbar per la gestione delle consultazioni preliminari visualizzate nella tabella sottostante, con i seguenti comandi: Stampa Lista per stampare le informazioni visualizzate nella tabella sottostante; Esporta in xls per esportare in formato xlsx le informazioni visualizzate nella tabella sottostante; Seleziona per selezionare/deselezionare con un’unica azione più consultazioni preliminari. Nella tabella sottostante, saranno visibili - se presenti - tutte le consultazioni predisposte (salvate) e/o pubblicate dalla Stazione Appaltante, ordinate per data di creazione (dalla più recente alla meno recente) . Per ogni consultazione è possibile visualizzare il dettaglio (cliccando sulla relativa icona Sistema, Nome, Oggetto, Rispondere Entro Il (scadenza), Stato, Numero Documenti Ricevuti e Numero Quesiti Ricevuti.\n```\n\nFonte: GuidaRapidaMigrazioneOperatoriEconomici.pdf - Pagina 7 - Sezione 'None'\n```\nFORNITORI Se sei già registrato come fornitore sulla piattaforma EmPULIA, la tua utenza è stata migrata anche sulla nuova piattaforma Se sei già registrato come fornitore sulla piattaforma EmPULIA, la tua utenza è stata migrata anche sulla nuova piattaforma Hai dunque ricevuto via email la terna di Password) che saranno valide solo per la nuova piattaforma Hai dunque ricevuto via email la terna di Password) che saranno valide solo per la nuova piattaforma La vecchia piattaforma sarà accessibile con le consuete modalità che già utilizzi La vecchia piattaforma sarà accessibile con le consuete modalità che già utilizzi Entra nella nuova piattaforma utilizzando la terna di credenziali che hai ricevuto Entra nella nuova piattaforma utilizzando la terna di credenziali che hai ricevuto Segui i passaggi descritti di seguito per poter essere subito operativo anche sulla nuova piattafoma Segui i passaggi descritti di seguito per poter essere subito operativo anche sulla nuova piattafoma password rispettando i criteri di sicurezza richiesti ed elencati password rispettando i criteri di sicurezza richiesti ed elencati Le procedure pubblicate sulla vecchia piattaforma saranno accessibili con le precedenti modalità. Le procedure pubblicate sulla vecchia piattaforma saranno accessibili con le precedenti modalità. Tuttavia ricorda che potrebbe essere necessario o utile effettuare alcune ulteriori operazioni, descritte di seguito Tuttavia ricorda che potrebbe essere necessario o utile effettuare alcune ulteriori operazioni, descritte di seguito Accertati che i dati di contatto (telefono e/o email) della tua utenza siano corretti. Clicca su Utente in alto a destra Accertati che i dati di contatto (telefono e/o email) della tua utenza siano corretti. Clicca su Utente in alto a destra Controlla i dati ed eventualmente clicca su numeri di telefono. Controlla i dati ed eventualmente clicca su numeri di telefono. Accertati che i dati (es. Telefono) della tua azienda siano corretti. Clicca su Anagrafica in alto a destra Accertati che i dati (es. Telefono) della tua azienda siano corretti. Clicca su Anagrafica in alto a destra Controlla i dati ed eventualmente clicca su fax e sito web Controlla i dati ed eventualmente clicca su fax e sito web P.IVA, forma giuridica, sedi ecc.) entra dal menu di sinistra in P.IVA, forma giuridica, sedi ecc.) entra dal menu di sinistra in Potrai apportare le modifiche richieste, ma tali modifiche non saranno immediatamente operative. Infatti ti verrà richiesto di generare un pdf con digitalmente e di riallegarlo firmato. Clicca su Invia al termine. Le modifiche dovranno essere Potrai apportare le modifiche richieste, ma tali modifiche non saranno immediatamente operative. Infatti ti verrà richiesto di generare un pdf con digitalmente e di riallegarlo firmato. Clicca su Invia al termine.\n```\n\nFonte: SA_CPM.pdf - Pagina 9 - Sezione 'CONVERSAZIONE'\n```\nuna precisa sequenza di compilazione delle diverse sezioni, ad eccezione di alcuni campi che verranno abilitati solo sulla base di determinate selezioni eseguite precedentemente. In generale, è però necessario inserire tutte le informazioni obbligatorie richieste, indicate da label in grassetto e dal simbolo *. Nella parte alta della pagina è presente una toolbar per la gestione del documento con i seguenti comandi: Salva permette di salvare il documento per poi riprenderlo in un secondo momento dalla tabella Consultazioni Preliminari di Mercato; Invio per inviare in approvazione e/o pubblicare il documento; Comunicazioni per inviare, agli operatori economici interessati comunicazioni integrative nonché la comunicazione di chiusura della Consultazione Preliminare; Stampa per stampare il dettaglio del documento visualizzato; Esporta in Excel per esportare in xls il documento visualizzato; Chiarimenti per creare un quesito d'iniziativa. Per maggiori dettagli, consultare il manuale Gestione quesiti e chiarimenti; Esiti/Pubblicazioni ; per pubblicare documenti inerenti agli adempimenti informativi Operatore Economico che ha inviato risposta; Chiudi per chiudere il documento e tornare alla schermata precedente.\n```\n\nFonte: SA_ConfigurazioneDGUE.pdf - Pagina 13 - Sezione 'SALVATAGGIO DEL DGUE'\n```\nManuale SA | Configurazione del DGUE Manuale SA | Configurazione del DGUE Alcuni moduli prevedono infine l’automatica attivazione di gruppi di domande dipendenti, legate al quanto configurato precedentemente. Ad es. modulo Altri requisiti economici e finanziari , come da immagine seguente. Una volta che sono state predisposte correttamente tutte le sezioni da includere nel documento, cliccare sul comando Salva posizionato nella toolbar in alto nella schermata.\n```\n\nFonte: SA_ConfigurazioneDGUE.pdf - Pagina 14 - Sezione 'SALVATAGGIO DEL DGUE'\n```\nManuale SA | Configurazione del DGUE Manuale SA | Configurazione del DGUE Nel caso in cui una o più informazioni richieste come obbligatorie non venissero indicate nelle modalità descritte, al momento del clic sul comando Invio sul documento del bando/invito, verrà visualizzato un messaggio di errore che impedirà la pubblicazione della gara. nella toolbar della schermata per visualizzare l’anteprima in pdf del documento strutturato che l’Operatore Economico dovrà compilare, secondo le personalizzazioni apportate alle sezioni/moduli/commenti dello stesso. Tale documento può essere allegato agli Atti di gara come esempio messo a disposizione dei partecipanti. Salvato il documento, cliccare sul comando Chiudi posizionato nella toolbar per tornare alla schermata precedente. È possibile estrarre l’XML del modello DGUE, sia nella versione completa ( XML ESPD Request ) che nella versione europea, priva quindi delle sezioni previste dalla sola legislazione nazionale ( XML ESPD Manuale SA | Configurazione del DGUE Manuale SA | Configurazione del DGUE Le immagini sono puramente indicative e possono subire variazioni.\n```\n\nFonte: SA_CPM.pdf - Pagina 21 - Sezione 'SEZIONI'\n```\nSe l’utente collegato ricopre il ruolo di RUP, successivamente all'invio in approvazione della consultazione predisposta da parte del Punto Istruttore, riceverà un'e-mail di notifica della Per visualizzare ed esaminare la consultazione e procedere con la sua Approvazione / Non Consultazioni Preliminari di Mercato e successivamente sulla voce che consente la visualizzazione delle consultazioni in attesa di approvazione Documenti in Approvazione . Nella tabella che verrà mostrata, cliccare sul comando per accedere al dettaglio della consultazione Nella sezione Cronologia , è possibile inserire eventuali Note approvatore e/o Allegati prima di approvare il documento.\n```\n\nFonte: SA_CPM.pdf - Pagina 23 - Sezione 'CREAZIONE CONSULTAZIONE PRELIMINARE'\n```\nschermata. tornerà al Punto Istruttore. Il presente paragrafo mostra le indicazioni per la visualizzazione e gestione della consultazione funzionalità Consultazione CPM, riservata agli utenti inseriti nei Riferimenti . L’accesso a tale funzionalità è consentito in particolare solo se, in fase di indizione della consultazione, alla propria utenza è stato assegnato il ruolo Bando/Inviti nella sezione Riferimenti . Area Riservata , cliccare sul gruppo funzionale Consultazioni Preliminari di Mercato e successivamente sulla voce Consultazioni CPM.\n```\n\nFonte: SA_CPM.pdf - Pagina 24 - Sezione 'CREAZIONE CONSULTAZIONE PRELIMINARE'\n```\nNella schermata verrà mostrata una tabella riassuntiva che darà evidenza di tutte le consultazioni con le relative informazioni. Per visualizzarne il dettaglio, cliccare sulla corrispondente icona nella colonna Apri . Verrà visualizzato il documento strutturato relativo al dettaglio della consultazione che è possibile visualizzare cliccando sulle specifiche sezioni.\n```\n\nFonte: SA_CPM.pdf - Pagina 26 - Sezione 'CONSULTAZIONE DELLE RISPOSTE'\n```\nPubblicate, nella colonna Numero Documenti Ricevuti. Per visualizzare il dettaglio di una risposta inviata da un Operatore Economico, cliccare sull'icona in prossimità del documento che si intende consultare. Verrà mostrata la schermata Risposta a Consultazione inviata dall'Operatore Economico, che risulterà composta da due sezioni: Testata e Busta Documentazione .\n```\n\nFonte: SA_CPM.pdf - Pagina 33 - Sezione 'CONSULTAZIONE DELLE RISPOSTE'\n```\nPredisposto correttamente il contenuto della comunicazione, cliccare sul comando Invio posizionato nella toolbar in alto nella schermata per procedere con l'invio. È possibile visualizzare tutte le comunicazioni integrative inviate, nella sezione Documenti. Per visualizzare le eventuali Risposte alle comunicazioni integrative inviate dagli Operatori Economici, è possibile procedere attraverso due modalità: dalla sezione Documenti ; Consultazione Preliminare. inviate a più Operatori Economici mentre la seconda modalità consente la visualizzazione della Risposta in caso di comunicazione integrativa inviata al singolo Operatore Economico.\n```\n\nFonte: SA_CPM.pdf - Pagina 37 - Sezione 'CONVERSAZIONE'\n```\nPredisposto correttamente il contenuto, cliccare sul comando Invio posizionato nella toolbar in alto nella schermata per inviare la comunicazione. confermerà l'operazione. Tale funzionalità consente di visualizzare tutte le comunicazioni scambiate tra la Stazione Appaltante e l'Operatore Economico, applicando il filtro per fornitore. Nella schermata che verrà mostrata, cliccare sul comando Operatore Economico .\n```\n\nFonte: SA_CPM.pdf - Pagina 41 - Sezione 'CREAZIONE CONSULTAZIONE PRELIMINARE'\n```\nPer visualizzare il dettaglio delle scadenze del giorno, cliccare sulla relativa Descrizione . Verrà visualizzata una tabella di sintesi con una serie di informazioni quali Ora Inizio , Ora Fine ,\n```""]","No, in base alle informazioni fornite, non è possibile vedere l'identità dell'Operatore Economico che ha inviato un quesito prima della scadenza della gara. Le funzionalità descritte riguardano la visualizzazione delle consultazioni, delle risposte (dopo l'invio), delle comunicazioni e dei dettagli delle scadenze, ma non l'identificazione dei mittenti dei quesiti prima della chiusura della gara.","No, non è possibile. Per garantire l'anonimato dei partecipanti, la piattaforma oscura alla Stazione Appaltante i nominativi e i riferimenti sia dei mittenti che dei destinatari nelle sezioni relative ai quesiti e alle comunicazioni. Potrai quindi gestire la risposta al quesito, ma senza vedere chi lo ha inviato.",1.0,0.9205864533401883,0.0,0.0
Ci sono specifici soggetti autorizzati a compilare e trasmettere le schede PCP nel modulo Esecuzione Contratti?,"[""Informazioni rilevanti trovate nel Knowledge Graph:\n\n✓ **Entità trovata**: richiesta cig trasmissione schede pcp\n  • Tipo: SezioneGuida\n  • Descrizione: La sezione della guida EmPULIA intitolata 'RICHIESTA CIG E TRASMISSIONE SCHEDE PCP' (ID: SA_EmissioneGestione_OdF.pdf_section_10) da cui provengono queste informazioni.\n  • Occorrenze nel testo: 10\n  • Varianti trovate: RICHIESTA CIG E TRASMISSIONE SCHEDE PCP\n\n→ **Relazione**: richiesta cig trasmissione schede pcp --[riguarda]--> cig derivato\n  • Dettaglio: Codice Identificativo Gara derivato.\n\n→ **Relazione**: richiesta cig trasmissione schede pcp --[riguarda]--> cig master\n  • Dettaglio: Il CIG Master.\n\n→ **Relazione**: richiesta cig trasmissione schede pcp --[eDescrittoIn]--> fornitore\n  • Dettaglio: Utente registrato sulla piattaforma EmPULIA.\n\n→ **Relazione**: richiesta cig trasmissione schede pcp --[eDescrittoIn]--> empulia\n  • Dettaglio: Piattaforma per la gestione di procedure.\n\n→ **Relazione**: richiesta cig trasmissione schede pcp --[eDescrittoIn]--> data scadenza\n  • Dettaglio: Data di scadenza del rinnovo dell'albo.\n\n→ **Relazione**: richiesta cig trasmissione schede pcp --[eDescrittoIn]--> documento\n  • Dettaglio: La documentazione di gara.\n\n→ **Relazione**: richiesta cig trasmissione schede pcp --[eDescrittoIn]--> salva\n  • Dettaglio: Comando dell'interfaccia utente per salvare le modifiche.\n\n→ **Relazione**: richiesta cig trasmissione schede pcp --[eDescrittoIn]--> toolbar\n  • Dettaglio: La barra degli strumenti in alto nella schermata.\n\n→ **Relazione**: richiesta cig trasmissione schede pcp --[eDescrittoIn]--> rup\n  • Dettaglio: Responsabile Unico del Procedimento.\n\n→ **Relazione**: richiesta cig trasmissione schede pcp --[eDescrittoIn]--> allegati\n  • Dettaglio: Possibilità di allegare documenti\n\n→ **Relazione**: richiesta cig trasmissione schede pcp --[eDescrittoIn]--> fornitura\n  • Dettaglio: Riferimento generico al concetto di fornitura.\n\n→ **Relazione**: richiesta cig trasmissione schede pcp --[eDescrittoIn]--> scheda ad4\n  • Dettaglio: Scheda AD4 generata a partire dall'OdF configurato."", ""--- Testo Originale dalle Guide per Contesto Aggiuntivo ---\n\nFonte: SA_EmissioneGestione_OdF.pdf - Pagina 2 - Sezione 'GESTIONE ORDINATIVI DI FORNITURA'\n```\nFORNITURA\n```\n\nFonte: SA_EmissioneGestione_OdF.pdf - Pagina 5 - Sezione 'CREAZIONE ORDINATIVO DI FORNITURA'\n```\nAttraverso la piattaforma EmPULIA è possibile: accordi quadro e convenzioni centralizzate; centralizzate; della scheda AD4 partendo dall’OdF configurato; Tali funzionalità sono descritte dal par. 2 al par. 11. accordo quadro. La funzionalità è descritta al par. 12 Per ricercare i prodotti/servizi presenti nelle convenzioni attive nel Negozio Elettronico ed avviare il cliccare sul gruppo funzionale Negozio Elettronico e successivamente sulla voce Creazione Ordinativi di Fornitura .\n```\n\nFonte: GuidaRapidaMigrazioneOperatoriEconomici.pdf - Pagina 7 - Sezione 'None'\n```\nFORNITORI Se sei già registrato come fornitore sulla piattaforma EmPULIA, la tua utenza è stata migrata anche sulla nuova piattaforma Se sei già registrato come fornitore sulla piattaforma EmPULIA, la tua utenza è stata migrata anche sulla nuova piattaforma Hai dunque ricevuto via email la terna di Password) che saranno valide solo per la nuova piattaforma Hai dunque ricevuto via email la terna di Password) che saranno valide solo per la nuova piattaforma La vecchia piattaforma sarà accessibile con le consuete modalità che già utilizzi La vecchia piattaforma sarà accessibile con le consuete modalità che già utilizzi Entra nella nuova piattaforma utilizzando la terna di credenziali che hai ricevuto Entra nella nuova piattaforma utilizzando la terna di credenziali che hai ricevuto Segui i passaggi descritti di seguito per poter essere subito operativo anche sulla nuova piattafoma Segui i passaggi descritti di seguito per poter essere subito operativo anche sulla nuova piattafoma password rispettando i criteri di sicurezza richiesti ed elencati password rispettando i criteri di sicurezza richiesti ed elencati Le procedure pubblicate sulla vecchia piattaforma saranno accessibili con le precedenti modalità. Le procedure pubblicate sulla vecchia piattaforma saranno accessibili con le precedenti modalità. Tuttavia ricorda che potrebbe essere necessario o utile effettuare alcune ulteriori operazioni, descritte di seguito Tuttavia ricorda che potrebbe essere necessario o utile effettuare alcune ulteriori operazioni, descritte di seguito Accertati che i dati di contatto (telefono e/o email) della tua utenza siano corretti. Clicca su Utente in alto a destra Accertati che i dati di contatto (telefono e/o email) della tua utenza siano corretti. Clicca su Utente in alto a destra Controlla i dati ed eventualmente clicca su numeri di telefono. Controlla i dati ed eventualmente clicca su numeri di telefono. Accertati che i dati (es. Telefono) della tua azienda siano corretti. Clicca su Anagrafica in alto a destra Accertati che i dati (es. Telefono) della tua azienda siano corretti. Clicca su Anagrafica in alto a destra Controlla i dati ed eventualmente clicca su fax e sito web Controlla i dati ed eventualmente clicca su fax e sito web P.IVA, forma giuridica, sedi ecc.) entra dal menu di sinistra in P.IVA, forma giuridica, sedi ecc.) entra dal menu di sinistra in Potrai apportare le modifiche richieste, ma tali modifiche non saranno immediatamente operative. Infatti ti verrà richiesto di generare un pdf con digitalmente e di riallegarlo firmato. Clicca su Invia al termine. Le modifiche dovranno essere Potrai apportare le modifiche richieste, ma tali modifiche non saranno immediatamente operative. Infatti ti verrà richiesto di generare un pdf con digitalmente e di riallegarlo firmato. Clicca su Invia al termine.\n```\n\nFonte: SA_ConfigurazioneDGUE.pdf - Pagina 7 - Sezione 'SPECIALIZZAZIONE FACOLTATIVA DI ALTRI MODULI'\n```\nManuale SA | Configurazione del DGUE Manuale SA | Configurazione del DGUE Se si disattiva una Parte, vengono disabilitate anche le Sezioni ed i Moduli Richieste relativi; se si disattiva una Sezione, vengono disabilitati tutti i Moduli Richieste relativi. Altrimenti si può procedere alla ATTENZIONE : se le sezioni/moduli vengono lasciati attivi, al fornitore potrebbe venir richiesta la compilazione obbligatoria delle risposte per quei moduli. Pertanto, si segnala l’opportunità di disattivare sezioni/moduli non pertinenti o per le quali non interessa conoscere il dato ai fini della gara in composizione. La colonna Indice fa riferimento all’indice previsto dalla tassonomia AGID La colonna Tipologia indica se si tratta di Parte, Sezione o Modulo Richiesta. La colonna Descrizione contiene la descrizione prevista secondo tassonomia AGID. Nella colonna Esito Riga vengono visualizzate icone rosse o verdi in prossimità delle informazioni che richiedono un inserimento di dati obbligatori da parte della Stazione Appaltante. Il bollino rosso indica che una o più informazioni obbligatorie non sono presenti ed andranno compilate dalla SA cliccando sulla lente in corrispondenza della colonna Apri (vedi immagine precedente). In particolare, in prossimità delle informazioni relative a Identità del committente , l’icona risulta essere già verde in quanto le informazioni vengono ereditate in automatico dalla gara. singoli Moduli Richieste, ed in particolare per: Visualizzare l’anteprima della domanda posta al fornitore; Completare informazioni mancanti non obbligatorie o specificare criteri minimi di selezione (es. fatturato, numero di referenze, abilitazioni o certificazioni ecc.) richiesti. Con riferimento ai valori relativi ai criteri minimi di selezione, che la SA dovrebbe specificare modulo per modulo, si segnala che la piattaforma consente comunque la non definizione degli stessi all’interno del DGUE strutturato, riportando la precisazione: Se il Requisito minimo non è valorizzato far riferimento alla documentazione di gara. Tale impostazione semplifica la compilazione del DGUE per la SA, rendendo di chiaramente riportati nella documentazione di gara.\n```\n\nFonte: SA_ConfigurazioneModelli.pdf - Pagina 8 - Sezione 'INTRODUZIONE'\n```\nManuale SA | Configurazione del Modello di Offerta Manuale SA | Configurazione del Modello di Offerta Vers.2 Esporta in xls Il comando Esporta in xls consente di esportare il modello in un file xlsx per una migliore consultazione dello stesso. Per procedere con il download del file, cliccare quindi sul comando predisposto in alto alla tabella. Giù e Su I comandi consentono di spostare l’ordine delle colonne nella tabella Elenco Prodotti . Il comando Vedi viene mostrato in caso di attributo Gerarchico o Dominio e consente di visualizzare le informazioni che è possibile selezionare tra quelle proposte attraverso, per l’appunto, una struttura gerarchica. Per visualizzare tali informazioni, cliccare sulla lente. Se si vuole eliminare un’informazione presente nella tabella Elenco Prodotti , è necessario aprire il dettaglio del modello attraverso il comando e, nella tabella Attributi da usare nelle fasi della gara Individuata quindi la riga relativa all’attributo da eliminare, cliccare sulla corrispettiva icona del bidone. Ad esempio, se il modello selezionato per la gara prevede l’attributo “Misure”, che nella procedura specifica non si intende richiedere ai partecipanti, si dovrà rimuoverlo dal dettaglio del modello. Ci sono alcuni attributi che non potranno comunque essere rimossi. Nella colonna Attributo , viene indicata la tipologia dell’informazione che verrà richiesta al RUP o all’OE nelle diverse fasi: Text: informazioni di tipo testuale; Number: informazioni di tipo numerico (es. quantità o prezzo); si precisa che per i campi di tipo numerico intero non viene richiesto di specificare il numero di decimali. Attach: informazioni di tipo allegato; Domain: scelta multipla tra più voci proposte; Gerarchico : informazioni da selezionare tra quelle proposte attraverso una struttura gerarchica. Alcuni attributi sono non editabili come, ad esempio, Text – DESCRIZIONE e Number – QUANTITA , altri invece possono essere personalizzati e quindi appariranno editabili come ad esempio Manuale SA | Configurazione del Modello di Offerta Manuale SA | Configurazione del Modello di Offerta Vers.2 In particolare, per alcuni modelli sono stati previsti degli attributi di tipo Text e Number generici che le stazioni appaltanti possono personalizzare inserendo una descrizione per l’informazione richiesta. Per aggiungere una nuova riga che consente di specializzare un nuovo attributo, cliccare sul comando Aggiungi attributo posizionato sopra alla tabella. In fondo alla tabella Attributi da usare nelle fasi della gara , verrà predisposta una nuova riga per la definizione dell’attributo per il quale dovranno essere compilate le informazioni richieste prestando attenzione a non selezionare attributi già previsti nel modello specifico. Non è consentito l'inserimento di attributi duplicati (es. due “Attach – ALLEGATO 1” nello stesso modello). Nella colonna Descrizione Attributo si potrà indicare il nome dell’attributo che gli utenti visualizzeranno.\n```\n\nFonte: GuidaRapidaMigrazioneOperatoriEconomici.pdf - Pagina 10 - Sezione 'None'\n```\nLe modifiche dovranno essere Sulla nuova piattaforma sono previsti tre diversi Albi Fornitori: Sulla nuova piattaforma sono previsti tre diversi Albi Fornitori: L’albo delle imprese che sulla vecchia piattaforma era unico, è dunque stato diviso in due: Forniture/Servizi e Le abilitazioni sono state migrate sulla base delle categorie selezionate: L’albo delle imprese che sulla vecchia piattaforma era unico, è dunque stato diviso in due: Forniture/Servizi e Le abilitazioni sono state migrate sulla base delle categorie selezionate: Se eri abilitato solo su categorie di beni/servizi, ora sarai abilitato sull’Albo Forniture e Servizi Se eri abilitato solo su categorie di beni/servizi, ora sarai abilitato sull’Albo Forniture e Servizi Se eri abilitato solo su categorie SOA, ora sarai abilitato sull’Albo dei Lavori Pubblici Se eri abilitato solo su categorie SOA, ora sarai abilitato sull’Albo dei Lavori Pubblici Se eri abilitato sia su categorie di beni/servizi che SOA, ora sarai abilitato su entrambi gli Albi Se eri abilitato sia su categorie di beni/servizi che SOA, ora sarai abilitato su entrambi gli AlbiRicordacheorasonodue Albi totalmenteseparati, con statie scadenzeeventualmentedifferentiRicordacheorasonodue Albi totalmenteseparati, con statie scadenzeeventualmentedifferenti Verifica le categorie per le quali sei attualmente abilitato, entrando in Anagrafica , e poi in Classi di iscrizione (per Forniture/Servizi) o Categorie SOA (per Lavori Pubblici) L’albero delle categorie non ha subito variazioni sulla nuova piattaforma Verifica le categorie per le quali sei attualmente abilitato, entrando in Anagrafica , e poi in Classi di iscrizione (per Forniture/Servizi) o Categorie SOA (per Lavori Pubblici) L’albero delle categorie non ha subito variazioni sulla nuova piattaforma Ricorda che – a partire dal tuo prossimo rinnovo all’Albo - sulla nuova piattaforma sarà richiesto di selezionare le categorie di massimo dettaglio e non sarà più possible scegliere nodi intermedi di categorie Ricorda che – a partire dal tuo prossimo rinnovo all’Albo - sulla nuova piattaforma sarà richiesto di selezionare le categorie di massimo dettaglio e non sarà più possible scegliere nodi intermedi di categorie Sarai comunque ricercabile ed invitabile a gare per le categorie di tuo interesse anche se al momento sei abilitato a  categorie di livello intermedio! Sarai comunque ricercabile ed invitabile a gare per le categorie di tuo interesse anche se al momento sei abilitato a  categorie di livello intermedio! Per le aziende migrate la data di scadenza del primo rinnovo è fissata d’ufficio al 31/12/2023 Per le aziende migrate la data di scadenza del primo rinnovo è fissata d’ufficio al 31/12/2023 SELEZIONABILI SELEZIONABILIEsempioEsempio Per creare un nuovo utente fai una nuova Per creare un nuovo utente fai una nuova p.iva dell’azienda già registrata e negli step successive inserisci i dati del nuovo utente. In questa fase non sarà possibile variare i dati anagrafici precaricati.\n```\n\nFonte: SA_ConfigurazioneDGUE.pdf - Pagina 11 - Sezione 'DETTAGLIO DEI MODULI DA COMPLETARE'\n```\nManuale SA | Configurazione del DGUE Manuale SA | Configurazione del DGUE obbligatoriamente: L’OE può inserire offerta per: selezionare l’opzione dal menù a tendina; Massimo numero di lotti: indicare il valore numerico Massimo numero di lotti aggiudicabili: indicare il valore numerico Cliccare quindi sul comando Salva e, successivamente Chiudi per tornare alla schermata precedente.\n```\n\nFonte: SA_EmissioneGestione_OdF.pdf - Pagina 11 - Sezione 'GESTIONE'\n```\nIl documento eliminato non sarà più visibile nell’elenco degli ordinativi e non potrà essere più ripristinato; Stampa Lista per stampare la lista degli Ordinativi presenti nell’area; Esporta in xlsx per esportare la lista degli Ordinativi in formato xlsx; presente nella lista; Ordinativi; Seleziona permette di selezionare/deselezionare/invertire la selezione sugli elementi della lista. Cliccare sul comando per accedere al dettaglio dell'Ordinativo di Fornitura In lavorazione e procedere con la sua compilazione. Dopo ave cliccato su Crea Ordinativo , verrà mostrato il documento strutturato Ordinativo di Fornitura, Salva per salvare il documento e continuarne la compilazione in un momento successivo; Invia al PO per inviare il documento al Punto Ordinante per l'approvazione e successiva comando risulterà disabilitato se il compilatore del documento coincide con il Punto Ordinante; Invia al Fornitore per inviare il documento direttamente all’operatore economico. Il comando è disponibile solo dopo che è stato ottenuto il CIG derivato ed è stato generato, firmato e riallegato il pdf dell’OdF da parte del PO; Stampa per stampare le informazioni presenti sul documento; Esporta in Excel per esportare il Excel le informazioni presenti sul documento; Verifica Residuo per verificare il residuo della convenzione; Elimina per eliminare il documento fino a quando il relativo Stato è In lavorazione;\n```\n\nFonte: SA_EmissioneGestione_OdF.pdf - Pagina 12 - Sezione 'RICHIESTA CIG E TRASMISSIONE SCHEDE PCP'\n```\nInoltre, una volta inviato il documento, verranno abilitati i comandi: Accettato da parte dell'Operatore Economico (se prevista l'integrazione per la convenzione e fino alla scadenza della stessa); fornitura; Annulla Ordinativo per annullare l’ordinativo. Tale comando risulterà abilitato solo per l’utente dell’Ente con ruolo di Punto Ordinante. Per consentire l’invio della Scheda AD4 alla PCP, nel documento di configurazione dell’OdF sono state introdotti, in aggiunta a quelli già disponibili in piattaforma, i parametri richiesti dalla PCP per la compilare solo le parti relative al CIG Master ed all’utente RUP .\n```\n\nFonte: SA_ConfigurazioneDGUE.pdf - Pagina 13 - Sezione 'SALVATAGGIO DEL DGUE'\n```\nManuale SA | Configurazione del DGUE Manuale SA | Configurazione del DGUE Alcuni moduli prevedono infine l’automatica attivazione di gruppi di domande dipendenti, legate al quanto configurato precedentemente. Ad es. modulo Altri requisiti economici e finanziari , come da immagine seguente. Una volta che sono state predisposte correttamente tutte le sezioni da includere nel documento, cliccare sul comando Salva posizionato nella toolbar in alto nella schermata.\n```\n\nFonte: SA_CPM.pdf - Pagina 21 - Sezione 'SEZIONI'\n```\nSe l’utente collegato ricopre il ruolo di RUP, successivamente all'invio in approvazione della consultazione predisposta da parte del Punto Istruttore, riceverà un'e-mail di notifica della Per visualizzare ed esaminare la consultazione e procedere con la sua Approvazione / Non Consultazioni Preliminari di Mercato e successivamente sulla voce che consente la visualizzazione delle consultazioni in attesa di approvazione Documenti in Approvazione . Nella tabella che verrà mostrata, cliccare sul comando per accedere al dettaglio della consultazione Nella sezione Cronologia , è possibile inserire eventuali Note approvatore e/o Allegati prima di approvare il documento.\n```""]","In base alle informazioni fornite, non è possibile identificare con precisione i soggetti *autorizzati* a compilare e trasmettere le schede PCP nel modulo Esecuzione Contratti. Tuttavia, si possono dedurre alcuni ruoli coinvolti nel processo:

*   **RUP (Responsabile Unico del Procedimento):** La guida menziona che per consentire l'invio della Scheda AD4 alla PCP, nel documento di configurazione dell'OdF sono stati introdotti i parametri richiesti dalla PCP per compilare le parti relative al CIG Master e all'utente RUP.
*   **Punto Ordinante (PO):** Il Punto Ordinante ha un ruolo nell'approvazione e nell'invio del documento al fornitore, e può annullare l'ordinativo.
*   **Fornitore:** L'operatore economico (fornitore) riceve il documento e, se prevista l'integrazione, lo accetta.
*   **Utente dell'Ente:** Un utente dell'ente con ruolo di Punto Ordinante può annullare l'ordinativo.

È probabile che la compilazione e la trasmissione delle schede PCP siano responsabilità del RUP o di altro personale dell'ente appaltante, ma le informazioni non lo specificano esplicitamente. Il fornitore, invece, sembra avere un ruolo più passivo di ricezione e accettazione del documento.","Sì, ci sono due soggetti specifici autorizzati. Il modulo Esecuzione e le relative schede PCP possono essere gestiti solo dal RUP Appaltante (l'utente indicato come RUP/Delegato nella fase di affidamento) o dal DEC (Direttore dell'Esecuzione del Contratto). La guida precisa inoltre che quando opera il DEC, le schede vengono comunque trasmesse ad ANAC a nome del RUP dell'esecuzione.",1.0,0.0,0.0,0.0
"Descrivi il flusso completo per gestire un subappalto per un contratto in esecuzione, dalla richiesta iniziale alla sua conclusione.","[""Informazioni rilevanti trovate nel Knowledge Graph:\n\n✓ **Entità trovata**: toolbar gestione consultazioni preliminari\n  • Tipo: InterfacciaUtenteElemento\n  • Descrizione: Toolbar per la gestione delle consultazioni preliminari visualizzate nella tabella.\n  • Occorrenze nel testo: 1\n  • Varianti trovate: Toolbar Gestione Consultazioni Preliminari\n\n→ **Relazione**: toolbar gestione consultazioni preliminari --[contieneElemento]--> esporta xls\n  • Dettaglio: Comando per esportare il modello in un file xlsx.\n\n→ **Relazione**: toolbar gestione consultazioni preliminari --[contieneElemento]--> stampa lista\n  • Dettaglio: Comando per stampare le informazioni visualizzate nella tabella.\n\n→ **Relazione**: toolbar gestione consultazioni preliminari --[contieneElemento]--> seleziona\n  • Dettaglio: Comando per selezionare/deselezionare più consultazioni preliminari.\n\n→ **Relazione**: toolbar gestione consultazioni preliminari --[eDescrittoIn]--> eliminazione consultazione lavorazione\n  • Dettaglio: La sezione della guida EmPULIA intitolata 'ELIMINAZIONE DI UNA CONSULTAZIONE IN LAVORAZIONE' (ID: SA_CPM.pdf_section_3) da cui provengono queste informazioni.\n\n✓ **Entità trovata**: gestione quesiti chiarimenti\n  • Tipo: SezioneGuida\n  • Descrizione: Manuale per maggiori dettagli sulla creazione di quesiti.\n  • Occorrenze nel testo: 3\n  • Varianti trovate: Gestione quesiti e chiarimenti, GESTIONE QUESITI E CHIARIMENTI\n\n→ **Relazione**: gestione quesiti chiarimenti --[rimandaA]--> chiarimenti\n  • Dettaglio: Comando per creare un quesito d'iniziativa.\n\n→ **Relazione**: gestione quesiti chiarimenti --[eDescrittoIn]--> conversazione\n  • Dettaglio: La sezione della guida EmPULIA intitolata 'CONVERSAZIONE' (ID: SA_CPM.pdf_section_7) da cui provengono queste informazioni.\n\n→ **Relazione**: gestione quesiti chiarimenti --[eDescrittoIn]--> fornitore\n  • Dettaglio: Utente registrato sulla piattaforma EmPULIA.\n\n→ **Relazione**: gestione quesiti chiarimenti --[eDescrittoIn]--> procedura\n  • Dettaglio: I criteri che la password deve rispettare.\n\n→ **Relazione**: gestione quesiti chiarimenti --[eDescrittoIn]--> punto istruttore\n  • Dettaglio: Uno dei ruoli utente sulla piattaforma EmPULIA.\n\n→ **Relazione**: gestione quesiti chiarimenti --[eDescrittoIn]--> conferma\n  • Dettaglio: Azione per confermare un'operazione.\n\n→ **Relazione**: gestione quesiti chiarimenti --[eDescrittoIn]--> chiudi\n  • Dettaglio: Comando dell'interfaccia utente per chiudere la schermata.\n\n→ **Relazione**: gestione quesiti chiarimenti --[eDescrittoIn]--> rup\n  • Dettaglio: Responsabile Unico del Procedimento.\n\n→ **Relazione**: gestione quesiti chiarimenti --[eDescrittoIn]--> approvazione\n  • Dettaglio: Azione di approvazione di un documento.\n\n→ **Relazione**: gestione quesiti chiarimenti --[eDescrittoIn]--> check box\n  • Dettaglio: La casella di controllo associata a ciascuna consultazione.\n\n→ **Relazione**: gestione quesiti chiarimenti --[eDescrittoIn]--> avviso\n  • Dettaglio: Avviso relativo alla consultazione.\n\n→ **Relazione**: gestione quesiti chiarimenti --[eDescrittoIn]--> elenco estensioni\n  • Dettaglio: Elenco delle estensioni generate dalla ricerca.\n\n→ **Relazione**: gestione quesiti chiarimenti --[eDescrittoIn]--> comando conferma\n  • Dettaglio: Comando per confermare la selezione delle estensioni.\n\n→ **Relazione**: gestione quesiti chiarimenti --[eDescrittoIn]--> non approvazione\n  • Dettaglio: Azione di non approvazione del documento"", ""--- Testo Originale dalle Guide per Contesto Aggiuntivo ---\n\nFonte: SA_CPM.pdf - Pagina 5 - Sezione 'ELIMINAZIONE DI UNA CONSULTAZIONE IN LAVORAZIONE'\n```\ninviate dagli Operatori Economici. alla Stazione Appaltante di acquisire maggiori informazioni tecniche ed operative nella preparazione delle Procedure di Gara; agli Operatori Economici di raccogliere informazioni rilevanti sull'appalto in fase di definizione. Riservata . documento strutturato e inviare quest’ultimo in approvazione al Responsabile del Procedimento (R.U.P.) - se diverso dall’Utente collegato - il quale potrà poi procedere alla pubblicazione dello stesso. cliccare sulla sezione Consultazioni Preliminari di Mercato e successivamente sulla voce Consultazioni Preliminari di Mercato .\n```\n\nFonte: SA_CPM.pdf - Pagina 6 - Sezione 'ELIMINAZIONE DI UNA CONSULTAZIONE IN LAVORAZIONE'\n```\nNella parte alta della pagina è presente innanzitutto un’area di filtro che consente all’utente di effettuare ricerche, in base ad uno o più criteri ( es. Registro di Sistema, Nome, Appalto Verde, Appalto Sociale ), tra le consultazioni preliminari nella tabella sottostante (se presenti). Sotto l’area di ricerca, è presente una toolbar per la gestione delle consultazioni preliminari visualizzate nella tabella sottostante, con i seguenti comandi: Stampa Lista per stampare le informazioni visualizzate nella tabella sottostante; Esporta in xls per esportare in formato xlsx le informazioni visualizzate nella tabella sottostante; Seleziona per selezionare/deselezionare con un’unica azione più consultazioni preliminari. Nella tabella sottostante, saranno visibili - se presenti - tutte le consultazioni predisposte (salvate) e/o pubblicate dalla Stazione Appaltante, ordinate per data di creazione (dalla più recente alla meno recente) . Per ogni consultazione è possibile visualizzare il dettaglio (cliccando sulla relativa icona Sistema, Nome, Oggetto, Rispondere Entro Il (scadenza), Stato, Numero Documenti Ricevuti e Numero Quesiti Ricevuti.\n```\n\nFonte: GuidaRapidaMigrazioneOperatoriEconomici.pdf - Pagina 7 - Sezione 'None'\n```\nFORNITORI Se sei già registrato come fornitore sulla piattaforma EmPULIA, la tua utenza è stata migrata anche sulla nuova piattaforma Se sei già registrato come fornitore sulla piattaforma EmPULIA, la tua utenza è stata migrata anche sulla nuova piattaforma Hai dunque ricevuto via email la terna di Password) che saranno valide solo per la nuova piattaforma Hai dunque ricevuto via email la terna di Password) che saranno valide solo per la nuova piattaforma La vecchia piattaforma sarà accessibile con le consuete modalità che già utilizzi La vecchia piattaforma sarà accessibile con le consuete modalità che già utilizzi Entra nella nuova piattaforma utilizzando la terna di credenziali che hai ricevuto Entra nella nuova piattaforma utilizzando la terna di credenziali che hai ricevuto Segui i passaggi descritti di seguito per poter essere subito operativo anche sulla nuova piattafoma Segui i passaggi descritti di seguito per poter essere subito operativo anche sulla nuova piattafoma password rispettando i criteri di sicurezza richiesti ed elencati password rispettando i criteri di sicurezza richiesti ed elencati Le procedure pubblicate sulla vecchia piattaforma saranno accessibili con le precedenti modalità. Le procedure pubblicate sulla vecchia piattaforma saranno accessibili con le precedenti modalità. Tuttavia ricorda che potrebbe essere necessario o utile effettuare alcune ulteriori operazioni, descritte di seguito Tuttavia ricorda che potrebbe essere necessario o utile effettuare alcune ulteriori operazioni, descritte di seguito Accertati che i dati di contatto (telefono e/o email) della tua utenza siano corretti. Clicca su Utente in alto a destra Accertati che i dati di contatto (telefono e/o email) della tua utenza siano corretti. Clicca su Utente in alto a destra Controlla i dati ed eventualmente clicca su numeri di telefono. Controlla i dati ed eventualmente clicca su numeri di telefono. Accertati che i dati (es. Telefono) della tua azienda siano corretti. Clicca su Anagrafica in alto a destra Accertati che i dati (es. Telefono) della tua azienda siano corretti. Clicca su Anagrafica in alto a destra Controlla i dati ed eventualmente clicca su fax e sito web Controlla i dati ed eventualmente clicca su fax e sito web P.IVA, forma giuridica, sedi ecc.) entra dal menu di sinistra in P.IVA, forma giuridica, sedi ecc.) entra dal menu di sinistra in Potrai apportare le modifiche richieste, ma tali modifiche non saranno immediatamente operative. Infatti ti verrà richiesto di generare un pdf con digitalmente e di riallegarlo firmato. Clicca su Invia al termine. Le modifiche dovranno essere Potrai apportare le modifiche richieste, ma tali modifiche non saranno immediatamente operative. Infatti ti verrà richiesto di generare un pdf con digitalmente e di riallegarlo firmato. Clicca su Invia al termine.\n```\n\nFonte: Guida_Rapida_Migrazione_Utenti_SA.pdf - Pagina 7 - Sezione 'None'\n```\nSe sei già registrato ed operativo come utente di una Stazione Appaltante sulla piattaforma EmPULIA, la tua utenza è stata migrata anche sulla nuova piattaforma Se sei già registrato ed operativo come utente di una Stazione Appaltante sulla piattaforma EmPULIA, la tua utenza è stata migrata anche sulla nuova piattaforma Hai dunque ricevuto via email la nuova terna di credenziali valide solo per la nuova piattaforma Hai dunque ricevuto via email la nuova terna di credenziali valide solo per la nuova piattaforma La vecchia piattaforma sarà accessibile con le consuete modalità che già utilizzi La vecchia piattaforma sarà accessibile con le consuete modalità che già utilizzi Entra nella nuova piattaforma utilizzando la terna di credenziali che hai ricevuto Entra nella nuova piattaforma utilizzando la terna di credenziali che hai ricevuto Segui i passaggi descritti di seguito per poter essere subito operativo anche sulla nuova piattafoma Segui i passaggi descritti di seguito per poter essere subito operativo anche sulla nuova piattafoma password rispettando i criteri di sicurezza richiesti ed elencati password rispettando i criteri di sicurezza richiesti ed elencati ad un set molto limitato di funzionalità ad un set molto limitato di funzionalità (angolo alto a destra) (angolo alto a destra) Ricorda che: \uf0d8 Se selezioni Punto Istruttore, dovrai obbligatoriamente indicare un approvatore di riferimento \uf0d8 Se selezioni Punto Ordinante o RUP PDG dovrai generare un pdf riepilogativo , da firmare digitalmente e riallegare firmato per poter \uf0d8 Se selezioni RUP PDG dovrai obbligatoriamente allegare l’ Atto di nomina o idoneità \uf0d8 Se selezioni più ruoli, devi indicare quello prevalente Ricorda che: \uf0d8 Se selezioni Punto Istruttore, dovrai obbligatoriamente indicare un approvatore di riferimento \uf0d8 Se selezioni Punto Ordinante o RUP PDG dovrai generare un pdf riepilogativo , da firmare digitalmente e riallegare firmato per poter \uf0d8 Se selezioni RUP PDG dovrai obbligatoriamente allegare l’ Atto di nomina o idoneità \uf0d8 Se selezioni più ruoli, devi indicare quello prevalente Se non trovi nell’elenco il tuo approvatore, molto probabilmente lo stesso non ha completato la assegnato il ruolo corretto Se non trovi nell’elenco il tuo approvatore, molto probabilmente lo stesso non ha completato la assegnato il ruolo corretto Indica dunque: \uf0d8 Struttura di Appartenenza (richiesto solo per alcuni Enti) \uf0d8 Almeno un approvatore di riferimento (solo se sei Punto Istruttore) Indica dunque: \uf0d8 Struttura di Appartenenza (richiesto solo per alcuni Enti) \uf0d8 Almeno un approvatore di riferimento (solo se sei Punto Istruttore) Se sei Punto Ordinante o RUP PDG devi inoltre cliccare su Genera pdf , firmare digitalmente il documento, riallegarlo firmato tramite Allega pdf firmato . Se hai già generato il pdf e vuoi fare modifiche al contenuto, Se sei Punto Ordinante o RUP PDG devi inoltre cliccare su Genera pdf , firmare digitalmente il documento, riallegarlo firmato tramite Allega pdf firmato .\n```\n\nFonte: SA_CPM.pdf - Pagina 8 - Sezione 'ELIMINAZIONE DI UNA CONSULTAZIONE IN LAVORAZIONE'\n```\nLAVORAZIONE Indipendentemente dallo stato di avanzamento rispetto alla predisposizione e alla compilazione delle da eliminare tra quelle presenti, spuntando la relativa check box e cliccare successivamente sul comando Elimina posizionato nella toolbar in alto.\n```\n\nFonte: SA_ConfigurazioneModelli.pdf - Pagina 8 - Sezione 'INTRODUZIONE'\n```\nManuale SA | Configurazione del Modello di Offerta Manuale SA | Configurazione del Modello di Offerta Vers.2 Esporta in xls Il comando Esporta in xls consente di esportare il modello in un file xlsx per una migliore consultazione dello stesso. Per procedere con il download del file, cliccare quindi sul comando predisposto in alto alla tabella. Giù e Su I comandi consentono di spostare l’ordine delle colonne nella tabella Elenco Prodotti . Il comando Vedi viene mostrato in caso di attributo Gerarchico o Dominio e consente di visualizzare le informazioni che è possibile selezionare tra quelle proposte attraverso, per l’appunto, una struttura gerarchica. Per visualizzare tali informazioni, cliccare sulla lente. Se si vuole eliminare un’informazione presente nella tabella Elenco Prodotti , è necessario aprire il dettaglio del modello attraverso il comando e, nella tabella Attributi da usare nelle fasi della gara Individuata quindi la riga relativa all’attributo da eliminare, cliccare sulla corrispettiva icona del bidone. Ad esempio, se il modello selezionato per la gara prevede l’attributo “Misure”, che nella procedura specifica non si intende richiedere ai partecipanti, si dovrà rimuoverlo dal dettaglio del modello. Ci sono alcuni attributi che non potranno comunque essere rimossi. Nella colonna Attributo , viene indicata la tipologia dell’informazione che verrà richiesta al RUP o all’OE nelle diverse fasi: Text: informazioni di tipo testuale; Number: informazioni di tipo numerico (es. quantità o prezzo); si precisa che per i campi di tipo numerico intero non viene richiesto di specificare il numero di decimali. Attach: informazioni di tipo allegato; Domain: scelta multipla tra più voci proposte; Gerarchico : informazioni da selezionare tra quelle proposte attraverso una struttura gerarchica. Alcuni attributi sono non editabili come, ad esempio, Text – DESCRIZIONE e Number – QUANTITA , altri invece possono essere personalizzati e quindi appariranno editabili come ad esempio Manuale SA | Configurazione del Modello di Offerta Manuale SA | Configurazione del Modello di Offerta Vers.2 In particolare, per alcuni modelli sono stati previsti degli attributi di tipo Text e Number generici che le stazioni appaltanti possono personalizzare inserendo una descrizione per l’informazione richiesta. Per aggiungere una nuova riga che consente di specializzare un nuovo attributo, cliccare sul comando Aggiungi attributo posizionato sopra alla tabella. In fondo alla tabella Attributi da usare nelle fasi della gara , verrà predisposta una nuova riga per la definizione dell’attributo per il quale dovranno essere compilate le informazioni richieste prestando attenzione a non selezionare attributi già previsti nel modello specifico. Non è consentito l'inserimento di attributi duplicati (es. due “Attach – ALLEGATO 1” nello stesso modello). Nella colonna Descrizione Attributo si potrà indicare il nome dell’attributo che gli utenti visualizzeranno.\n```\n\nFonte: Guida_Rapida_Migrazione_Utenti_SA.pdf - Pagina 9 - Sezione 'None'\n```\nSe hai già generato il pdf e vuoi fare modifiche al contenuto, Gli altri campi sono facoltativi Gli altri campi sono facoltativi Effettua il log-out e successivamente rientra con le tue credenziali Effettua il log-out e successivamente rientra con le tue credenziali Troverai nel menu di sinistra tutti i gruppi funzionali a cui sei abilitato sulla base del ruolo assegnato Troverai nel menu di sinistra tutti i gruppi funzionali a cui sei abilitato sulla base del ruolo assegnato Dopo aver caricato il file firmato, clicca su Conferma Dopo aver caricato il file firmato, clicca su Conferma Per maggiori informazioni consulta su http://www.empulia.it i manuali e gli altri strumenti di apprendimento pubblicati nella sezione dedicata alla Migrazione Piattaforma Per maggiori informazioni consulta su http://www.empulia.it i manuali e gli altri strumenti di apprendimento pubblicati nella sezione dedicata alla Migrazione Piattaforma Nella stessa sezione troverai a breve anche degli eventi formativi (webinar) dedicati al passaggio alla nuova piattaforma, ed ai quali ti invitiamo a partecipare! Nella stessa sezione troverai a breve anche degli eventi formativi (webinar) dedicati al passaggio alla nuova piattaforma, ed ai quali ti invitiamo a partecipare!\n```\n\nFonte: SA_CPM.pdf - Pagina 9 - Sezione 'CONVERSAZIONE'\n```\nuna precisa sequenza di compilazione delle diverse sezioni, ad eccezione di alcuni campi che verranno abilitati solo sulla base di determinate selezioni eseguite precedentemente. In generale, è però necessario inserire tutte le informazioni obbligatorie richieste, indicate da label in grassetto e dal simbolo *. Nella parte alta della pagina è presente una toolbar per la gestione del documento con i seguenti comandi: Salva permette di salvare il documento per poi riprenderlo in un secondo momento dalla tabella Consultazioni Preliminari di Mercato; Invio per inviare in approvazione e/o pubblicare il documento; Comunicazioni per inviare, agli operatori economici interessati comunicazioni integrative nonché la comunicazione di chiusura della Consultazione Preliminare; Stampa per stampare il dettaglio del documento visualizzato; Esporta in Excel per esportare in xls il documento visualizzato; Chiarimenti per creare un quesito d'iniziativa. Per maggiori dettagli, consultare il manuale Gestione quesiti e chiarimenti; Esiti/Pubblicazioni ; per pubblicare documenti inerenti agli adempimenti informativi Operatore Economico che ha inviato risposta; Chiudi per chiudere il documento e tornare alla schermata precedente.\n```\n\nFonte: SA_ConfigurazioneDGUE.pdf - Pagina 11 - Sezione 'DETTAGLIO DEI MODULI DA COMPLETARE'\n```\nManuale SA | Configurazione del DGUE Manuale SA | Configurazione del DGUE obbligatoriamente: L’OE può inserire offerta per: selezionare l’opzione dal menù a tendina; Massimo numero di lotti: indicare il valore numerico Massimo numero di lotti aggiudicabili: indicare il valore numerico Cliccare quindi sul comando Salva e, successivamente Chiudi per tornare alla schermata precedente.\n```\n\nFonte: SA_CPM.pdf - Pagina 12 - Sezione 'CREAZIONE CONSULTAZIONE PRELIMINARE'\n```\nNell'area Termini , sarà necessario indicare i termini richiesti rispettando il seguente criterio: considerando l'ordine di posizione dei termini nella sezione Testata (da sinistra a destra), la data del termine successivo deve essere maggiore rispetto alla data impostata per il termine precedente. Inoltre, per i medesimi termini, dovrà essere indicato un orario diverso da 00:00. risposta. Nel caso in cui venga inserito nei campi Termine Richiesta Quesiti , Termine Presentazione Risposte una data nella quale è previsto un fermo di sistema, verrà visualizzato un messaggio di alert e la data sarà in automatico spostata in avanti al primo giorno utile. Appalto Sociale , selezionando si ed inserendo le relative Motivazioni negli appositi campi. inoltre possibile indicare la classe merceologica della consultazione, cliccando comando Merceologia e selezionando la categoria merceologica di interesse tra quelle proposte. Inserire l'informazione Identificativo Iniziativa , selezionandolo tra quelli presenti in elenco. Nella sezione Atti, viene inserita tutta la documentazione relativa alla consultazione (avviso di\n```\n\nFonte: SA_CPM.pdf - Pagina 15 - Sezione 'ELIMINAZIONE DI UNA CONSULTAZIONE IN LAVORAZIONE'\n```\nPer richiedere la firma digitale della documentazione richiesta, spuntare la casella in corrispondenza del documento di interesse nella colonna Richiedi Firma . corrispondenza della riga di interesse. Per copiare una riga già predisposta all'interno della tabella Elenco documenti , cliccare sul comando modificare la descrizione e le caratteristiche tecniche di obbligatorietà e di richiesta della firma digitale e di determinate estensioni del file. Per specificare la tipologia di estensione ammessa per ogni documentazione predisposta, cliccare sul relativo comando nella colonna Tipo File . Di default, sono previste le estensioni .pdf e .p7m. Per modificare i tipi di file ammessi è possibile procedere mediante due modalità: digitare la parola chiave nell'apposito campo per effettuare la ricerca dell'estensione di interesse, cliccare sul comando Cerca , selezionare una o più estensioni tra quelle presenti dall'elenco generato dalla ricerca e cliccare sul comando Conferma . ricercare l'estensione di interesse tra quelle presenti nell'elenco proposto e selezionarla cliccando sulla relativa check box. Cliccare infine sul comando Conferma . dagli operatori economici. Nella sezione verrà infatti mostrata la tabella Elenco Utenti , in cui dovrà essere indicato, per ogni utente, il ruolo assegnato. Poiché è già presente una riga il cui Ruolo è impostato di default su Quesiti , sarà sufficiente procedere con l'indicazione del nominativo dell'utente. Per aggiungere un riferimento, cliccare sul comando Aggiungi e, nella riga predisposta, selezionare il nominativo dell'Utente tra quelli proposti e indicare il Ruolo che gli si intende affidare.\n```\n\nFonte: SA_CPM.pdf - Pagina 21 - Sezione 'SEZIONI'\n```\nSe l’utente collegato ricopre il ruolo di RUP, successivamente all'invio in approvazione della consultazione predisposta da parte del Punto Istruttore, riceverà un'e-mail di notifica della Per visualizzare ed esaminare la consultazione e procedere con la sua Approvazione / Non Consultazioni Preliminari di Mercato e successivamente sulla voce che consente la visualizzazione delle consultazioni in attesa di approvazione Documenti in Approvazione . Nella tabella che verrà mostrata, cliccare sul comando per accedere al dettaglio della consultazione Nella sezione Cronologia , è possibile inserire eventuali Note approvatore e/o Allegati prima di approvare il documento.\n```""]","Purtroppo, le informazioni fornite nel Knowledge Graph e nei documenti di contesto non contengono dettagli specifici sulla gestione dei subappalti. Pertanto, non posso fornire un flusso completo per la gestione di un subappalto basato esclusivamente su queste informazioni.

Tuttavia, posso fornire una struttura generale di come tipicamente si gestisce un subappalto, che potrebbe essere utile nel contesto di EmPULIA, anche se mancano i dettagli specifici della piattaforma:

**Flusso Generale di Gestione di un Subappalto:**

1.  **Richiesta di Autorizzazione (se necessaria):**
    *   L'appaltatore principale (contraente) valuta la necessità di subappaltare una parte del lavoro.
    *   A seconda dei termini del contratto principale e delle normative vigenti, potrebbe essere necessario richiedere l'autorizzazione alla stazione appaltante (committente) per il subappalto. Questa richiesta deve includere informazioni sul subappaltatore proposto, la natura del lavoro da subappaltare e le ragioni del subappalto.

2.  **Selezione del Subappaltatore:**
    *   L'appaltatore principale seleziona un subappaltatore qualificato. Questo processo può includere la valutazione delle capacità tecniche, dell'esperienza, della solidità finanziaria e della conformità normativa del subappaltatore.

3.  **Redazione e Stipula del Contratto di Subappalto:**
    *   L'appaltatore principale e il subappaltatore negoziano e stipulano un contratto di subappalto. Questo contratto deve definire chiaramente l'ambito del lavoro, i termini di pagamento, le responsabilità, le garanzie, le clausole di risoluzione e altri termini e condizioni rilevanti.

4.  **Approvazione del Subappaltatore (se necessaria):**
    *   Se l'autorizzazione al subappalto è richiesta, la stazione appaltante esamina la proposta di subappalto e il subappaltatore proposto.
    *   La stazione appaltante può approvare o respingere la proposta in base a criteri predefiniti.

5.  **Esecuzione del Lavoro Subappaltato:**
    *   Il subappaltatore esegue il lavoro secondo i termini del contratto di subappalto.
    *   L'appaltatore principale supervisiona il lavoro del subappaltatore per garantire la conformità ai requisiti del contratto principale.

6.  **Gestione dei Pagamenti:**
    *   L'appaltatore principale paga il subappaltatore in base ai termini del contratto di subappalto.
    *   I pagamenti possono essere legati al raggiungimento di determinate milestone o alla presentazione di fatture approvate.

7.  **Gestione delle Modifiche:**
    *   Eventuali modifiche all'ambito del lavoro subappaltato devono essere concordate tra l'appaltatore principale e il subappaltatore e documentate per iscritto.
    *   Le modifiche possono richiedere l'approvazione della stazione appaltante, a seconda dei termini del contratto principale.

8.  **Monitoraggio e Controllo Qualità:**
    *   L'appaltatore principale monitora la qualità del lavoro svolto dal subappaltatore.
    *   Vengono eseguiti controlli di qualità per garantire che il lavoro soddisfi i requisiti del contratto principale.

9.  **Gestione delle Controversie:**
    *   Eventuali controversie tra l'appaltatore principale e il subappaltatore vengono risolte in base ai termini del contratto di subappalto.

10. **Chiusura del Subappalto:**
    *   Una volta completato il lavoro subappaltato e tutti i pagamenti effettuati, il contratto di subappalto viene chiuso.
    *   Viene rilasciata una liberatoria finale da parte del subappaltatore.

**Considerazioni Specifiche per EmPULIA (basate sulle informazioni disponibili):**

*   **Gestione Quesiti e Chiarimenti:**  Potrebbe essere necessario utilizzare la funzionalità di ""Gestione quesiti e chiarimenti"" per comunicare con la stazione appaltante in merito al subappalto.
*   **RUP (Responsabile Unico del Procedimento):** Il RUP avrà un ruolo chiave nell'approvazione o nella supervisione del subappalto.
*   **Documentazione:** Assicurarsi che tutta la documentazione relativa al subappalto sia conforme ai requisiti di EmPULIA e che sia firmata digitalmente, se necessario.
*   **Fornitori Registrati:** Verificare che il subappaltatore sia un fornitore registrato sulla piattaforma EmPULIA.

**Limitazioni:**

Senza informazioni più specifiche su come EmPULIA gestisce i subappalti, questo flusso è generico.  È necessario consultare la documentazione completa di EmPULIA e le linee guida specifiche della stazione appaltante per ottenere un quadro completo del processo.","Il flusso completo per gestire un subappalto si articola in tre schede principali. 1. Richiesta (Scheda RSU1): Per avviare il processo, devi andare nella toolbar del contratto in esecuzione, cliccare su 'Funzioni' e selezionare 'Subappalto'. Questo ti permetterà di compilare e inviare la scheda RSU1 con la richiesta. 2. Esito (Scheda ES1): Dopo che la RSU1 è confermata, devi tornare su 'Funzioni' e selezionare 'Esito richiesta subappalto' per creare la scheda ES1 e dare l'esito. 3. Conclusione (Scheda CS1): Infine, una volta confermata la ES1, accedi di nuovo a 'Funzioni' e seleziona 'Conclusione subappalto' per compilare la scheda CS1 che chiude il processo.",0.08108108108108109,0.0,0.0,0.0
In che modo è possibile compilare l'elenco dei prodotti in un questionario fabbisogni?,"[""Informazioni rilevanti trovate nel Knowledge Graph:\n\n✓ **Entità trovata**: compilazione obbligatoria\n  • Tipo: Condizione\n  • Descrizione: La condizione per cui la compilazione di un modulo è obbligatoria per il fornitore.\n  • Occorrenze nel testo: 3\n  • Varianti trovate: Compilazione obbligatoria, Compilazione Obbligatoria\n\n→ **Relazione**: compilazione obbligatoria --[siApplicaA]--> fornitore\n  • Dettaglio: Utente registrato sulla piattaforma EmPULIA.\n\n→ **Relazione**: compilazione obbligatoria --[siApplicaA]--> sezione ente proponente\n  • Dettaglio: La sezione che consente di indicare l’Ente per conto del quale si pubblica l’AD.\n\n→ **Relazione**: compilazione obbligatoria --[eVincolatoDa]--> dati informativi\n  • Dettaglio: Informazioni richieste nella sezione Testata.\n\n→ **Relazione**: compilazione obbligatoria --[eDescrittoIn]--> specializzazione facoltativa altri moduli\n  • Dettaglio: La sezione della guida EmPULIA intitolata 'SPECIALIZZAZIONE FACOLTATIVA DI ALTRI MODULI' (ID: SA_ConfigurazioneDGUE.pdf_section_5) da cui provengono queste informazioni.\n\n→ **Relazione**: compilazione obbligatoria --[eDescrittoIn]--> eliminazione consultazione lavorazione\n  • Dettaglio: La sezione della guida EmPULIA intitolata 'ELIMINAZIONE DI UNA CONSULTAZIONE IN LAVORAZIONE' (ID: SA_CPM.pdf_section_3) da cui provengono queste informazioni.\n\n→ **Relazione**: compilazione obbligatoria --[eDescrittoIn]--> testata\n  • Dettaglio: Una sezione della schermata di consultazione.\n\n→ **Relazione**: compilazione obbligatoria --[puoEseguire]--> stazione appaltante (sa)\n  • Dettaglio: Il ruolo di Stazione Appaltante nella piattaforma.\n\n✓ **Entità trovata**: compilazione dell’offerta\n  • Tipo: FunzionalitàPiattaforma\n  • Descrizione: Fase di compilazione dell'Offerta.\n  • Occorrenze nel testo: 1\n  • Varianti trovate: Compilazione dell’Offerta\n\n→ **Relazione**: compilazione dell’offerta --[eDescrittoIn]--> introduzione\n  • Dettaglio: La sezione della guida EmPULIA intitolata 'INTRODUZIONE' (ID: SA_ConfigurazioneModelli.pdf_section_2) da cui provengono queste informazioni.\n\n✓ **Entità trovata**: compilazione sezioni\n  • Tipo: OperazioneSistema\n  • Descrizione: Sequenza di compilazione delle diverse sezioni del documento.\n  • Occorrenze nel testo: 2\n  • Varianti trovate: Compilazione sezioni\n\n→ **Relazione**: compilazione sezioni --[richiedeInput]--> campo obbligatorio\n  • Dettaglio: Campi che richiedono l'inserimento di informazioni, indicati da label in grassetto e dal simbolo *.\n\n→ **Relazione**: compilazione sezioni --[richiedeInput]--> dati obbligatori\n  • Dettaglio: Informazioni richieste per la compilazione del documento, indicate da label in grassetto e dal simbolo *.\n\n→ **Relazione**: compilazione sezioni --[eDescrittoIn]--> sezioni\n  • Dettaglio: Le sezioni da includere nel documento DGUE.\n\n→ **Relazione**: compilazione sezioni --[eDescrittoIn]--> conversazione\n  • Dettaglio: La sezione della guida EmPULIA intitolata 'CONVERSAZIONE' (ID: SA_CPM.pdf_section_7) da cui provengono queste informazioni.\n\n✓ **Entità trovata**: ripristino compilazione\n  • Tipo: FunzionalitàPiattaforma\n  • Descrizione: La funzionalità di ripristino della compilazione del documento.\n  • Occorrenze nel testo: 1\n  • Varianti trovate: Ripristino compilazione\n\n→ **Relazione**: ripristino compilazione --[richiedeInput]--> documento\n  • Dettaglio: La documentazione di gara.\n\n→ **Relazione**: ripristino compilazione --[eDescrittoIn]--> modifica\n  • Dettaglio: La sezione della guida EmPULIA intitolata 'MODIFICA' (ID: SA_EmissioneGestione_OdF.pdf_section_1) da cui provengono queste informazioni.\n\n✓ **Entità trovata**: compilazione campi\n  • Tipo: AzioneUtente\n  • Descrizione: Azione di compilazione dei campi necessari per l'affidamento diretto.\n  • Occorrenze nel testo: 3\n  • Varianti trovate: Compilazione campi, Compilazione Campi\n\n→ **Relazione**: compilazione campi --[richiedeInput]--> campo obbligatorio\n  • Dettaglio: Campi che richiedono l'inserimento di informazioni, indicati da label in grassetto e dal simbolo *.\n\n→ **Relazione**: compilazione campi --[riguarda]--> campo\n  • Dettaglio: Un campo nell'interfaccia utente dove inserire informazioni.\n\n→ **Relazione**: compilazione campi --[haPassoSuccessivo]--> richiedi cig\n  • Dettaglio: Comando Richiedi CIG presente nella toolbar.\n\n→ **Relazione**: compilazione campi --[eDescrittoIn]--> affidamento diretto accordo quadro\n  • Dettaglio: La sezione della guida EmPULIA intitolata 'AFFIDAMENTO DIRETTO SU ACCORDO QUADRO' (ID: SA_EmissioneGestione_OdF.pdf_section_2) da cui provengono queste informazioni.\n\n→ **Relazione**: compilazione campi --[eDescrittoIn]--> contratti esecuzione\n  • Dettaglio: La sezione della guida EmPULIA intitolata 'CONTRATTI IN ESECUZIONE' (ID: SA_Modulo_Esecuzione_Contratti.pdf_section_0) da cui provengono queste informazioni."", ""--- Testo Originale dalle Guide per Contesto Aggiuntivo ---\n\nFonte: SA_Modulo_Esecuzione_Contratti.pdf - Pagina 2 - Sezione 'CONTRATTI IN ESECUZIONE'\n```\nManuale per Stazioni Appaltanti\n```\n\nFonte: SA_EmissioneGestione_OdF.pdf - Pagina 3 - Sezione 'MODIFICA'\n```\nCrea Ordinativo ................................................................................................................. 8 INVIO .................................................................................................................................... 23 ANNULLAMENTO ORDINATIVO FORNITURA (GESTORE CONVENZIONI) .......................................................................................................................... 36\n```\n\nFonte: SA_EmissioneGestione_OdF.pdf - Pagina 4 - Sezione 'AFFIDAMENTO DIRETTO SU ACCORDO QUADRO'\n```\nPA Pubblica Amministrazione OE Operatore Economico SA Stazione Appaltante RTI Raggruppamento temporaneo di imprese RUP Responsabile Unico di Progetto\n```\n\nFonte: SA_CPM.pdf - Pagina 5 - Sezione 'ELIMINAZIONE DI UNA CONSULTAZIONE IN LAVORAZIONE'\n```\ninviate dagli Operatori Economici. alla Stazione Appaltante di acquisire maggiori informazioni tecniche ed operative nella preparazione delle Procedure di Gara; agli Operatori Economici di raccogliere informazioni rilevanti sull'appalto in fase di definizione. Riservata . documento strutturato e inviare quest’ultimo in approvazione al Responsabile del Procedimento (R.U.P.) - se diverso dall’Utente collegato - il quale potrà poi procedere alla pubblicazione dello stesso. cliccare sulla sezione Consultazioni Preliminari di Mercato e successivamente sulla voce Consultazioni Preliminari di Mercato .\n```\n\nFonte: GuidaRapidaMigrazioneOperatoriEconomici.pdf - Pagina 7 - Sezione 'None'\n```\nFORNITORI Se sei già registrato come fornitore sulla piattaforma EmPULIA, la tua utenza è stata migrata anche sulla nuova piattaforma Se sei già registrato come fornitore sulla piattaforma EmPULIA, la tua utenza è stata migrata anche sulla nuova piattaforma Hai dunque ricevuto via email la terna di Password) che saranno valide solo per la nuova piattaforma Hai dunque ricevuto via email la terna di Password) che saranno valide solo per la nuova piattaforma La vecchia piattaforma sarà accessibile con le consuete modalità che già utilizzi La vecchia piattaforma sarà accessibile con le consuete modalità che già utilizzi Entra nella nuova piattaforma utilizzando la terna di credenziali che hai ricevuto Entra nella nuova piattaforma utilizzando la terna di credenziali che hai ricevuto Segui i passaggi descritti di seguito per poter essere subito operativo anche sulla nuova piattafoma Segui i passaggi descritti di seguito per poter essere subito operativo anche sulla nuova piattafoma password rispettando i criteri di sicurezza richiesti ed elencati password rispettando i criteri di sicurezza richiesti ed elencati Le procedure pubblicate sulla vecchia piattaforma saranno accessibili con le precedenti modalità. Le procedure pubblicate sulla vecchia piattaforma saranno accessibili con le precedenti modalità. Tuttavia ricorda che potrebbe essere necessario o utile effettuare alcune ulteriori operazioni, descritte di seguito Tuttavia ricorda che potrebbe essere necessario o utile effettuare alcune ulteriori operazioni, descritte di seguito Accertati che i dati di contatto (telefono e/o email) della tua utenza siano corretti. Clicca su Utente in alto a destra Accertati che i dati di contatto (telefono e/o email) della tua utenza siano corretti. Clicca su Utente in alto a destra Controlla i dati ed eventualmente clicca su numeri di telefono. Controlla i dati ed eventualmente clicca su numeri di telefono. Accertati che i dati (es. Telefono) della tua azienda siano corretti. Clicca su Anagrafica in alto a destra Accertati che i dati (es. Telefono) della tua azienda siano corretti. Clicca su Anagrafica in alto a destra Controlla i dati ed eventualmente clicca su fax e sito web Controlla i dati ed eventualmente clicca su fax e sito web P.IVA, forma giuridica, sedi ecc.) entra dal menu di sinistra in P.IVA, forma giuridica, sedi ecc.) entra dal menu di sinistra in Potrai apportare le modifiche richieste, ma tali modifiche non saranno immediatamente operative. Infatti ti verrà richiesto di generare un pdf con digitalmente e di riallegarlo firmato. Clicca su Invia al termine. Le modifiche dovranno essere Potrai apportare le modifiche richieste, ma tali modifiche non saranno immediatamente operative. Infatti ti verrà richiesto di generare un pdf con digitalmente e di riallegarlo firmato. Clicca su Invia al termine.\n```\n\nFonte: SA_CPM.pdf - Pagina 7 - Sezione 'CONSULTAZIONE DELLE RISPOSTE'\n```\ncome Responsabile Unico del Procedimento (R.U.P.) e non è più possibile modificarla; Pubblicato : la consultazione è stata approvata/pubblicata dal Responsabile Unico del Procedimento (R.U.P.) ed è pertanto visibile agli operatori economici, che potranno presentare la risposta; Rifiutato : la consultazione non è stata approvata dal Responsabile Unico del Procedimento (R.U.P.); Rettificato : la consultazione è stata rettificata; e non è più possibile inviare risposte e/o ulteriori comunicazioni. riportata al di sopra della tabella con l'elenco delle consultazioni. della consultazione e per ciascuna di esse è possibile consultare lo specifico paragrafo disponibile nel presente manuale. In particolare, la schermata presenterà le seguenti sezioni: Testata , Atti , Busta\n```\n\nFonte: SA_ConfigurazioneDGUE.pdf - Pagina 7 - Sezione 'SPECIALIZZAZIONE FACOLTATIVA DI ALTRI MODULI'\n```\nManuale SA | Configurazione del DGUE Manuale SA | Configurazione del DGUE Se si disattiva una Parte, vengono disabilitate anche le Sezioni ed i Moduli Richieste relativi; se si disattiva una Sezione, vengono disabilitati tutti i Moduli Richieste relativi. Altrimenti si può procedere alla ATTENZIONE : se le sezioni/moduli vengono lasciati attivi, al fornitore potrebbe venir richiesta la compilazione obbligatoria delle risposte per quei moduli. Pertanto, si segnala l’opportunità di disattivare sezioni/moduli non pertinenti o per le quali non interessa conoscere il dato ai fini della gara in composizione. La colonna Indice fa riferimento all’indice previsto dalla tassonomia AGID La colonna Tipologia indica se si tratta di Parte, Sezione o Modulo Richiesta. La colonna Descrizione contiene la descrizione prevista secondo tassonomia AGID. Nella colonna Esito Riga vengono visualizzate icone rosse o verdi in prossimità delle informazioni che richiedono un inserimento di dati obbligatori da parte della Stazione Appaltante. Il bollino rosso indica che una o più informazioni obbligatorie non sono presenti ed andranno compilate dalla SA cliccando sulla lente in corrispondenza della colonna Apri (vedi immagine precedente). In particolare, in prossimità delle informazioni relative a Identità del committente , l’icona risulta essere già verde in quanto le informazioni vengono ereditate in automatico dalla gara. singoli Moduli Richieste, ed in particolare per: Visualizzare l’anteprima della domanda posta al fornitore; Completare informazioni mancanti non obbligatorie o specificare criteri minimi di selezione (es. fatturato, numero di referenze, abilitazioni o certificazioni ecc.) richiesti. Con riferimento ai valori relativi ai criteri minimi di selezione, che la SA dovrebbe specificare modulo per modulo, si segnala che la piattaforma consente comunque la non definizione degli stessi all’interno del DGUE strutturato, riportando la precisazione: Se il Requisito minimo non è valorizzato far riferimento alla documentazione di gara. Tale impostazione semplifica la compilazione del DGUE per la SA, rendendo di chiaramente riportati nella documentazione di gara.\n```\n\nFonte: SA_ConfigurazioneModelli.pdf - Pagina 7 - Sezione 'INTRODUZIONE'\n```\nVerrà mostrata una schermata nella quale è presente una toolbar con una serie di comandi per la gestione del documento: Salva: permette di salvare la personalizzazione del modello per poterlo riprendere in un secondo momento (cliccando sempre sul comando Apri dettagli modello , viene riproposta sempre l’ultima versione salvata); Conferma: applica le modifiche apportate al modello; per un altro utente registrato ed abilitato alla gestione dello stesso sulla gara; un altro utente registrato ed abilitato alla gestione dello stesso sulla gara; dello stesso sulla gara; Stampa: permette di stampare la pagina visualizzata; Manuale SA | Configurazione del Modello di Offerta Manuale SA | Configurazione del Modello di Offerta Vers.2 Esporta in XML: permette di esportare le informazioni contenute sulla pagina in formato XML; Chiudi: per tornare alla pagina precedente. Nell’area sottostante verranno visualizzate una serie di informazioni identificative e non editabili quali A seguire, viene invece riportato l’ Ambito di riferimento, precedentemente selezionato nella sezione Prodotti / Lotti e le quattro tabelle che consentono la configurazione del modello, ciascuna con i relativi comandi. In particolare, vengono mostrate le seguenti tabelle , descritte dettagliatamente nei paragrafi successivi: Attributi da usare nelle fasi della gara: nella tabella si definiscono gli attributi con le relative caratteristiche ed il momento in cui verranno richiesti; Calcolo del valore economico: nella tabella viene definito il calcolo sulla base del quale la piattaforma definirà il valore offerto da ciascun offerente; Colonne calcolate: nella tabella verranno definite le formule di calcolo per tutti gli attributi per i quali si è definito di usare un valore calcolato; Vincoli sugli attributi del modello: la tabella permette di configurare eventuali vincoli sugli attributi. Tutte le voci della colonna Descrizione Attributo presenti nella tabella Attributi da usare nelle fasi della gara corrispondono alla denominazione delle singole colonne che compongono la corrispettiva tabella Elenco Prodotti nella sezione Prodotti / Lotti . Manuale SA | Configurazione del Modello di Offerta Manuale SA | Configurazione del Modello di Offerta Vers.2 Sopra alla tabella Attributi da usare nelle fasi della gara , è disponibile una toolbar con alcuni comandi per la gestione della stessa. Aggiungi Attributo Consente l’aggiunta di un nuovo attributo, definito liberamente dall’utente compilatore. L’attributo aggiunto viene aggiunto in fondo alla tabella, può essere spostato e devono essere compilate tutte le relative opzioni; Nascondi e Visualizza I comandi Nascondi e Visualizza permettono di nascondere/visualizzare determinate colonne per semplificare la lettura della tabella. Per visualizzare nuovamente una o tutte le colonne nascoste, cliccare sul comando Visualizza e selezionare la voce desiderata. La colonna selezionata verrà resa nuovamente visibile nella tabella degli attributi.\n```\n\nFonte: SA_CPM.pdf - Pagina 9 - Sezione 'CONVERSAZIONE'\n```\nuna precisa sequenza di compilazione delle diverse sezioni, ad eccezione di alcuni campi che verranno abilitati solo sulla base di determinate selezioni eseguite precedentemente. In generale, è però necessario inserire tutte le informazioni obbligatorie richieste, indicate da label in grassetto e dal simbolo *. Nella parte alta della pagina è presente una toolbar per la gestione del documento con i seguenti comandi: Salva permette di salvare il documento per poi riprenderlo in un secondo momento dalla tabella Consultazioni Preliminari di Mercato; Invio per inviare in approvazione e/o pubblicare il documento; Comunicazioni per inviare, agli operatori economici interessati comunicazioni integrative nonché la comunicazione di chiusura della Consultazione Preliminare; Stampa per stampare il dettaglio del documento visualizzato; Esporta in Excel per esportare in xls il documento visualizzato; Chiarimenti per creare un quesito d'iniziativa. Per maggiori dettagli, consultare il manuale Gestione quesiti e chiarimenti; Esiti/Pubblicazioni ; per pubblicare documenti inerenti agli adempimenti informativi Operatore Economico che ha inviato risposta; Chiudi per chiudere il documento e tornare alla schermata precedente.\n```\n\nFonte: SA_Indizione_Affidamento_diretto_richiesta_CIG.pdf - Pagina 10 - Sezione 'SEZIONI'\n```\nL’utente, una volta configurato e confermato il wizard di creazione, verrà indirizzato sul documento Pur non essendo prevista una precisa sequenza di compilazione delle diverse sezioni, si suggerisce di compilarle nell’ordine proposto da sinistra a destra, in modo da non dover imputare più volte dati o parametri richiesti in diverse sezioni. È necessario inserire tutte le informazioni obbligatorie richieste, indicate da label in grassetto e dal simbolo *. INTESTAZIONE compilatore del documento) e altre da indicare manualmente. Assegnare, innanzitutto, un nome all’AD, compilando il campo Titolo Documento . Tale titolo è una descrizione abbreviata dell’oggetto, visibile solo dagli utenti della SA. L’oggetto completo dell’AD, infatti, sarà specificato in seguito. I campi relativi a Fascicolo di Sistema, Registro di sistema, Data invio, Fase saranno auto compilati dalla piattaforma all’invio in pubblicazione. È possibile compilare i dati relativi al Protocollo ( Fascicolo, Protocollo, Data protocollo ). In base all’importo dell’AD o ad altri parametri, nel campo Scheda PCP , la piattaforma indicherà la scheda che verrà trasmessa in interoperabilità (AD3, AD5, AD25, A3_6). lo stato della procedura con riferimento alle attività in interoperabilità con la PCP di ANAC ed è inizialmente vuoto.\n```\n\nFonte: SA_CPM.pdf - Pagina 11 - Sezione 'ELIMINAZIONE DI UNA CONSULTAZIONE IN LAVORAZIONE'\n```\nNella sezione Testata è richiesto l’inserimento di alcuni dati informativi per alcuni dei quali è richiesta la compilazione obbligatoria indicata da label in grassetto e dal simbolo *. Se all’utenza collegata è assegnato un solo Responsabile, il campo R.U.P. potrà essere già precompilato con il corrispondente nominativo. R.U.P. tra quelli proposti.\n```\n\nFonte: SA_ConfigurazioneDGUE.pdf - Pagina 13 - Sezione 'SALVATAGGIO DEL DGUE'\n```\nManuale SA | Configurazione del DGUE Manuale SA | Configurazione del DGUE Alcuni moduli prevedono infine l’automatica attivazione di gruppi di domande dipendenti, legate al quanto configurato precedentemente. Ad es. modulo Altri requisiti economici e finanziari , come da immagine seguente. Una volta che sono state predisposte correttamente tutte le sezioni da includere nel documento, cliccare sul comando Salva posizionato nella toolbar in alto nella schermata.\n```\n\nFonte: SA_ConfigurazioneModelli.pdf - Pagina 15 - Sezione 'INTRODUZIONE'\n```\nAggiungere Operando (attributo da inserire nella formula) e Operatore (operazione aritmetica da eseguire) selezionandoli dai rispettivi menù a tendina e cliccando su Aggiungi operando / Aggiungi operatore. Manuale SA | Configurazione del Modello di Offerta Manuale SA | Configurazione del Modello di Offerta Vers.2 In alternativa è possibile anche scrivere gli Operatori direttamente tramite tastiera, avendo cura di utilizzare i simboli corretti. Al termine della selezione procedere con il pulsante Verifica formula . Se la verifica va a buon fine, cliccare su OK . La Formula definita verrà riportata nell'omonimo campo della tabella Colonne calcolate . Nell'area Vincoli sugli attributi del modello è possibile definire dei vincoli nel modello di offerta che l’utente della Stazione Appaltante e/o dell’Operatore Economico dovrà osservare rispettivamente in fase di predisposizione del Bando e/o di compilazione dell’Offerta. Per aggiungere un nuovo vincolo, cliccare sul comando Aggiungi vincolo , inserire la Descrizione Vincolo e selezionare il Contesto Manuale SA | Configurazione del Modello di Offerta Manuale SA | Configurazione del Modello di Offerta Vers.2 Il contesto indica in quale fase verrà richiesta la verifica sul rispetto del vincolo: BANDO/APPALTO SPECIFICO : se il vincolo è definito per l’utente della Stazione Appaltante per la compilazione della tabella Elenco Prodotti in fase di predisposizione del Bando; OFFERTA : se il vincolo è definito per l’utente dell’Operatore Economico in fase di compilazione dell’Offerta. Per inserire poi l’ Espressione del vincolo, cliccare sulla lente nella colonna Apri della tabella. Al momento del clic sulla lente, verrà mostrata una schermata in cui il campo Descrizione Vincolo sarà precompilato sulla base delle informazioni inserite nella tabella Vincoli sugli attributi del modello . Tutti gli attributi coinvolti devono essere di tipo numerico. Aggiungere Operando (attributo da inserire nella formula) e Operatore (operazione aritmetica da eseguire) selezionandoli dai rispettivi menù a tendina e cliccando su Aggiungi operando / Aggiungi operatore Al termine della selezione procedere con il pulsante Verifica vincoli . Se la verifica va a buon fine, proseguire con la OK . Il Vincolo definito verrà riportata nell'omonimo campo della tabella Apportate le opportune modifiche e/o personalizzazioni al modello precaricato relativamente agli Attributi da usare nelle fasi di gara , al Calcolo del valore economico e alle Colonne calcolate , cliccare sul comando Conferma presente nella toolbar in alto nella schermata. Manuale SA | Configurazione del Modello di Offerta Manuale SA | Configurazione del Modello di Offerta Vers.2 Le immagini sono puramente indicative e possono subire variazioni.\n```\n\nFonte: SA_EmissioneGestione_OdF.pdf - Pagina 18 - Sezione 'RICHIESTA CIG E TRASMISSIONE SCHEDE PCP'\n```\neliminare e cliccare sul comando Elimina posizionato nella toolbar in alto. per aprire il dettaglio dell'Ordinativo di Fornitura In lavorazione . Successivamente, aperto il documento, cliccare sul comando Elimina posizionato nella toolbar in alto nella schermata. l’apposito comando Richiedi CIG presente nella toolbar dei comandi.\n```\n\nFonte: SA_IndizioneProceduraGara_AppaltoSpecifico.pdf - Pagina 18 - Sezione 'TESTATA'\n```\nUna volta definita la tipologia di gara ed i relativi importi, il campo Scheda PCP identificherà il codice della scheda che sarà trasmessa alla PCP. La combinazione di tipologia di procedura, settore, regime, importo rispetto alla soglia, serve alla piattaforma per identificare la scheda corretta da trasmettere alla della procedura con riferimento alle attività in interoperabilità con la PCP di ANAC ed è inizialmente vuoto. Lo Stato PCP ha impatti sia sui comandi all’interno del menù Gestione PCP sia sull’attivazione del comando Invio per la pubblicazione della procedura su EmPULIA. A titolo esemplificativo il pulsante Pubblica Avviso si attiva solo se lo Stato PCP corrisponde a CIG recuperato , ed il comando Invio è disponibile solo se lo Stato PCP corrisponde almeno ad Avviso in pubblicazione, come meglio descritto nel par. 8. la compilazione obbligatoria indicata da label in grassetto e dal simbolo *. Si suddivide in diverse sottosezioni. La sezione Ente Proponente consente di indicare l’Ente per conto del quale si pubblica l’AD (attraverso selezione da menù dello stesso tra tutti gli Enti profilati in piattaforma), qualora questo sia differente rispetto all’Ente Appaltante, nonché il relativo RUP. Si precisa che l’utente indicato come assegnate all’Ente Proponente sulla gara. Il dato è pertanto puramente informativo, essendo peraltro richiesto dalla PCP di ANAC.\n```\n\nFonte: SA_FunzioniBando.pdf - Pagina 27 - Sezione 'FUNZIONI'\n```\npubblicato Nella sezione superiore del documento, vengono poi riportate informazioni identificative del bando a cui fa riferimento il documento di ripristino, il Compilatore del documento e il suo Stato (inizialmente In Lavorazione). Le informazioni Registro di Sistema e Data invio fanno riferimento al documento di ripristino e pertanto verranno compilate automaticamente al momento dell’invio. A seconda della tipologia di procedura di gara, il sistema consentirà la modifica di determinate date. In particolare, il Sistema non effettua alcun controllo in merito alle date precedentemente indicate nel bando/invito/avviso, né sul superamento del termine di presentazione offerte/risposte. Nel dettaglio se, contestualmente al ripristino, per la procedura di gara, viene modificata una data (o più date), all'Operatore Economico verrà data evidenza nel dettaglio del bando della Data Originale e della Data Prorogata . In caso contrario, verranno visualizzate le date originarie senza alcuna dicitura. Per modificare un termine, posizionarsi nel relativo campo e riportare le informazioni di dettaglio richieste (data, ora, minuti), indicando un orario diverso da 00:00. In alternativa, per indicare una nuova data, fare clic sul comando con i tre punti e scegliere dal calendario che verrà visualizzato la data desiderata, selezionando il pulsante Conferma per salvare l’informazione. Valgono le regole già descritte in merito alla scelta di una data/ora in cui sono previsti interventi manutentivi o di un orario prossimo a tale intervento.\n```\n\nFonte: SA_EmissioneGestione_OdF.pdf - Pagina 36 - Sezione 'MODIFICA'\n```\nPredisposto il documento, procedere quindi con la generazione e la firma del documento, ed il conseguente invio all'utente con ruolo Gestore convenzioni , cliccando sul comando Genera PDF per scaricare il documento pdf. Salvato il file sul proprio computer e dopo averlo firmato digitalmente, cliccare sul comando Allega PDF Firmato per riallegarlo. Prima dell’invio del documento, è possibile modificare le relative informazioni cliccando sul comando La compilazione del documento verrà ripristinata e, apportate le modifiche necessarie, sarà necessario procedere con la generazione ed il caricamento del documento firmato digitalmente secondo quanto descritto precedentemente. Predisposto correttamente il documento Annulla Ordinativo , cliccare sul comando Invia posizionato nella toolbar in alto nella schermata per inviarlo all'utente con ruolo Gestore convenzioni . Al momento dell'invio, il Sistema verifica che non siano stati superati i termini della Convenzione e, contestualmente, invierà un'e-mail di notifica all'utente con ruolo Gestore convenzioni , per avvertirlo della nuova richiesta da valutare. Lo Stato del documento cambierà da In lavorazione ad In approvazione ed un messaggio di informazione a video confermerà l'operazione.\n```\n\nFonte: SA_EmissioneGestione_OdF.pdf - Pagina 50 - Sezione 'AFFIDAMENTO DIRETTO SU ACCORDO QUADRO'\n```\nDopo avere compilato tutti i campi necessari, utilizzare l’opzione Richiedi CIG (presente nella toolbar l’ottenimento del CIG derivato. Qualora il comando sia attivato da un Punto Istruttore, è necessario che il RUP indicato nel documento abbia effettuato almeno un accesso con sistema di autenticazione forte (SPID o CIE/CNS) negli ultimi 30 giorni. L’operazione potrebbe richiedere qualche minuto per cui si consiglia di verificare l’esito visualizzando la sezione Cronologia PCP (presente in fondo alla pagina): Una volta ottenuto il CIG derivato, viene inviata una mail di notifica al RUP ed una all’aggiudicatario indicati nel documento. L’aggiudicatario ha inoltre accesso, previa autenticazione in piattaforma, al\n```""]","Per compilare l'elenco dei prodotti in un questionario fabbisogni, basandosi sulle informazioni fornite, si possono seguire questi passaggi:

1.  **Identificare gli attributi rilevanti:** Nella sezione ""INTRODUZIONE"" della guida SA\_ConfigurazioneModelli.pdf, si menziona che le voci della colonna ""Descrizione Attributo"" nella tabella ""Attributi da usare nelle fasi della gara"" corrispondono alla denominazione delle singole colonne che compongono la tabella ""Elenco Prodotti"" nella sezione ""Prodotti / Lotti"". Quindi, il primo passo è definire quali attributi descrivono i prodotti che si vogliono acquisire.

2.  **Configurare il modello di offerta:** Utilizzare la tabella ""Attributi da usare nelle fasi della gara"" per definire gli attributi con le relative caratteristiche e il momento in cui verranno richiesti.  Questo include l'aggiunta di nuovi attributi, se necessario, e la compilazione di tutte le opzioni relative a ciascun attributo.

3.  **Definire il calcolo del valore economico (se applicabile):** Se il valore economico dei prodotti deve essere calcolato in base a determinati attributi, utilizzare la tabella ""Calcolo del valore economico"" per definire la formula di calcolo.

4.  **Definire colonne calcolate (se applicabile):** Se sono necessari attributi calcolati, utilizzare la tabella ""Colonne calcolate"" per definire le formule di calcolo per tali attributi.

5.  **Definire vincoli sugli attributi (se applicabile):** Se ci sono vincoli sugli attributi dei prodotti, utilizzare la tabella ""Vincoli sugli attributi del modello"" per configurare tali vincoli.  Specificare il contesto in cui il vincolo deve essere applicato (BANDO/APPALTO SPECIFICO per la Stazione Appaltante o OFFERTA per l'Operatore Economico).

6.  **Compilare la tabella ""Elenco Prodotti"" nella sezione ""Prodotti / Lotti"":**  Utilizzare gli attributi definiti nel passaggio 1 per compilare la tabella ""Elenco Prodotti"".  Assicurarsi di rispettare eventuali vincoli definiti nel passaggio 5.

7.  **Considerare la specializzazione facoltativa di altri moduli (DGUE):** Nella guida SA\_ConfigurazioneDGUE.pdf, si sottolinea l'importanza di disattivare sezioni/moduli non pertinenti nel DGUE per evitare di richiedere ai fornitori la compilazione obbligatoria di informazioni non necessarie.

In sintesi, la compilazione dell'elenco dei prodotti in un questionario fabbisogni richiede una definizione accurata degli attributi rilevanti, la configurazione del modello di offerta e la compilazione della tabella ""Elenco Prodotti"" con le informazioni specifiche sui prodotti.","È possibile compilare l'elenco dei prodotti in due modi. La prima modalità è direttamente a video, compilando i campi per ogni prodotto e usando il comando 'Verifica Informazioni'. In alternativa, è possibile scaricare un modello Excel (.xlsx) tramite l'icona 'Template prodotti da compilare', compilarlo offline e poi ricaricarlo sulla piattaforma tramite l'icona 'Carica file prodotti'.",0.8518518518518519,0.9738379368683084,0.0,0.0
Come può un referente fabbisogni delegare la compilazione dei questionari ad altri utenti e monitorarne il progresso?,"[""Informazioni rilevanti trovate nel Knowledge Graph:\n\n✓ **Entità trovata**: rup/delegato fase affidamento\n  • Tipo: RuoloUtente\n  • Descrizione: Responsabile Unico del Procedimento o suo delegato per la fase di affidamento.\n  • Occorrenze nel testo: 1\n  • Varianti trovate: RUP/Delegato per la fase di affidamento\n\n✓ **Entità trovata**: delegato fase affidamento\n  • Tipo: RuoloUtente\n  • Descrizione: Utente delegato dal RUP per la fase di affidamento.\n  • Occorrenze nel testo: 1\n  • Varianti trovate: Delegato per la fase di affidamento\n\n→ **Relazione**: delegato fase affidamento --[eEseguitaDa]--> trasmissione scheda esecuzione\n  • Dettaglio: Azione di invio delle schede di esecuzione.\n\n→ **Relazione**: delegato fase affidamento --[eDescrittoIn]--> contratti esecuzione\n  • Dettaglio: La sezione della guida EmPULIA intitolata 'CONTRATTI IN ESECUZIONE' (ID: SA_Modulo_Esecuzione_Contratti.pdf_section_0) da cui provengono queste informazioni.\n\n→ **Relazione**: delegato fase affidamento --[puoEseguire]--> trasmissione scheda esecuzione\n  • Dettaglio: Azione di invio delle schede di esecuzione.\n\n✓ **Entità trovata**: gara delega\n  • Tipo: FunzionalitàPiattaforma\n  • Descrizione: L’istituto è assimilabile alla gara su delega.\n  • Occorrenze nel testo: 3\n  • Varianti trovate: Gara su delega, Gara su Delega\n\n→ **Relazione**: gara delega --[siApplicaA]--> accordo servizio\n  • Dettaglio: Parametro che indica se la gara è su delega.\n\n→ **Relazione**: gara delega --[siApplicaA]--> trasferimento contratto\n  • Dettaglio: Funzionalità di trasferimento di un contratto ad altro RUP\n\n→ **Relazione**: gara delega --[haPassoSuccessivo]--> chiusura manuale gara\n  • Dettaglio: La possibilità di chiudere manualmente la gara senza passare dal contratto.\n\n→ **Relazione**: gara delega --[eDescrittoIn]--> procedura\n  • Dettaglio: I criteri che la password deve rispettare.\n\n→ **Relazione**: gara delega --[eDescrittoIn]--> documenti\n  • Dettaglio: Sezione della piattaforma dedicata ai documenti.\n\n→ **Relazione**: gara delega --[eDescrittoIn]--> trasferisci contratto\n  • Dettaglio: La sezione della guida EmPULIA intitolata 'TRASFERISCI CONTRATTO' (ID: SA_Trasferimento_ProceduraContratto_altroRUP.pdf_section_6) da cui provengono queste informazioni."", ""--- Testo Originale dalle Guide per Contesto Aggiuntivo ---\n\nFonte: SA_Modulo_Esecuzione_Contratti.pdf - Pagina 2 - Sezione 'CONTRATTI IN ESECUZIONE'\n```\nManuale per Stazioni Appaltanti\n```\n\nFonte: Guida_Rapida_Migrazione_Utenti_SA.pdf - Pagina 7 - Sezione 'None'\n```\nSe sei già registrato ed operativo come utente di una Stazione Appaltante sulla piattaforma EmPULIA, la tua utenza è stata migrata anche sulla nuova piattaforma Se sei già registrato ed operativo come utente di una Stazione Appaltante sulla piattaforma EmPULIA, la tua utenza è stata migrata anche sulla nuova piattaforma Hai dunque ricevuto via email la nuova terna di credenziali valide solo per la nuova piattaforma Hai dunque ricevuto via email la nuova terna di credenziali valide solo per la nuova piattaforma La vecchia piattaforma sarà accessibile con le consuete modalità che già utilizzi La vecchia piattaforma sarà accessibile con le consuete modalità che già utilizzi Entra nella nuova piattaforma utilizzando la terna di credenziali che hai ricevuto Entra nella nuova piattaforma utilizzando la terna di credenziali che hai ricevuto Segui i passaggi descritti di seguito per poter essere subito operativo anche sulla nuova piattafoma Segui i passaggi descritti di seguito per poter essere subito operativo anche sulla nuova piattafoma password rispettando i criteri di sicurezza richiesti ed elencati password rispettando i criteri di sicurezza richiesti ed elencati ad un set molto limitato di funzionalità ad un set molto limitato di funzionalità (angolo alto a destra) (angolo alto a destra) Ricorda che: \uf0d8 Se selezioni Punto Istruttore, dovrai obbligatoriamente indicare un approvatore di riferimento \uf0d8 Se selezioni Punto Ordinante o RUP PDG dovrai generare un pdf riepilogativo , da firmare digitalmente e riallegare firmato per poter \uf0d8 Se selezioni RUP PDG dovrai obbligatoriamente allegare l’ Atto di nomina o idoneità \uf0d8 Se selezioni più ruoli, devi indicare quello prevalente Ricorda che: \uf0d8 Se selezioni Punto Istruttore, dovrai obbligatoriamente indicare un approvatore di riferimento \uf0d8 Se selezioni Punto Ordinante o RUP PDG dovrai generare un pdf riepilogativo , da firmare digitalmente e riallegare firmato per poter \uf0d8 Se selezioni RUP PDG dovrai obbligatoriamente allegare l’ Atto di nomina o idoneità \uf0d8 Se selezioni più ruoli, devi indicare quello prevalente Se non trovi nell’elenco il tuo approvatore, molto probabilmente lo stesso non ha completato la assegnato il ruolo corretto Se non trovi nell’elenco il tuo approvatore, molto probabilmente lo stesso non ha completato la assegnato il ruolo corretto Indica dunque: \uf0d8 Struttura di Appartenenza (richiesto solo per alcuni Enti) \uf0d8 Almeno un approvatore di riferimento (solo se sei Punto Istruttore) Indica dunque: \uf0d8 Struttura di Appartenenza (richiesto solo per alcuni Enti) \uf0d8 Almeno un approvatore di riferimento (solo se sei Punto Istruttore) Se sei Punto Ordinante o RUP PDG devi inoltre cliccare su Genera pdf , firmare digitalmente il documento, riallegarlo firmato tramite Allega pdf firmato . Se hai già generato il pdf e vuoi fare modifiche al contenuto, Se sei Punto Ordinante o RUP PDG devi inoltre cliccare su Genera pdf , firmare digitalmente il documento, riallegarlo firmato tramite Allega pdf firmato .\n```\n\nFonte: SA_Modulo_Esecuzione_Contratti.pdf - Pagina 7 - Sezione 'ACCESSO AL FLUSSO DI ESECUZIONE'\n```\nIl modulo Esecuzione e le relative schede PCP sono accessibili, compilabili e trasmissibili solo dai seguenti soggetti: affidamento in Testata nel momento della configurazione della procedura di gara/affidamento. Si tratta di fatto dell’utente che ha staccato il CIG in interoperabilità tramite PCP. trasferendogli il contratto/affidamento tramite la funzionalità descritta al par. 20. Si precisa che nel caso di utilizzo della funzionalità da parte del DEC, le schede vengono sempre trasmesse ad ANAC a nome del RUP dell’esecuzione (e dunque del RUP/Delegato per la fase di affidamento o, in caso di trasferimento, del nuovo RUP dell’esecuzione). Per tale motivo è indispensabile che l’utente RUP sia profilato correttamente su ANAC ed abbia eseguito almeno un accesso negli ultimi 30 giorni con un sistema di autenticazione forte (SPID, CIE/CNS). propria area riservata, cliccare sul gruppo funzionale Esecuzione . Cliccando su questa voce verrà mostrato l’elenco delle funzionalità relative all’esecuzione, ovvero: contratto) e la scheda S3 (Incarichi tecnici), per cui non è già stata inviata nessuna delle seguenti schede: esecuzione) e per cui non è già stata inviata la scheda di conclusione (CO1 o CO2); quali è stata inviata la scheda CO2 (conclusione esecuzione).\n```\n\nFonte: SA_Trasferimento_ProceduraContratto_altroRUP.pdf - Pagina 11 - Sezione 'TRASFERISCI CONTRATTO'\n```\nManuale SA | Trasferimento di una procedura o di un contratto ad altro RUP contratto , è possibile indicare il RUP dell’esecuzione abilitato a gestire il contratto fino alla conclusione dell’esecuzione. Il trasferimento può avvenire anche nei confronti di un RUP di un altro Ente per consentire la stipula/esecuzione dei contratti derivanti da gare su delega. La piattaforma propone come RUP dell’Esecuzione quello indicato nella fase precedente, ovvero: il RUP Appaltante se non sono mai stati effettuati trasferimenti in fase di Procedura di Aggiudicazione; il RUP dell’esecuzione al quale è stata trasferita la Procedura di Aggiudicazione. È possibile modificare il nominativo proposto dalla piattaforma, eventualmente allargando la nomina ad utenti di altri enti nel caso di contratti derivanti da gare su delega. Solo nel caso in cui venga modificato il nominativo proposto dalla piattaforma, si deve cliccare sul comando Trasferisci contratto. a video.\n```\n\nFonte: SA_CPM.pdf - Pagina 17 - Sezione 'SEZIONI'\n```\nNel caso in cui vengano inserite eventuali Note Approvatore e/o Allegati , all'atto del salvataggio/invio della consultazione, nella sezione Cronologia la tabella Operazioni Effettuate verrà alimentata automaticamente. Nella sezione Documenti è possibile visualizzare tutti i documenti generati da piattaforma e collegati alla consultazione, come ad esempio eventuali comunicazioni e/o documenti di Rettifica e Proroga (anche solo in fase di lavorazione). Durante la fase di indizione della consultazione, e dunque di\n```\n\nFonte: SA_IndizioneProceduraGara_AppaltoSpecifico (1).pdf - Pagina 24 - Sezione 'CREAZIONE PROCEDURA DI GARA'\n```\nVisualizza notifiche: se impostato su sì, è previsto l'invio di un'e-mail di notifica al offerte pervenute e la loro visualizzazione nella relativa sezione del bando. In particolare, se l'informazione Visualizza Notifiche è impostata su si, per i documenti che lo prevedono (es. rettifica, proroga), il comando Info Mail verrà attivato contestualmente all'invio del documento. In caso contrario, ovvero se l'informazione Visualizza Notifiche è stata impostata su no, il comando verrà attivato solo al raggiungimento del termine di presentazione delle offerte indicato nel bando su No non verrà richiesta alcuna busta amministrativa. Accordo di servizio: Indicare sì in caso di gara su delega, per la quale la SA che di aggiudicazione ed individuato l'aggiudicatario della procedura di gara, sarà possibile chiudere manualmente la gara, senza passare dal contratto. Destinatari notifica: di default, il campo è impostato su Chi ha inviato Quesito/Risposta . In tal caso, a seguito dell'invio di un documento relativo alla procedura di gara, che prevede l'inoltro automatico di comunicazioni, verranno informati tutti gli OE che hanno inviato un quesito e/o offerta. Per informare, invece, i soli OE che hanno inviato offerta, solo al raggiungimento del termine per la presentazione delle offerte, selezionare Partecipanti dopo scadenza termini . Seduta virtuale: definire se attivare o meno le sedute virtuali, che permettono agli OE che hanno presentato offerta di collegarsi e vedere lo stato di avanzamento dell’apertura buste, ammissioni/esclusioni, punteggi, graduatoria. Per maggiori dettagli si faccia riferimento al manuale dedicato alle sedute virtuali. mostrato il campo Numero massimo lotti offerti in cui è possibile indicare il valore limite dei lotti per cui l'operatore economico potrà presentare la propria offerta. Se tale campo viene lasciato incompleto (vuoto), non verrà applicato alcun limite e l'operatore economico potrà partecipare anche a tutti i lotti oggetto della procedura di gara. Inversione delle buste: l’istituto consente di procedere alla valutazione delle buste amministrative successivamente all'apertura e all’esame delle offerte tecniche e/o economiche, ai fini di velocizzare i controlli relativi all’offerta del miglior offerente, nonché eventualmente degli altri partecipanti, circa la verifica dei motivi di esclusione e dei requisiti richiesti e la valutazione della documentazione amministrativa presentata. Il parametro è attivo solo per determinate tipologie di procedura e a determinate condizioni.\n```\n\nFonte: SA_Modulo_Esecuzione_Contratti.pdf - Pagina 46 - Sezione 'CONTRATTI IN ESECUZIONE'\n```\nDi default l’utente abilitato a trasmettere le schede di esecuzione è lo stesso che ha richiesto il CIG ( RUP/Delegato per la fase di affidamento indicato in Testata durante la configurazione della procedura di gara). Qualora l’utente responsabile dell’invio delle schede di esecuzione non sia tale soggetto, ma altro utente, è possibile attivare il Trasferimento affidamento in fase di Esecuzione. selezionare la funzionalità Trasferimento affidamento . l’utente ha attualmente In carico , nonché eventuali affidamenti che gli sono stati assegnati da altri RUP e che avranno lo stato Da prendere in carico . Il box in alto consente di effettuare ricerche per attributi specifici.\n```\n\nFonte: SA_PDA.pdf - Pagina 81 - Sezione 'PROCEDURA DI AGGIUDICAZIONE'\n```\nI destinatari sono di default i primi cinque classificati e non è possibile modificarli. ACCORDO SERVIZIO CHIUSURA Il presente capitolo mostra le indicazioni relative alla chiusura della procedura consentita nel caso di Accordo di Servizio . Attraverso tale accordo, viene affidato all’Ente erogatore il compito di espletare, previa accurata istruttoria, una procedura di gara nel suo complesso fino alla scelta del contraente e ad esclusione della gestione del contratto, in carico all'Ente richiedente (Ente fruitore). L’istituto è assimilabile alla gara su delega. Nel caso di una procedura di gara aperta , negoziata con invito e di un appalto specifico , se in fase di indizione del bando/invito il campo Accordo di Servizio è stato impostato su Sì una volta individuato l'aggiudicatario definitivo della procedura di gara o, nel caso di una procedura multilotto, l’aggiudicatario di ciascun lotto, verrà mostrato nella toolbar dei comandi, nella schermata della procedura, senza che da quest'ultima venga generata una convenzione o stipulato il/i contratto/i. Inserire la Motivazione nell'apposito campo e la Data Chiusura che non dovrà essere superiore alla data corrente. Cliccare infine sul comando Conferma .\n```""]","Un referente fabbisogni, presumibilmente il RUP/Delegato per la fase di affidamento, può delegare la compilazione dei questionari ad altri utenti e monitorarne il progresso tramite le seguenti modalità, basate sulle informazioni estratte dal Knowledge Graph:

1.  **Delega formale tramite la piattaforma:**

    *   **Trasferimento Affidamento in Fase di Esecuzione:** Se l'utente responsabile dell'invio delle schede di esecuzione non è il RUP/Delegato per la fase di affidamento originale, è possibile attivare il ""Trasferimento affidamento in fase di Esecuzione"" (SA\_Modulo\_Esecuzione\_Contratti.pdf). Questa funzionalità permette di delegare la compilazione e trasmissione delle schede PCP (e quindi dei questionari) ad un altro utente.
    *   **Selezione della Funzionalità Trasferimento Affidamento:** All'interno della piattaforma, il RUP/Delegato deve selezionare la funzionalità ""Trasferimento affidamento"" (SA\_Modulo\_Esecuzione\_Contratti.pdf).
    *   **RUP dell'Esecuzione:**  È possibile indicare il RUP dell’esecuzione abilitato a gestire il contratto fino alla conclusione dell’esecuzione. Il trasferimento può avvenire anche nei confronti di un RUP di un altro Ente per consentire la stipula/esecuzione dei contratti derivanti da gare su delega (SA\_Trasferimento\_ProceduraContratto\_altroRUP.pdf).
    *   **Gara su Delega:** Nel caso di gare su delega, la piattaforma permette di allargare la nomina ad utenti di altri enti (SA\_Trasferimento\_ProceduraContratto\_altroRUP.pdf).

2.  **Monitoraggio del Progresso:**

    *   **Tracciamento delle Schede di Esecuzione:** Il RUP può monitorare lo stato di avanzamento delle schede di esecuzione (PCP) per i contratti in esecuzione. La piattaforma indica quali schede sono state inviate (CO1, CO2, S3) e quali sono ancora in attesa di compilazione (SA\_Modulo\_Esecuzione\_Contratti.pdf).
    *   **Cronologia:** La sezione Cronologia registra le operazioni effettuate, inclusi salvataggi e invii di consultazioni, note e allegati (SA\_CPM.pdf). Questo permette di tracciare l'attività degli utenti delegati.
    *   **Notifiche:** Se impostato su ""sì"", è previsto l'invio di un'e-mail di notifica (SA\_IndizioneProceduraGara\_AppaltoSpecifico (1).pdf).

**In sintesi:** Il referente fabbisogni (RUP/Delegato) può delegare la compilazione dei questionari tramite la funzionalità di ""Trasferimento Affidamento in Fase di Esecuzione"", assegnando il compito ad un altro utente (anche di un altro ente in caso di gara su delega). Il monitoraggio del progresso avviene tramite il tracciamento delle schede di esecuzione, la cronologia delle operazioni e le notifiche.","Un referente fabbisogni può delegare la compilazione tramite sub-questionari. All'interno del 'Questionario Fabbisogni', deve accedere alla scheda 'Sub-Questionari'. Lì, deve prima aggiungere gli utenti a cui delegare il compito usando il comando 'Aggiungi'. Una volta definiti gli utenti, per inviare la richiesta deve cliccare sul pulsante 'Invia Sub-Questionari' nella toolbar. Successivamente, dalla stessa scheda, potrà monitorare lo stato di ogni sub-questionario (es. In Lavorazione, Completato, Annullato).",0.75,0.9832834072723866,0.0,0.0
